Description,Quantity,UnitPrice,Revenue,Year,Month,DayOfWeek,Hour,Weekday
12 PENCILS SMALL TUBE SKULL,6,0.65,3.9,2010,December,Tuesday,12 PM,Weekday
3 STRIPEY MICE FELTCRAFT,3,1.95,5.85,2010,December,Tuesday,12 PM,Weekday
3D HEARTS  HONEYCOMB PAPER GARLAND,1,2.95,2.95,2010,December,Tuesday,12 PM,Weekday
AGED GLASS SILVER T-LIGHT HOLDER,24,0.65,15.6,2010,December,Tuesday,12 PM,Weekday
APPLE BATH SPONGE,10,1.25,12.5,2010,December,Tuesday,12 PM,Weekday
ASSORTED COLOUR BIRD ORNAMENT,24,1.69,40.56,2010,December,Tuesday,12 PM,Weekday
BLUE HAPPY BIRTHDAY BUNTING,2,5.45,10.9,2010,December,Tuesday,12 PM,Weekday
CANDLE PLATE LACE WHITE,24,2.55,61.2,2010,December,Tuesday,12 PM,Weekday
CANDLEHOLDER PINK HANGING HEART,9,2.95,26.55,2010,December,Tuesday,12 PM,Weekday
CRAZY DAISY HEART DECORATION,1,1.25,1.25,2010,December,Tuesday,12 PM,Weekday
CREAM SLICE FLANNEL CHOCOLATE SPOT,3,2.95,8.85,2010,December,Tuesday,12 PM,Weekday
CREAM SLICE FLANNEL PINK SPOT,24,2.55,61.2,2010,December,Tuesday,12 PM,Weekday
ENGLISH ROSE SCENTED HANGING FLOWER,1,4.25,4.25,2010,December,Tuesday,12 PM,Weekday
FAIRY CAKE FLANNEL ASSORTED COLOUR,9,2.55,22.95,2010,December,Tuesday,12 PM,Weekday
FELTCRAFT 6 FLOWER FRIENDS,3,2.1,6.3,2010,December,Tuesday,12 PM,Weekday
FELTCRAFT BUTTERFLY HEARTS,4,1.45,5.8,2010,December,Tuesday,12 PM,Weekday
FELTCRAFT CUSHION BUTTERFLY,2,3.75,7.5,2010,December,Tuesday,12 PM,Weekday
FELTCRAFT CUSHION OWL,2,3.75,7.5,2010,December,Tuesday,12 PM,Weekday
FELTCRAFT DOLL EMILY,1,2.95,2.95,2010,December,Tuesday,12 PM,Weekday
FELTCRAFT DOLL MARIA,1,2.95,2.95,2010,December,Tuesday,12 PM,Weekday
FELTCRAFT PRINCESS CHARLOTTE DOLL,1,3.75,3.75,2010,December,Tuesday,12 PM,Weekday
FELTCRAFT PRINCESS CHARLOTTE DOLL,1,3.75,3.75,2010,December,Tuesday,12 PM,Weekday
FELTCRAFT PRINCESS OLIVIA DOLL,2,3.75,7.5,2010,December,Tuesday,12 PM,Weekday
FILIGRIS HEART WITH BUTTERFLY,24,1.25,30.0,2010,December,Tuesday,12 PM,Weekday
FOLKART ZINC HEART CHRISTMAS DEC,12,0.85,10.2,2010,December,Tuesday,12 PM,Weekday
GRAND CHOCOLATECANDLE,18,1.45,26.1,2010,December,Tuesday,12 PM,Weekday
GREY FLORAL FELTCRAFT SHOULDER BAG,1,3.75,3.75,2010,December,Tuesday,12 PM,Weekday
HANGING CHICK CREAM DECORATION,24,1.45,34.8,2010,December,Tuesday,12 PM,Weekday
HANGING FAIRY CAKE DECORATION,10,2.1,21.0,2010,December,Tuesday,12 PM,Weekday
HANGING HEART BASKET,8,2.1,16.8,2010,December,Tuesday,12 PM,Weekday
HANGING METAL STAR LANTERN,12,1.65,19.8,2010,December,Tuesday,12 PM,Weekday
HANGING SPRING FLOWER EGG LARGE,36,0.85,30.6,2010,December,Tuesday,12 PM,Weekday
HAPPY EASTER HANGING DECORATION,13,3.75,48.75,2010,December,Tuesday,12 PM,Weekday
HEART DECORATION PAINTED ZINC,96,0.65,62.4,2010,December,Tuesday,12 PM,Weekday
HEART FILIGREE DOVE  SMALL,48,1.25,60.0,2010,December,Tuesday,12 PM,Weekday
HEART IVORY TRELLIS LARGE,24,1.65,39.6,2010,December,Tuesday,12 PM,Weekday
HEART IVORY TRELLIS SMALL,48,1.25,60.0,2010,December,Tuesday,12 PM,Weekday
IVORY HANGING DECORATION  HEART,24,0.85,20.4,2010,December,Tuesday,12 PM,Weekday
LANTERN CREAM GAZEBO,9,4.95,44.55,2010,December,Tuesday,12 PM,Weekday
LARGE CAKE TOWEL CHOCOLATE SPOTS,3,6.75,20.25,2010,December,Tuesday,12 PM,Weekday
LARGE CAKE TOWEL PINK SPOTS,6,6.75,40.5,2010,December,Tuesday,12 PM,Weekday
MEDIUM MEDINA STAMPED METAL BOWL,6,2.95,17.7,2010,December,Tuesday,12 PM,Weekday
MINI WOODEN HAPPY BIRTHDAY GARLAND,24,1.69,40.56,2010,December,Tuesday,12 PM,Weekday
NINJA RABBIT PINK,10,1.25,12.5,2010,December,Tuesday,12 PM,Weekday
PACK OF 6 SWEETIE GIFT BOXES,6,2.55,15.3,2010,December,Tuesday,12 PM,Weekday
PAPER BUNTING COLOURED LACE,1,2.95,2.95,2010,December,Tuesday,12 PM,Weekday
PAPER BUNTING WHITE LACE,1,2.95,2.95,2010,December,Tuesday,12 PM,Weekday
PAPER CHAIN KIT RETROSPOT,1,2.95,2.95,2010,December,Tuesday,12 PM,Weekday
PAPER CHAIN KIT SKULLS,1,2.95,2.95,2010,December,Tuesday,12 PM,Weekday
PARTY BUNTING,1,4.65,4.65,2010,December,Tuesday,12 PM,Weekday
PINK CREAM FELT CRAFT TRINKET BOX,2,1.25,2.5,2010,December,Tuesday,12 PM,Weekday
PINK FLORAL FELTCRAFT SHOULDER BAG,1,3.75,3.75,2010,December,Tuesday,12 PM,Weekday
PINK HAPPY BIRTHDAY BUNTING,1,5.45,5.45,2010,December,Tuesday,12 PM,Weekday
POPPY'S PLAYHOUSE BATHROOM,1,2.1,2.1,2010,December,Tuesday,12 PM,Weekday
POPPY'S PLAYHOUSE BEDROOM,1,2.1,2.1,2010,December,Tuesday,12 PM,Weekday
POPPY'S PLAYHOUSE KITCHEN,1,2.1,2.1,2010,December,Tuesday,12 PM,Weekday
POPPY'S PLAYHOUSE LIVINGROOM,1,2.1,2.1,2010,December,Tuesday,12 PM,Weekday
RED FLORAL FELTCRAFT SHOULDER BAG,1,3.75,3.75,2010,December,Tuesday,12 PM,Weekday
RED HANGING HEART T-LIGHT HOLDER,16,2.95,47.2,2010,December,Tuesday,12 PM,Weekday
SANDWICH BATH SPONGE,10,1.25,12.5,2010,December,Tuesday,12 PM,Weekday
SKULL AND CROSSBONES  GARLAND,1,1.65,1.65,2010,December,Tuesday,12 PM,Weekday
SMALL MEDINA STAMPED METAL BOWL,24,0.85,20.4,2010,December,Tuesday,12 PM,Weekday
SMALL RED RETROSPOT MUG IN BOX,5,3.75,18.75,2010,December,Tuesday,12 PM,Weekday
SMALL WHITE RETROSPOT MUG IN BOX,5,3.75,18.75,2010,December,Tuesday,12 PM,Weekday
SPACE CADET BLACK,10,1.25,12.5,2010,December,Tuesday,12 PM,Weekday
SPACE CADET RED,10,1.25,12.5,2010,December,Tuesday,12 PM,Weekday
SPACE CADET WHITE,10,1.25,12.5,2010,December,Tuesday,12 PM,Weekday
SPACE FROG,10,1.25,12.5,2010,December,Tuesday,12 PM,Weekday
SPACE OWL,10,1.25,12.5,2010,December,Tuesday,12 PM,Weekday
STRAWBERRY BATH SPONGE,10,1.25,12.5,2010,December,Tuesday,12 PM,Weekday
STRAWBERRY CERAMIC TRINKET BOX,18,1.25,22.5,2010,December,Tuesday,12 PM,Weekday
SWEETHEART CERAMIC TRINKET BOX,8,1.25,10.0,2010,December,Tuesday,12 PM,Weekday
"SWISS ROLL TOWEL, CHOCOLATE  SPOTS",12,2.95,35.4,2010,December,Tuesday,12 PM,Weekday
"SWISS ROLL TOWEL, PINK  SPOTS",12,2.95,35.4,2010,December,Tuesday,12 PM,Weekday
TOAST ITS - DINOSAUR,2,1.25,2.5,2010,December,Tuesday,12 PM,Weekday
TOAST ITS - FAIRY FLOWER,1,1.25,1.25,2010,December,Tuesday,12 PM,Weekday
TOAST ITS - HAPPY BIRTHDAY,5,1.25,6.25,2010,December,Tuesday,12 PM,Weekday
TOAST ITS - I LOVE YOU,1,1.25,1.25,2010,December,Tuesday,12 PM,Weekday
WHITE HANGING HEART T-LIGHT HOLDER,64,2.55,163.2,2010,December,Tuesday,12 PM,Weekday
WHITE HONEYCOMB PAPER GARLAND,2,1.65,3.3,2010,December,Tuesday,12 PM,Weekday
WHITE TALL PORCELAIN T-LIGHT HOLDER,5,2.55,12.75,2010,December,Tuesday,12 PM,Weekday
WOODEN HAPPY BIRTHDAY GARLAND,12,2.95,35.4,2010,December,Tuesday,12 PM,Weekday
ZINC HEART LATTICE T-LIGHT HOLDER,20,1.25,25.0,2010,December,Tuesday,12 PM,Weekday
FRENCH ENAMEL POT W LID,12,1.25,15.0,2011,January,Wednesday,12 PM,Weekday
GINGHAM BABUSHKA DOORSTOP,8,1.25,10.0,2011,January,Wednesday,12 PM,Weekday
METAL SIGN CUPCAKE SINGLE HOOK,20,0.42,8.4,2011,January,Wednesday,12 PM,Weekday
"METAL SIGN,CUPCAKE SINGLE HOOK",20,0.42,8.4,2011,January,Wednesday,12 PM,Weekday
"METAL SIGN,CUPCAKE SINGLE HOOK",20,0.42,8.4,2011,January,Wednesday,12 PM,Weekday
MR ROBOT SOFT TOY,8,1.95,15.6,2011,January,Wednesday,12 PM,Weekday
MRS ROBOT SOFT TOY,8,1.95,15.6,2011,January,Wednesday,12 PM,Weekday
RECIPE BOX PANTRY YELLOW DESIGN,6,2.95,17.7,2011,January,Wednesday,12 PM,Weekday
REGENCY CAKESTAND 3 TIER,6,12.75,76.5,2011,January,Wednesday,12 PM,Weekday
RETROSPOT BABUSHKA DOORSTOP,8,1.25,10.0,2011,January,Wednesday,12 PM,Weekday
SET OF 3 CAKE TINS PANTRY DESIGN,3,4.95,14.85,2011,January,Wednesday,12 PM,Weekday
SET OF 3 CAKE TINS SKETCHBOOK,3,4.95,14.85,2011,January,Wednesday,12 PM,Weekday
TV DINNER TRAY AIR HOSTESS,8,1.95,15.6,2011,January,Wednesday,12 PM,Weekday
VINTAGE BLUE KITCHEN CABINET,1,125.0,125.0,2011,January,Wednesday,12 PM,Weekday
VINTAGE RED KITCHEN CABINET,1,125.0,125.0,2011,January,Wednesday,12 PM,Weekday
WOOD BLACK BOARD ANT WHITE FINISH,12,5.55,66.6,2011,January,Wednesday,12 PM,Weekday
CAKE STAND LOVEBIRD 2 TIER PINK,1,9.95,9.95,2011,February,Monday,1 PM,Weekday
CANDLEHOLDER PINK HANGING HEART,4,2.95,11.8,2011,February,Monday,1 PM,Weekday
CANDLEHOLDER PINK HANGING HEART,5,2.95,14.75,2011,February,Monday,1 PM,Weekday
CERAMIC CAKE STAND + HANGING CAKES,1,9.95,9.95,2011,February,Monday,1 PM,Weekday
CLASSIC METAL BIRDCAGE PLANT HOLDER,3,12.75,38.25,2011,February,Monday,1 PM,Weekday
DANISH ROSE FOLDING CHAIR,1,7.95,7.95,2011,February,Monday,1 PM,Weekday
DOORMAT FAIRY CAKE,1,7.95,7.95,2011,February,Monday,1 PM,Weekday
DOORMAT I LOVE LONDON,1,7.95,7.95,2011,February,Monday,1 PM,Weekday
FRYING PAN PINK POLKADOT,1,4.25,4.25,2011,February,Monday,1 PM,Weekday
REGENCY CAKESTAND 3 TIER,1,12.75,12.75,2011,February,Monday,1 PM,Weekday
WHITE HANGING HEART T-LIGHT HOLDER,8,2.95,23.6,2011,February,Monday,1 PM,Weekday
WOODEN FRAME ANTIQUE WHITE,2,2.95,5.9,2011,February,Monday,1 PM,Weekday
20 DOLLY PEGS RETROSPOT,12,1.25,15.0,2011,February,Monday,2 PM,Weekday
3 TIER CAKE TIN GREEN AND CREAM,2,14.95,29.9,2011,February,Monday,2 PM,Weekday
3 TIER CAKE TIN RED AND CREAM,2,14.95,29.9,2011,February,Monday,2 PM,Weekday
BATH BUILDING BLOCK WORD,3,5.95,17.85,2011,February,Monday,2 PM,Weekday
BLACK KITCHEN SCALES,2,8.5,17.0,2011,February,Monday,2 PM,Weekday
BLUE COAT RACK PARIS FASHION,3,4.95,14.85,2011,February,Monday,2 PM,Weekday
BLUE DINER WALL CLOCK,2,8.5,17.0,2011,February,Monday,2 PM,Weekday
BLUE GIANT GARDEN THERMOMETER,2,5.95,11.9,2011,February,Monday,2 PM,Weekday
BOX OF VINTAGE JIGSAW BLOCKS,3,4.95,14.85,2011,February,Monday,2 PM,Weekday
BREAD BIN DINER STYLE IVORY,2,16.95,33.9,2011,February,Monday,2 PM,Weekday
BREAD BIN DINER STYLE MINT,2,16.95,33.9,2011,February,Monday,2 PM,Weekday
BREAD BIN DINER STYLE RED,2,16.95,33.9,2011,February,Monday,2 PM,Weekday
BROCANTE COAT RACK,1,9.95,9.95,2011,February,Monday,2 PM,Weekday
CAT BOWL VINTAGE CREAM,6,3.25,19.5,2011,February,Monday,2 PM,Weekday
CHILDS BREAKFAST SET CIRCUS PARADE,2,8.5,17.0,2011,February,Monday,2 PM,Weekday
DOCTOR'S BAG SOFT TOY,1,8.95,8.95,2011,February,Monday,2 PM,Weekday
DOG BOWL VINTAGE CREAM,4,4.25,17.0,2011,February,Monday,2 PM,Weekday
DOORMAT FAIRY CAKE,2,7.95,15.9,2011,February,Monday,2 PM,Weekday
DOORMAT WELCOME TO OUR HOME,2,7.95,15.9,2011,February,Monday,2 PM,Weekday
EASTER TIN CHICKS PINK DAISY,6,1.65,9.9,2011,February,Monday,2 PM,Weekday
EASTER TIN KEEPSAKE,6,1.65,9.9,2011,February,Monday,2 PM,Weekday
EMERGENCY FIRST AID TIN,12,1.25,15.0,2011,February,Monday,2 PM,Weekday
EMPIRE UNION JACK TV DINNER TRAY,3,4.95,14.85,2011,February,Monday,2 PM,Weekday
ENAMEL BLUE RIM BISCUIT BIN,3,4.95,14.85,2011,February,Monday,2 PM,Weekday
FRYING PAN RED RETROSPOT,4,4.25,17.0,2011,February,Monday,2 PM,Weekday
FRYING PAN UNION FLAG,4,4.25,17.0,2011,February,Monday,2 PM,Weekday
GAOLERS KEYS DECORATIVE GARDEN,4,3.75,15.0,2011,February,Monday,2 PM,Weekday
GREEN GIANT GARDEN THERMOMETER,2,5.95,11.9,2011,February,Monday,2 PM,Weekday
GREEN REGENCY TEACUP AND SAUCER,6,2.95,17.7,2011,February,Monday,2 PM,Weekday
HERB MARKER BASIL,12,0.65,7.8,2011,February,Monday,2 PM,Weekday
HERB MARKER MINT,12,0.65,7.8,2011,February,Monday,2 PM,Weekday
HERB MARKER PARSLEY,12,0.65,7.8,2011,February,Monday,2 PM,Weekday
HERB MARKER ROSEMARY,12,0.65,7.8,2011,February,Monday,2 PM,Weekday
HERB MARKER THYME,12,0.65,7.8,2011,February,Monday,2 PM,Weekday
HOME BUILDING BLOCK WORD,3,5.95,17.85,2011,February,Monday,2 PM,Weekday
IVORY GIANT GARDEN THERMOMETER,2,5.95,11.9,2011,February,Monday,2 PM,Weekday
IVORY KITCHEN SCALES,2,8.5,17.0,2011,February,Monday,2 PM,Weekday
JAM JAR WITH GREEN LID,12,0.85,10.2,2011,February,Monday,2 PM,Weekday
JAM JAR WITH PINK LID,12,0.85,10.2,2011,February,Monday,2 PM,Weekday
JAM MAKING SET PRINTED,12,1.45,17.4,2011,February,Monday,2 PM,Weekday
JAM MAKING SET WITH JARS,6,4.25,25.5,2011,February,Monday,2 PM,Weekday
JUMBO BAG SPACEBOY DESIGN,10,1.95,19.5,2011,February,Monday,2 PM,Weekday
JUMBO SHOPPER VINTAGE RED PAISLEY,10,1.95,19.5,2011,February,Monday,2 PM,Weekday
JUMBO STORAGE BAG SUKI,10,1.95,19.5,2011,February,Monday,2 PM,Weekday
LOVE BUILDING BLOCK WORD,3,5.95,17.85,2011,February,Monday,2 PM,Weekday
LUNCH BOX I LOVE LONDON,12,1.95,23.4,2011,February,Monday,2 PM,Weekday
MA CAMPAGNE CUTLERY BOX,1,14.95,14.95,2011,February,Monday,2 PM,Weekday
MINT KITCHEN SCALES,2,8.5,17.0,2011,February,Monday,2 PM,Weekday
NURSE'S BAG SOFT TOY,1,8.95,8.95,2011,February,Monday,2 PM,Weekday
PACK OF 12 LONDON TISSUES,24,0.29,6.96,2011,February,Monday,2 PM,Weekday
PARTY BUNTING,5,4.65,23.25,2011,February,Monday,2 PM,Weekday
PEG BAG APPLES DESIGN,6,2.55,15.3,2011,February,Monday,2 PM,Weekday
PICNIC BASKET WICKER LARGE,2,9.95,19.9,2011,February,Monday,2 PM,Weekday
PICNIC BASKET WICKER SMALL,4,5.95,23.8,2011,February,Monday,2 PM,Weekday
PLASTERS IN TIN CIRCUS PARADE,12,1.65,19.8,2011,February,Monday,2 PM,Weekday
PLASTERS IN TIN STRONGMAN,12,1.65,19.8,2011,February,Monday,2 PM,Weekday
RECIPE BOX BLUE SKETCHBOOK DESIGN,6,2.95,17.7,2011,February,Monday,2 PM,Weekday
RECIPE BOX PANTRY YELLOW DESIGN,6,2.95,17.7,2011,February,Monday,2 PM,Weekday
RED DINER WALL CLOCK,2,8.5,17.0,2011,February,Monday,2 PM,Weekday
RED KITCHEN SCALES,2,8.5,17.0,2011,February,Monday,2 PM,Weekday
ROSES REGENCY TEACUP AND SAUCER,6,2.95,17.7,2011,February,Monday,2 PM,Weekday
ROUND CAKE TIN VINTAGE GREEN,2,7.95,15.9,2011,February,Monday,2 PM,Weekday
ROUND CAKE TIN VINTAGE RED,2,7.95,15.9,2011,February,Monday,2 PM,Weekday
RUSTIC  SEVENTEEN DRAWER SIDEBOARD,2,145.0,290.0,2011,February,Monday,2 PM,Weekday
SET 2 TEA TOWELS I LOVE LONDON,6,2.95,17.7,2011,February,Monday,2 PM,Weekday
SET OF 6 SPICE TINS PANTRY DESIGN,4,3.95,15.8,2011,February,Monday,2 PM,Weekday
SPACEBOY TV DINNER TRAY,3,4.95,14.85,2011,February,Monday,2 PM,Weekday
SWEETHEART CAKESTAND 3 TIER,4,9.95,39.8,2011,February,Monday,2 PM,Weekday
SWEETHEART WIRE FRUIT BOWL,4,8.5,34.0,2011,February,Monday,2 PM,Weekday
TRAVEL SEWING KIT,10,1.65,16.5,2011,February,Monday,2 PM,Weekday
TV DINNER TRAY DOLLY GIRL,3,4.95,14.85,2011,February,Monday,2 PM,Weekday
VINTAGE BLUE KITCHEN CABINET,1,125.0,125.0,2011,February,Monday,2 PM,Weekday
VINTAGE CREAM CAT FOOD CONTAINER,2,6.35,12.7,2011,February,Monday,2 PM,Weekday
VINTAGE CREAM DOG FOOD CONTAINER,2,8.5,17.0,2011,February,Monday,2 PM,Weekday
VINTAGE RED KITCHEN CABINET,1,125.0,125.0,2011,February,Monday,2 PM,Weekday
VINTAGE SNAKES & LADDERS,4,3.75,15.0,2011,February,Monday,2 PM,Weekday
VINTAGE SNAP CARDS,12,0.85,10.2,2011,February,Monday,2 PM,Weekday
WRAP ALPHABET DESIGN,25,0.42,10.5,2011,February,Monday,2 PM,Weekday
WRAP WEDDING DAY,25,0.42,10.5,2011,February,Monday,2 PM,Weekday
YELLOW COAT RACK PARIS FASHION,3,4.95,14.85,2011,February,Monday,2 PM,Weekday
AGED GLASS SILVER T-LIGHT HOLDER,72,0.65,46.8,2011,February,Wednesday,9 AM,Weekday
ASSORTED COLOUR T-LIGHT HOLDER,96,0.55,52.8,2011,February,Wednesday,9 AM,Weekday
BEADED PEARL HEART WHITE ON STICK,48,1.25,60.0,2011,February,Wednesday,9 AM,Weekday
BIRDCAGE DECORATION TEALIGHT HOLDER,96,1.06,101.76,2011,February,Wednesday,9 AM,Weekday
BLACK HEART CARD HOLDER,4,3.95,15.8,2011,February,Wednesday,9 AM,Weekday
BLUE COAT RACK PARIS FASHION,3,4.95,14.85,2011,February,Wednesday,9 AM,Weekday
CANDLEHOLDER PINK HANGING HEART,32,2.55,81.6,2011,February,Wednesday,9 AM,Weekday
CERAMIC CAKE BOWL + HANGING CAKES,6,2.95,17.7,2011,February,Wednesday,9 AM,Weekday
CERAMIC CAKE STAND + HANGING CAKES,8,8.5,68.0,2011,February,Wednesday,9 AM,Weekday
CHERRY BLOSSOM  DECORATIVE FLASK,8,3.75,30.0,2011,February,Wednesday,9 AM,Weekday
CHERRY BLOSSOM DECORATIVE FLASK,8,3.75,30.0,2011,February,Wednesday,9 AM,Weekday
COLOUR GLASS T-LIGHT HOLDER HANGING,64,0.65,41.6,2011,February,Wednesday,9 AM,Weekday
CREAM HEART CARD HOLDER,12,3.95,47.4,2011,February,Wednesday,9 AM,Weekday
FINE WICKER HEART,48,1.06,50.88,2011,February,Wednesday,9 AM,Weekday
FIVE CATS HANGING DECORATION,6,2.95,17.7,2011,February,Wednesday,9 AM,Weekday
GINGHAM HEART DECORATION,48,0.85,40.8,2011,February,Wednesday,9 AM,Weekday
HANGING HEART MIRROR DECORATION,48,0.65,31.2,2011,February,Wednesday,9 AM,Weekday
HANGING HEART ZINC T-LIGHT HOLDER,48,0.85,40.8,2011,February,Wednesday,9 AM,Weekday
HANGING JAM JAR T-LIGHT HOLDER,96,0.72,69.12,2011,February,Wednesday,9 AM,Weekday
HEART DECORATION PAINTED ZINC,288,0.55,158.4,2011,February,Wednesday,9 AM,Weekday
MULTICOLOUR HONEYCOMB FAN,24,1.65,39.6,2011,February,Wednesday,9 AM,Weekday
MULTICOLOUR HONEYCOMB PAPER GARLAND,12,1.65,19.8,2011,February,Wednesday,9 AM,Weekday
MUSICAL ZINC HEART DECORATION,48,0.85,40.8,2011,February,Wednesday,9 AM,Weekday
PASTEL COLOUR HONEYCOMB FAN,24,1.65,39.6,2011,February,Wednesday,9 AM,Weekday
PINK  HONEYCOMB PAPER BALL,24,2.1,50.4,2011,February,Wednesday,9 AM,Weekday
PINK  HONEYCOMB PAPER FAN,24,2.1,50.4,2011,February,Wednesday,9 AM,Weekday
PINK PADDED MOBILE,6,4.25,25.5,2011,February,Wednesday,9 AM,Weekday
PLACE SETTING WHITE HEART,72,0.42,30.24,2011,February,Wednesday,9 AM,Weekday
POMPOM CURTAIN,4,6.95,27.8,2011,February,Wednesday,9 AM,Weekday
RED COAT RACK PARIS FASHION,3,4.95,14.85,2011,February,Wednesday,9 AM,Weekday
RETROSPOT WOODEN HEART DECORATION,48,0.85,40.8,2011,February,Wednesday,9 AM,Weekday
SET OF 36 PAISLEY FLOWER DOILIES,12,1.45,17.4,2011,February,Wednesday,9 AM,Weekday
SET OF 4 ENGLISH ROSE COASTERS,10,1.25,12.5,2011,February,Wednesday,9 AM,Weekday
SET OF 6 CAKE CHOPSTICKS,12,1.25,15.0,2011,February,Wednesday,9 AM,Weekday
SET OF 6 HEART CHOPSTICKS,12,1.25,15.0,2011,February,Wednesday,9 AM,Weekday
SET OF 72 PINK HEART PAPER DOILIES,12,1.45,17.4,2011,February,Wednesday,9 AM,Weekday
TEA TIME DES TEA COSY,6,2.55,15.3,2011,February,Wednesday,9 AM,Weekday
WHITE HANGING HEART T-LIGHT HOLDER,32,2.55,81.6,2011,February,Wednesday,9 AM,Weekday
WHITE JEWELLED HEART DECORATION,48,0.85,40.8,2011,February,Wednesday,9 AM,Weekday
WHITE SOAP RACK WITH 2 BOTTLES,2,5.95,11.9,2011,February,Wednesday,9 AM,Weekday
ZINC METAL HEART DECORATION,48,1.25,60.0,2011,February,Wednesday,9 AM,Weekday
POSTAGE,1,15.0,15.0,2011,February,Thursday,5 PM,Weekday
ANT WHITE WIRE HEART SPIRAL,5,3.95,19.75,2011,February,Monday,1 PM,Weekday
ASSORTED BOTTLE TOP  MAGNETS,12,0.42,5.04,2011,February,Monday,1 PM,Weekday
BIRDHOUSE GARDEN MARKER,10,1.25,12.5,2011,February,Monday,1 PM,Weekday
CREAM SLICE FLANNEL CHOCOLATE SPOT,6,2.95,17.7,2011,February,Monday,1 PM,Weekday
CREAM SLICE FLANNEL PINK SPOT,6,2.95,17.7,2011,February,Monday,1 PM,Weekday
GREEN REGENCY TEACUP AND SAUCER,6,2.95,17.7,2011,February,Monday,1 PM,Weekday
HANGING GLASS ETCHED TEALIGHT,6,1.65,9.9,2011,February,Monday,1 PM,Weekday
PACK OF 6 BIRDY GIFT TAGS,12,1.25,15.0,2011,February,Monday,1 PM,Weekday
PARTY CONES CANDY ASSORTED,12,1.25,15.0,2011,February,Monday,1 PM,Weekday
PINK CREAM FELT CRAFT TRINKET BOX,12,1.25,15.0,2011,February,Monday,1 PM,Weekday
PINK REGENCY TEACUP AND SAUCER,6,2.95,17.7,2011,February,Monday,1 PM,Weekday
REGENCY CAKESTAND 3 TIER,1,12.75,12.75,2011,February,Monday,1 PM,Weekday
ROSES REGENCY TEACUP AND SAUCER,6,2.95,17.7,2011,February,Monday,1 PM,Weekday
SET OF 36 PAISLEY FLOWER DOILIES,12,1.45,17.4,2011,February,Monday,1 PM,Weekday
SET OF 36 TEATIME PAPER DOILIES,12,1.45,17.4,2011,February,Monday,1 PM,Weekday
SET/3 ROSE CANDLE IN JEWELLED BOX,4,4.25,17.0,2011,February,Monday,1 PM,Weekday
SPOTTY PINK DUCK DOORSTOP,3,4.25,12.75,2011,February,Monday,1 PM,Weekday
TOAST ITS - FAIRY FLOWER,12,1.25,15.0,2011,February,Monday,1 PM,Weekday
TOAST ITS - HAPPY BIRTHDAY,12,1.25,15.0,2011,February,Monday,1 PM,Weekday
TOAST ITS - I LOVE YOU,12,1.25,15.0,2011,February,Monday,1 PM,Weekday
WHITE LOVEBIRD LANTERN,6,2.95,17.7,2011,February,Monday,1 PM,Weekday
Manual,1,320.69,320.69,2011,February,Monday,2 PM,Weekday
ASSORTED EASTER GIFT TAGS,12,0.85,10.2,2011,March,Thursday,12 PM,Weekday
BOYS ALPHABET IRON ON PATCHES,288,0.21,60.48,2011,March,Thursday,12 PM,Weekday
BUNNY WOODEN PAINTED WITH FLOWER,12,0.85,10.2,2011,March,Thursday,12 PM,Weekday
CHERRY BLOSSOM LUGGAGE TAG,12,1.25,15.0,2011,March,Thursday,12 PM,Weekday
CHILDRENS GARDEN GLOVES BLUE,10,1.25,12.5,2011,March,Thursday,12 PM,Weekday
CHILDRENS GARDEN GLOVES PINK,10,1.25,12.5,2011,March,Thursday,12 PM,Weekday
CHILDS GARDEN FORK BLUE,12,0.85,10.2,2011,March,Thursday,12 PM,Weekday
CHILDS GARDEN FORK PINK,12,0.85,10.2,2011,March,Thursday,12 PM,Weekday
CHILDS GARDEN TROWEL BLUE,12,0.85,10.2,2011,March,Thursday,12 PM,Weekday
CHILDS GARDEN TROWEL PINK,12,0.85,10.2,2011,March,Thursday,12 PM,Weekday
DOCTOR'S BAG SOFT TOY,6,8.95,53.7,2011,March,Thursday,12 PM,Weekday
EASTER CRAFT 4 CHICKS,12,1.95,23.4,2011,March,Thursday,12 PM,Weekday
FAIRY CAKE BIRTHDAY CANDLE SET,20,3.75,75.0,2011,March,Thursday,12 PM,Weekday
FAIRY CAKE FLANNEL ASSORTED COLOUR,9,2.55,22.95,2011,March,Thursday,12 PM,Weekday
FELTCRAFT CUSHION BUTTERFLY,4,3.75,15.0,2011,March,Thursday,12 PM,Weekday
FELTCRAFT CUSHION OWL,4,3.75,15.0,2011,March,Thursday,12 PM,Weekday
FELTCRAFT CUSHION RABBIT,4,3.75,15.0,2011,March,Thursday,12 PM,Weekday
FELTCRAFT DOLL EMILY,6,2.95,17.7,2011,March,Thursday,12 PM,Weekday
FELTCRAFT DOLL MARIA,6,2.95,17.7,2011,March,Thursday,12 PM,Weekday
FELTCRAFT DOLL MOLLY,6,2.95,17.7,2011,March,Thursday,12 PM,Weekday
FELTCRAFT DOLL ROSIE,6,2.95,17.7,2011,March,Thursday,12 PM,Weekday
FELTCRAFT HAIRBAND PINK AND PURPLE,24,0.85,20.4,2011,March,Thursday,12 PM,Weekday
FELTCRAFT HAIRBANDS PINK AND WHITE,24,0.85,20.4,2011,March,Thursday,12 PM,Weekday
FELTCRAFT PRINCESS CHARLOTTE DOLL,4,3.75,15.0,2011,March,Thursday,12 PM,Weekday
FELTCRAFT PRINCESS LOLA DOLL,4,3.75,15.0,2011,March,Thursday,12 PM,Weekday
FELTCRAFT PRINCESS OLIVIA DOLL,4,3.75,15.0,2011,March,Thursday,12 PM,Weekday
FIRST CLASS LUGGAGE TAG,12,1.25,15.0,2011,March,Thursday,12 PM,Weekday
GIRLS ALPHABET IRON ON PATCHES,288,0.21,60.48,2011,March,Thursday,12 PM,Weekday
GREY FLORAL FELTCRAFT SHOULDER BAG,4,3.75,15.0,2011,March,Thursday,12 PM,Weekday
JIGSAW RABBIT AND BIRDHOUSE,12,1.65,19.8,2011,March,Thursday,12 PM,Weekday
JIGSAW TREE WITH BIRDHOUSE,12,1.45,17.4,2011,March,Thursday,12 PM,Weekday
JIGSAW TREE WITH WATERING CAN,12,0.85,10.2,2011,March,Thursday,12 PM,Weekday
LANTERN CREAM GAZEBO,6,4.95,29.7,2011,March,Thursday,12 PM,Weekday
LARGE CAKE TOWEL PINK SPOTS,2,6.75,13.5,2011,March,Thursday,12 PM,Weekday
LARGE HANGING IVORY & RED WOOD BIRD,12,0.65,7.8,2011,March,Thursday,12 PM,Weekday
LIGHT GARLAND BUTTERFILES PINK,4,4.25,17.0,2011,March,Thursday,12 PM,Weekday
PINK FLORAL FELTCRAFT SHOULDER BAG,4,3.75,15.0,2011,March,Thursday,12 PM,Weekday
RED FLORAL FELTCRAFT SHOULDER BAG,4,3.75,15.0,2011,March,Thursday,12 PM,Weekday
RED RETROSPOT LUGGAGE TAG,12,1.25,15.0,2011,March,Thursday,12 PM,Weekday
SMALL HANGING IVORY/RED WOOD BIRD,24,0.42,10.08,2011,March,Thursday,12 PM,Weekday
THREE CANVAS LUGGAGE TAGS,8,1.95,15.6,2011,March,Thursday,12 PM,Weekday
TOOL BOX SOFT TOY,4,8.95,35.8,2011,March,Thursday,12 PM,Weekday
WATERING CAN GARDEN MARKER,10,1.25,12.5,2011,March,Thursday,12 PM,Weekday
WHITE LOVEBIRD LANTERN,6,2.95,17.7,2011,March,Thursday,12 PM,Weekday
WHITE TALL PORCELAIN T-LIGHT HOLDER,6,2.55,15.3,2011,March,Thursday,12 PM,Weekday
WHITE/PINK CHICK DECORATION,12,1.25,15.0,2011,March,Thursday,12 PM,Weekday
WHITE/PINK CHICK EASTER DECORATION,12,0.85,10.2,2011,March,Thursday,12 PM,Weekday
WOODEN OWLS LIGHT GARLAND,4,4.25,17.0,2011,March,Thursday,12 PM,Weekday
ABC TREASURE BOOK BOX,8,2.25,18.0,2011,June,Friday,12 PM,Weekday
BUNDLE OF 3 RETRO NOTE BOOKS,12,1.65,19.8,2011,June,Friday,12 PM,Weekday
DOORMAT KEEP CALM AND COME IN,4,7.95,31.8,2011,June,Friday,12 PM,Weekday
DOORMAT RESPECTABLE HOUSE,6,7.95,47.7,2011,June,Friday,12 PM,Weekday
DOORMAT VINTAGE LEAVES DESIGN,2,7.95,15.9,2011,June,Friday,12 PM,Weekday
FELTCRAFT GIRL AMELIE KIT,4,4.95,19.8,2011,June,Friday,12 PM,Weekday
FIRST AID TIN,6,3.25,19.5,2011,June,Friday,12 PM,Weekday
FRENCH STYLE EMBOSSED HEART CABINET,1,21.95,21.95,2011,June,Friday,12 PM,Weekday
FULL ENGLISH BREAKFAST PLATE,12,3.75,45.0,2011,June,Friday,12 PM,Weekday
GIRAFFE WOODEN RULER,12,1.95,23.4,2011,June,Friday,12 PM,Weekday
GYMKHANA TREASURE BOOK BOX,8,2.25,18.0,2011,June,Friday,12 PM,Weekday
JUMBO  BAG BAROQUE BLACK WHITE,10,2.08,20.8,2011,June,Friday,12 PM,Weekday
JUMBO BAG ALPHABET,10,2.08,20.8,2011,June,Friday,12 PM,Weekday
JUMBO BAG APPLES,10,2.08,20.8,2011,June,Friday,12 PM,Weekday
JUMBO BAG VINTAGE LEAF,10,2.08,20.8,2011,June,Friday,12 PM,Weekday
LUNCH BAG APPLE DESIGN,10,1.65,16.5,2011,June,Friday,12 PM,Weekday
LUNCH BAG VINTAGE LEAF DESIGN,10,1.65,16.5,2011,June,Friday,12 PM,Weekday
NO SINGING METAL SIGN,12,2.1,25.2,2011,June,Friday,12 PM,Weekday
OPEN CLOSED METAL SIGN,6,4.95,29.7,2011,June,Friday,12 PM,Weekday
PACK OF 20 NAPKINS PANTRY DESIGN,12,0.85,10.2,2011,June,Friday,12 PM,Weekday
PACK OF 20 NAPKINS RED APPLES,12,0.85,10.2,2011,June,Friday,12 PM,Weekday
PARISIENNE KEY CABINET,2,5.75,11.5,2011,June,Friday,12 PM,Weekday
PHARMACIE FIRST AID TIN,4,6.75,27.0,2011,June,Friday,12 PM,Weekday
PICNIC BASKET WICKER LARGE,4,9.95,39.8,2011,June,Friday,12 PM,Weekday
RECYCLED ACAPULCO MAT BLUE,2,8.25,16.5,2011,June,Friday,12 PM,Weekday
RECYCLED ACAPULCO MAT GREEN,2,8.25,16.5,2011,June,Friday,12 PM,Weekday
RECYCLED ACAPULCO MAT LAVENDER,2,8.25,16.5,2011,June,Friday,12 PM,Weekday
RECYCLED ACAPULCO MAT PINK,2,8.25,16.5,2011,June,Friday,12 PM,Weekday
RECYCLED ACAPULCO MAT RED,2,8.25,16.5,2011,June,Friday,12 PM,Weekday
RECYCLED ACAPULCO MAT TURQUOISE,2,8.25,16.5,2011,June,Friday,12 PM,Weekday
RED RETROSPOT CAKE STAND,2,10.95,21.9,2011,June,Friday,12 PM,Weekday
REGENCY CAKESTAND 3 TIER,8,12.75,102.0,2011,June,Friday,12 PM,Weekday
REGENCY MILK JUG PINK,6,3.25,19.5,2011,June,Friday,12 PM,Weekday
REGENCY SUGAR BOWL GREEN,6,4.15,24.9,2011,June,Friday,12 PM,Weekday
REGENCY TEA PLATE GREEN,12,1.65,19.8,2011,June,Friday,12 PM,Weekday
REGENCY TEA PLATE PINK,12,1.65,19.8,2011,June,Friday,12 PM,Weekday
REGENCY TEA PLATE ROSES,12,1.65,19.8,2011,June,Friday,12 PM,Weekday
REGENCY TEA STRAINER,4,3.75,15.0,2011,June,Friday,12 PM,Weekday
REGENCY TEAPOT ROSES,4,9.95,39.8,2011,June,Friday,12 PM,Weekday
ROSES REGENCY TEACUP AND SAUCER,6,2.95,17.7,2011,June,Friday,12 PM,Weekday
SET OF 4 PANTRY JELLY MOULDS,24,1.25,30.0,2011,June,Friday,12 PM,Weekday
SPOTTY BUNTING,3,4.95,14.85,2011,June,Friday,12 PM,Weekday
TOILET SIGN OCCUPIED OR VACANT,24,0.83,19.92,2011,June,Friday,12 PM,Weekday
TRAVEL SEWING KIT,10,1.65,16.5,2011,June,Friday,12 PM,Weekday
TREASURE ISLAND BOOK BOX,8,2.25,18.0,2011,June,Friday,12 PM,Weekday
