Description,Quantity,UnitPrice,Revenue,Year,Month,DayOfWeek,Hour,Weekday
WATERING CAN GARDEN MARKER,10,1.25,12.5,2011,June,Friday,12 PM,Weekday
WOOD BLACK BOARD ANT WHITE FINISH,6,7.95,47.7,2011,June,Friday,12 PM,Weekday
EDWARDIAN PARASOL NATURAL,33,5.95,196.35,2011,September,Monday,9 AM,Weekday
EDWARDIAN PARASOL NATURAL,33,5.95,196.35,2011,February,Tuesday,1 PM,Weekday
ASSORTED COLOUR MINI CASES,4,7.95,31.8,2011,February,Friday,8 AM,Weekday
ASSORTED TUTTI FRUTTI SMALL PURSE,24,1.25,30.0,2011,February,Friday,8 AM,Weekday
BAKING SET 9 PIECE RETROSPOT,3,4.95,14.85,2011,February,Friday,8 AM,Weekday
BISCUIT TIN 50'S CHRISTMAS,12,2.89,34.68,2011,February,Friday,8 AM,Weekday
CERAMIC CAKE STAND + HANGING CAKES,2,9.95,19.9,2011,February,Friday,8 AM,Weekday
FOOD COVER WITH BEADS SET 2,6,3.75,22.5,2011,February,Friday,8 AM,Weekday
HANGING WOOD AND FELT BUTTERFLY,24,0.42,10.08,2011,February,Friday,8 AM,Weekday
HANGING WOOD AND FELT FLOWER,96,0.12,11.52,2011,February,Friday,8 AM,Weekday
LARGE CAKE STAND  HANGING STRAWBERY,4,9.95,39.8,2011,February,Friday,8 AM,Weekday
LOVE HEART TRINKET POT,48,0.39,18.72,2011,February,Friday,8 AM,Weekday
MINI CAKE STAND  HANGING STRAWBERY,8,1.65,13.2,2011,February,Friday,8 AM,Weekday
MINI CAKE STAND WITH HANGING CAKES,8,1.45,11.6,2011,February,Friday,8 AM,Weekday
NOVELTY BISCUITS CAKE STAND 3 TIER,2,9.95,19.9,2011,February,Friday,8 AM,Weekday
PARTY CONES CANDY ASSORTED,24,1.25,30.0,2011,February,Friday,8 AM,Weekday
PARTY CONES CANDY DECORATION,12,0.85,10.2,2011,February,Friday,8 AM,Weekday
PIN CUSHION BABUSHKA PINK,6,3.35,20.1,2011,February,Friday,8 AM,Weekday
PIN CUSHION BABUSHKA RED,6,3.35,20.1,2011,February,Friday,8 AM,Weekday
POPCORN HOLDER,12,0.85,10.2,2011,February,Friday,8 AM,Weekday
RED RETROSPOT MINI CASES,4,7.95,31.8,2011,February,Friday,8 AM,Weekday
REGENCY CAKESTAND 3 TIER,1,12.75,12.75,2011,February,Friday,8 AM,Weekday
ROUND STORAGE TIN VINTAGE LEAF,6,1.95,11.7,2011,February,Friday,8 AM,Weekday
SET OF 2 TINS JARDIN DE PROVENCE,4,4.95,19.8,2011,February,Friday,8 AM,Weekday
SET OF 3 CAKE TINS PANTRY DESIGN,3,4.95,14.85,2011,February,Friday,8 AM,Weekday
SET OF 3 CAKE TINS SKETCHBOOK,3,4.95,14.85,2011,February,Friday,8 AM,Weekday
SET OF 3 REGENCY CAKE TINS,4,4.95,19.8,2011,February,Friday,8 AM,Weekday
SET/3 DECOUPAGE STACKING TINS,3,4.95,14.85,2011,February,Friday,8 AM,Weekday
SEWING BOX RETROSPOT DESIGN,2,16.95,33.9,2011,February,Friday,8 AM,Weekday
STORAGE TIN VINTAGE DOILY,6,2.89,17.34,2011,February,Friday,8 AM,Weekday
STRAWBERRY FAIRY CAKE TEAPOT,8,4.95,39.6,2011,February,Friday,8 AM,Weekday
ALARM CLOCK BAKELIKE CHOCOLATE,4,3.75,15.0,2011,February,Thursday,12 PM,Weekday
ALARM CLOCK BAKELIKE GREEN,4,3.75,15.0,2011,February,Thursday,12 PM,Weekday
ALARM CLOCK BAKELIKE PINK,4,3.75,15.0,2011,February,Thursday,12 PM,Weekday
ALARM CLOCK BAKELIKE RED,4,3.75,15.0,2011,February,Thursday,12 PM,Weekday
BLACK KITCHEN SCALES,2,8.5,17.0,2011,February,Thursday,12 PM,Weekday
BREAD BIN DINER STYLE IVORY,1,16.95,16.95,2011,February,Thursday,12 PM,Weekday
BREAD BIN DINER STYLE RED,1,16.95,16.95,2011,February,Thursday,12 PM,Weekday
CHEST OF DRAWERS GINGHAM HEART,4,16.95,67.8,2011,February,Thursday,12 PM,Weekday
COOK WITH WINE METAL SIGN,12,2.08,24.96,2011,February,Thursday,12 PM,Weekday
DAIRY MAID TRADITIONAL TEAPOT,2,6.95,13.9,2011,February,Thursday,12 PM,Weekday
DOLLY GIRL BEAKER,12,1.25,15.0,2011,February,Thursday,12 PM,Weekday
DOLLY GIRL MINI BACKPACK,4,4.15,16.6,2011,February,Thursday,12 PM,Weekday
DOORMAT FANCY FONT HOME SWEET HOME,2,7.95,15.9,2011,February,Thursday,12 PM,Weekday
DOORMAT HOME SWEET HOME BLUE,2,7.95,15.9,2011,February,Thursday,12 PM,Weekday
DOORMAT KEEP CALM AND COME IN,2,8.25,16.5,2011,February,Thursday,12 PM,Weekday
FOOT STOOL HOME SWEET HOME,2,9.95,19.9,2011,February,Thursday,12 PM,Weekday
FULL ENGLISH BREAKFAST PLATE,4,3.75,15.0,2011,February,Thursday,12 PM,Weekday
FUNKY WASHING UP GLOVES ASSORTED,12,2.1,25.2,2011,February,Thursday,12 PM,Weekday
GAOLERS KEYS DECORATIVE GARDEN,4,3.75,15.0,2011,February,Thursday,12 PM,Weekday
GARDENERS KNEELING PAD KEEP CALM,12,1.65,19.8,2011,February,Thursday,12 PM,Weekday
GINGHAM RECIPE BOOK BOX,4,4.95,19.8,2011,February,Thursday,12 PM,Weekday
GLASS  SONGBIRD STORAGE JAR,4,12.5,50.0,2011,February,Thursday,12 PM,Weekday
GLASS APOTHECARY BOTTLE PERFUME,4,3.95,15.8,2011,February,Thursday,12 PM,Weekday
GLASS APOTHECARY BOTTLE TONIC,4,3.95,15.8,2011,February,Thursday,12 PM,Weekday
GLASS BONNE JAM JAR,4,4.15,16.6,2011,February,Thursday,12 PM,Weekday
GLASS CLOCHE SMALL,8,3.95,31.6,2011,February,Thursday,12 PM,Weekday
GREEN REGENCY TEACUP AND SAUCER,6,2.95,17.7,2011,February,Thursday,12 PM,Weekday
HOME SWEET HOME BLACKBOARD,6,4.95,29.7,2011,February,Thursday,12 PM,Weekday
HOT WATER BOTTLE KEEP CALM,8,4.95,39.6,2011,February,Thursday,12 PM,Weekday
I LOVE LONDON MINI BACKPACK,4,4.15,16.6,2011,February,Thursday,12 PM,Weekday
IVORY REFECTORY CLOCK,2,9.95,19.9,2011,February,Thursday,12 PM,Weekday
JUMBO BAG APPLES,10,2.08,20.8,2011,February,Thursday,12 PM,Weekday
JUMBO BAG PEARS,10,2.08,20.8,2011,February,Thursday,12 PM,Weekday
JUMBO BAG RED RETROSPOT,10,2.08,20.8,2011,February,Thursday,12 PM,Weekday
JUMBO BAG STRAWBERRY,10,2.08,20.8,2011,February,Thursday,12 PM,Weekday
JUMBO STORAGE BAG SUKI,10,2.08,20.8,2011,February,Thursday,12 PM,Weekday
KNEELING MAT HOUSEWORK  DESIGN,12,1.65,19.8,2011,February,Thursday,12 PM,Weekday
LE GRAND TRAY CHIC SET,4,12.5,50.0,2011,February,Thursday,12 PM,Weekday
LOVE HOT WATER BOTTLE,6,5.95,35.7,2011,February,Thursday,12 PM,Weekday
LOVE SEAT ANTIQUE WHITE METAL,2,85.0,170.0,2011,February,Thursday,12 PM,Weekday
MEASURING TAPE BABUSHKA PINK,6,2.95,17.7,2011,February,Thursday,12 PM,Weekday
METAL SIGN DROP YOUR PANTS,6,2.89,17.34,2011,February,Thursday,12 PM,Weekday
MINT KITCHEN SCALES,2,8.5,17.0,2011,February,Thursday,12 PM,Weekday
NINE DRAWER OFFICE TIDY,4,14.95,59.8,2011,February,Thursday,12 PM,Weekday
OWL DOORSTOP,3,4.95,14.85,2011,February,Thursday,12 PM,Weekday
PAINTED METAL PEARS ASSORTED,16,1.69,27.04,2011,February,Thursday,12 PM,Weekday
PANTRY 3 HOOK ROLLING PIN HANGER,6,3.75,22.5,2011,February,Thursday,12 PM,Weekday
PANTRY HOOK BALLOON WHISK,12,2.08,24.96,2011,February,Thursday,12 PM,Weekday
PANTRY HOOK SPATULA,12,2.08,24.96,2011,February,Thursday,12 PM,Weekday
PANTRY HOOK TEA STRAINER,12,2.08,24.96,2011,February,Thursday,12 PM,Weekday
PIN CUSHION BABUSHKA PINK,6,3.35,20.1,2011,February,Thursday,12 PM,Weekday
PINK REGENCY TEACUP AND SAUCER,6,2.95,17.7,2011,February,Thursday,12 PM,Weekday
PLAYING CARDS JUBILEE UNION JACK,12,1.25,15.0,2011,February,Thursday,12 PM,Weekday
PLAYING CARDS KEEP CALM & CARRY ON,12,1.25,15.0,2011,February,Thursday,12 PM,Weekday
POPPY FIELDS CHOPPING BOARD,3,4.95,14.85,2011,February,Thursday,12 PM,Weekday
REGENCY CAKESTAND 3 TIER,4,12.75,51.0,2011,February,Thursday,12 PM,Weekday
REGENCY CAKESTAND 3 TIER,6,12.75,76.5,2011,February,Thursday,12 PM,Weekday
REGENCY CAKESTAND 3 TIER,3,12.75,38.25,2011,February,Thursday,12 PM,Weekday
REGENCY MILK JUG PINK,4,3.25,13.0,2011,February,Thursday,12 PM,Weekday
REGENCY SUGAR BOWL GREEN,4,4.15,16.6,2011,February,Thursday,12 PM,Weekday
REGENCY TEA PLATE GREEN,12,1.65,19.8,2011,February,Thursday,12 PM,Weekday
REGENCY TEA PLATE PINK,12,1.65,19.8,2011,February,Thursday,12 PM,Weekday
REGENCY TEA PLATE ROSES,12,1.65,19.8,2011,February,Thursday,12 PM,Weekday
REGENCY TEAPOT ROSES,2,9.95,19.9,2011,February,Thursday,12 PM,Weekday
ROSES REGENCY TEACUP AND SAUCER,6,2.95,17.7,2011,February,Thursday,12 PM,Weekday
RUSTIC  SEVENTEEN DRAWER SIDEBOARD,2,145.0,290.0,2011,February,Thursday,12 PM,Weekday
SET 12 RETRO WHITE CHALK STICKS,24,0.42,10.08,2011,February,Thursday,12 PM,Weekday
SET 36 COLOUR PENCILS DOLLY GIRL,16,1.25,20.0,2011,February,Thursday,12 PM,Weekday
SET 36 COLOUR PENCILS SPACEBOY,16,1.25,20.0,2011,February,Thursday,12 PM,Weekday
SET 36 COLOURING PENCILS DOILY,16,1.25,20.0,2011,February,Thursday,12 PM,Weekday
SET OF 3 CAKE TINS PANTRY DESIGN,3,4.95,14.85,2011,February,Thursday,12 PM,Weekday
SET OF 3 REGENCY CAKE TINS,4,4.95,19.8,2011,February,Thursday,12 PM,Weekday
SET OF 3 REGENCY CAKE TINS,4,4.95,19.8,2011,February,Thursday,12 PM,Weekday
SET OF 4 KNICK KNACK TINS DOILY,6,4.15,24.9,2011,February,Thursday,12 PM,Weekday
SET OF 4 KNICK KNACK TINS LEAF,6,4.15,24.9,2011,February,Thursday,12 PM,Weekday
SET OF 4 KNICK KNACK TINS LONDON,6,4.15,24.9,2011,February,Thursday,12 PM,Weekday
SET OF 4 KNICK KNACK TINS POPPIES,6,4.15,24.9,2011,February,Thursday,12 PM,Weekday
SET OF 4 KNICK KNACK TINS POPPIES,6,4.15,24.9,2011,February,Thursday,12 PM,Weekday
SET/4 WHITE RETRO STORAGE CUBES,2,39.95,79.9,2011,February,Thursday,12 PM,Weekday
SILVER BELLS TABLE DECORATION,12,1.25,15.0,2011,February,Thursday,12 PM,Weekday
SIX DRAWER OFFICE TIDY,4,9.95,39.8,2011,February,Thursday,12 PM,Weekday
SPACEBOY BEAKER,12,1.25,15.0,2011,February,Thursday,12 PM,Weekday
SUKI  SHOULDER BAG,10,1.65,16.5,2011,February,Thursday,12 PM,Weekday
SWEETHEART RECIPE BOOK STAND,2,6.75,13.5,2011,February,Thursday,12 PM,Weekday
SWEETHEART WIRE MAGAZINE RACK,2,7.95,15.9,2011,February,Thursday,12 PM,Weekday
SWEETHEART WIRE WALL TIDY,4,9.95,39.8,2011,February,Thursday,12 PM,Weekday
VINTAGE  2 METRE FOLDING RULER,12,1.65,19.8,2011,February,Thursday,12 PM,Weekday
VINTAGE COFFEE GRINDER BOX,3,4.95,14.85,2011,February,Thursday,12 PM,Weekday
VINTAGE DOILY DELUXE SEWING KIT,3,5.95,17.85,2011,February,Thursday,12 PM,Weekday
VINTAGE DOILY DELUXE SEWING KIT,3,5.95,17.85,2011,February,Thursday,12 PM,Weekday
VINTAGE DOILY TRAVEL SEWING KIT,10,1.95,19.5,2011,February,Thursday,12 PM,Weekday
VINTAGE LEAF CHOPPING BOARD,3,4.95,14.85,2011,February,Thursday,12 PM,Weekday
WALL ART 70'S ALPHABET,2,8.25,16.5,2011,February,Thursday,12 PM,Weekday
WALL ART BICYCLE SAFETY,4,5.95,23.8,2011,February,Thursday,12 PM,Weekday
WALL ART BIG LOVE,3,6.95,20.85,2011,February,Thursday,12 PM,Weekday
WALL ART DOG LICENCE,4,5.95,23.8,2011,February,Thursday,12 PM,Weekday
WALL ART DOLLY GIRL,6,3.75,22.5,2011,February,Thursday,12 PM,Weekday
WALL ART I LOVE LONDON,6,4.95,29.7,2011,February,Thursday,12 PM,Weekday
WALL ART ONLY ONE PERSON,6,4.95,29.7,2011,February,Thursday,12 PM,Weekday
WALL ART SPACEBOY,6,3.75,22.5,2011,February,Thursday,12 PM,Weekday
WALL ART STOP FOR TEA,3,5.95,17.85,2011,February,Thursday,12 PM,Weekday
WALL ART VILLAGE SHOW,4,5.95,23.8,2011,February,Thursday,12 PM,Weekday
WHITE WOOD GARDEN PLANT LADDER,4,8.5,34.0,2011,February,Thursday,12 PM,Weekday
WOOD BLACK BOARD ANT WHITE FINISH,4,7.95,31.8,2011,February,Thursday,12 PM,Weekday
ZINC BOX SIGN HOME,3,9.95,29.85,2011,February,Thursday,12 PM,Weekday
ANGEL DECORATION 3 BUTTONS,48,0.42,20.16,2011,February,Wednesday,2 PM,Weekday
ANGEL DECORATION STARS ON DRESS,48,0.42,20.16,2011,February,Wednesday,2 PM,Weekday
ANTIQUE SILVER T-LIGHT GLASS,12,1.25,15.0,2011,February,Wednesday,2 PM,Weekday
"ART LIGHTS,FUNK MONKEY",6,2.95,17.7,2011,February,Wednesday,2 PM,Weekday
ASSORTED COLOUR BIRD ORNAMENT,24,1.69,40.56,2011,February,Wednesday,2 PM,Weekday
"CHRISTMAS GARLAND STARS,TREES",12,3.75,45.0,2011,February,Wednesday,2 PM,Weekday
FAIRY TALE COTTAGE NIGHT LIGHT,12,1.95,23.4,2011,February,Wednesday,2 PM,Weekday
FELTCRAFT CUSHION OWL,4,3.75,15.0,2011,February,Wednesday,2 PM,Weekday
HANGING METAL STAR LANTERN,12,1.65,19.8,2011,February,Wednesday,2 PM,Weekday
LANTERN CREAM GAZEBO,6,4.95,29.7,2011,February,Wednesday,2 PM,Weekday
LIGHT GARLAND BUTTERFILES PINK,4,4.25,17.0,2011,February,Wednesday,2 PM,Weekday
MAGIC SHEEP WOOL GROWING FROM PAPER,24,0.85,20.4,2011,February,Wednesday,2 PM,Weekday
MAGIC TREE -PAPER FLOWERS,12,0.85,10.2,2011,February,Wednesday,2 PM,Weekday
METAL MERRY CHRISTMAS WREATH,8,1.95,15.6,2011,February,Wednesday,2 PM,Weekday
PHOTO FRAME CORNICE,8,2.95,23.6,2011,February,Wednesday,2 PM,Weekday
PINK FLORAL FELTCRAFT SHOULDER BAG,4,3.75,15.0,2011,February,Wednesday,2 PM,Weekday
PINK HEARTS LIGHT CHAIN,6,4.65,27.9,2011,February,Wednesday,2 PM,Weekday
RED FLORAL FELTCRAFT SHOULDER BAG,4,3.75,15.0,2011,February,Wednesday,2 PM,Weekday
ROCKING HORSE RED CHRISTMAS,12,0.85,10.2,2011,February,Wednesday,2 PM,Weekday
SET 10 NIGHT OWL LIGHTS,4,6.75,27.0,2011,February,Wednesday,2 PM,Weekday
SET 6 PAPER TABLE LANTERN HEARTS,12,3.75,45.0,2011,February,Wednesday,2 PM,Weekday
SET 6 PAPER TABLE LANTERN STARS,12,3.75,45.0,2011,February,Wednesday,2 PM,Weekday
STAR WREATH DECORATION WITH BELL,12,1.25,15.0,2011,February,Wednesday,2 PM,Weekday
TRIPLE PHOTO FRAME CORNICE,4,9.95,39.8,2011,February,Wednesday,2 PM,Weekday
WHITE HANGING HEART T-LIGHT HOLDER,30,2.95,88.5,2011,February,Wednesday,2 PM,Weekday
WHITE ROCKING HORSE HAND PAINTED,24,1.25,30.0,2011,February,Wednesday,2 PM,Weekday
WHITE TALL PORCELAIN T-LIGHT HOLDER,12,2.55,30.6,2011,February,Wednesday,2 PM,Weekday
WOODEN OWLS LIGHT GARLAND,4,4.25,17.0,2011,February,Wednesday,2 PM,Weekday
12 RED ROSE PEG PLACE SETTINGS,3,1.25,3.75,2011,January,Friday,12 PM,Weekday
AIRLINE BAG VINTAGE JET SET BROWN,1,4.25,4.25,2011,January,Friday,12 PM,Weekday
AIRLINE BAG VINTAGE JET SET RED,1,4.25,4.25,2011,January,Friday,12 PM,Weekday
AIRLINE BAG VINTAGE TOKYO 78,1,4.25,4.25,2011,January,Friday,12 PM,Weekday
AIRLINE BAG VINTAGE WORLD CHAMPION,1,4.25,4.25,2011,January,Friday,12 PM,Weekday
ALPHABET STENCIL CRAFT,1,1.25,1.25,2011,January,Friday,12 PM,Weekday
BABY MOUSE RED GINGHAM DRESS,2,4.25,8.5,2011,January,Friday,12 PM,Weekday
BALLOONS  WRITING SET,1,1.65,1.65,2011,January,Friday,12 PM,Weekday
BASKET OF TOADSTOOLS,3,1.25,3.75,2011,January,Friday,12 PM,Weekday
BLUE POLKADOT BOWL,2,1.25,2.5,2011,January,Friday,12 PM,Weekday
CANDY SPOT HAND BAG,2,2.1,4.2,2011,January,Friday,12 PM,Weekday
CARD CHRISTMAS VILLAGE,24,0.42,10.08,2011,January,Friday,12 PM,Weekday
CARD MOTORBIKE SANTA,12,0.42,5.04,2011,January,Friday,12 PM,Weekday
CHRISTMAS CRAFT LITTLE FRIENDS,1,2.1,2.1,2011,January,Friday,12 PM,Weekday
CHRISTMAS CRAFT LITTLE FRIENDS,1,2.1,2.1,2011,January,Friday,12 PM,Weekday
CHRISTMAS CRAFT TREE TOP ANGEL,1,2.1,2.1,2011,January,Friday,12 PM,Weekday
CHRISTMAS CRAFT WHITE FAIRY,1,1.45,1.45,2011,January,Friday,12 PM,Weekday
DAIRY MAID TRADITIONAL TEAPOT,1,6.95,6.95,2011,January,Friday,12 PM,Weekday
DOG TOY WITH PINK CROCHET SKIRT,1,3.75,3.75,2011,January,Friday,12 PM,Weekday
DOLLY GIRL BABY GIFT SET,1,16.95,16.95,2011,January,Friday,12 PM,Weekday
DOUGHNUT LIP GLOSS,20,1.25,25.0,2011,January,Friday,12 PM,Weekday
EGG FRYING PAN IVORY,1,2.08,2.08,2011,January,Friday,12 PM,Weekday
EMBROIDERED RIBBON REEL DAISY,1,2.08,2.08,2011,January,Friday,12 PM,Weekday
EMBROIDERED RIBBON REEL EMILY,1,2.08,2.08,2011,January,Friday,12 PM,Weekday
EMBROIDERED RIBBON REEL RACHEL,1,2.89,2.89,2011,January,Friday,12 PM,Weekday
EMBROIDERED RIBBON REEL REBECCA,1,2.89,2.89,2011,January,Friday,12 PM,Weekday
EMBROIDERED RIBBON REEL ROSIE,1,2.08,2.08,2011,January,Friday,12 PM,Weekday
EMBROIDERED RIBBON REEL RUBY,1,3.75,3.75,2011,January,Friday,12 PM,Weekday
EMBROIDERED RIBBON REEL SALLY,1,2.08,2.08,2011,January,Friday,12 PM,Weekday
EMBROIDERED RIBBON REEL SOPHIE,1,3.75,3.75,2011,January,Friday,12 PM,Weekday
EMBROIDERED RIBBON REEL SUSIE,1,2.08,2.08,2011,January,Friday,12 PM,Weekday
ENGLISH ROSE NOTEBOOK A7 SIZE,3,0.42,1.26,2011,January,Friday,12 PM,Weekday
"FEATHER PEN,HOT PINK",12,0.39,4.68,2011,January,Friday,12 PM,Weekday
FELTCRAFT BOY JEAN-PAUL KIT,1,4.95,4.95,2011,January,Friday,12 PM,Weekday
FELTCRAFT CHRISTMAS FAIRY,2,4.25,8.5,2011,January,Friday,12 PM,Weekday
FELTCRAFT DOLL EMILY,1,2.95,2.95,2011,January,Friday,12 PM,Weekday
FELTCRAFT DOLL MOLLY,1,2.95,2.95,2011,January,Friday,12 PM,Weekday
FELTCRAFT DOLL ROSIE,1,2.95,2.95,2011,January,Friday,12 PM,Weekday
FELTCRAFT GIRL AMELIE KIT,1,4.95,4.95,2011,January,Friday,12 PM,Weekday
FELTCRAFT GIRL NICOLE KIT,1,4.95,4.95,2011,January,Friday,12 PM,Weekday
FELTCRAFT HAIRBAND PINK AND BLUE,1,0.85,0.85,2011,January,Friday,12 PM,Weekday
FELTCRAFT HAIRBAND PINK AND PURPLE,1,0.85,0.85,2011,January,Friday,12 PM,Weekday
FELTCRAFT HAIRBANDS PINK AND WHITE,1,0.85,0.85,2011,January,Friday,12 PM,Weekday
FELTCRAFT PRINCESS CHARLOTTE DOLL,1,3.75,3.75,2011,January,Friday,12 PM,Weekday
GLOW IN DARK DOLPHINS,4,0.21,0.84,2011,January,Friday,12 PM,Weekday
GREEN POLKADOT BOWL,2,1.25,2.5,2011,January,Friday,12 PM,Weekday
HAPPY EASTER HANGING DECORATION,1,3.75,3.75,2011,January,Friday,12 PM,Weekday
HAPPY EASTER HANGING DECORATION,1,3.75,3.75,2011,January,Friday,12 PM,Weekday
HAPPY STENCIL CRAFT,1,1.25,1.25,2011,January,Friday,12 PM,Weekday
HEART CALCULATOR,1,1.25,1.25,2011,January,Friday,12 PM,Weekday
HEART CALCULATOR,2,1.25,2.5,2011,January,Friday,12 PM,Weekday
ICE CREAM PEN LIP GLOSS,20,1.25,25.0,2011,January,Friday,12 PM,Weekday
JINGLE BELL HEART ANTIQUE GOLD,3,2.08,6.24,2011,January,Friday,12 PM,Weekday
KEY RING BASEBALL BOOT ASSORTED,20,1.25,25.0,2011,January,Friday,12 PM,Weekday
LARGE PURPLE BABUSHKA NOTEBOOK,1,1.25,1.25,2011,January,Friday,12 PM,Weekday
LUNCH BAG PINK POLKADOT,1,1.65,1.65,2011,January,Friday,12 PM,Weekday
LUNCH BAG RED RETROSPOT,1,1.65,1.65,2011,January,Friday,12 PM,Weekday
MONSTERS STENCIL CRAFT,1,1.25,1.25,2011,January,Friday,12 PM,Weekday
MOUSE TOY WITH PINK T-SHIRT,1,3.75,3.75,2011,January,Friday,12 PM,Weekday
MOUSE TOY WITH PINK T-SHIRT,1,3.75,3.75,2011,January,Friday,12 PM,Weekday
PANTRY MAGNETIC  SHOPPING LIST,1,1.45,1.45,2011,January,Friday,12 PM,Weekday
PARTY BUNTING,1,4.95,4.95,2011,January,Friday,12 PM,Weekday
PARTY CONES CANDY ASSORTED,12,1.25,15.0,2011,January,Friday,12 PM,Weekday
PARTY INVITES FOOTBALL,3,0.85,2.55,2011,January,Friday,12 PM,Weekday
PARTY TIME PENCIL ERASERS,28,0.21,5.88,2011,January,Friday,12 PM,Weekday
PINK BABY BUNTING,1,2.95,2.95,2011,January,Friday,12 PM,Weekday
PINK BLUE FELT CRAFT TRINKET BOX,2,1.25,2.5,2011,January,Friday,12 PM,Weekday
PINK HANGING HEART T-LIGHT HOLDER,6,2.95,17.7,2011,January,Friday,12 PM,Weekday
PINK POLKADOT BOWL,2,1.25,2.5,2011,January,Friday,12 PM,Weekday
RED BABY BUNTING,1,2.95,2.95,2011,January,Friday,12 PM,Weekday
RED HANGING HEART T-LIGHT HOLDER,6,2.95,17.7,2011,January,Friday,12 PM,Weekday
RED RETROSPOT BOWL,2,1.25,2.5,2011,January,Friday,12 PM,Weekday
REX CASH+CARRY JUMBO SHOPPER,1,0.95,0.95,2011,January,Friday,12 PM,Weekday
SET 6 FOOTBALL CELEBRATION CANDLES,2,1.25,2.5,2011,January,Friday,12 PM,Weekday
SET OF 10 LANTERNS FAIRY LIGHT STAR,1,4.15,4.15,2011,January,Friday,12 PM,Weekday
SET OF 10 LANTERNS FAIRY LIGHT STAR,1,4.15,4.15,2011,January,Friday,12 PM,Weekday
SET OF 10 LANTERNS FAIRY LIGHT STAR,1,4.15,4.15,2011,January,Friday,12 PM,Weekday
SET OF 3 NOTEBOOKS IN PARCEL,2,1.65,3.3,2011,January,Friday,12 PM,Weekday
SET OF 4 JAM JAR MAGNETS,2,2.08,4.16,2011,January,Friday,12 PM,Weekday
SET OF 5 MINI GROCERY MAGNETS,1,2.08,2.08,2011,January,Friday,12 PM,Weekday
SET OF 5 MINI GROCERY MAGNETS,1,2.08,2.08,2011,January,Friday,12 PM,Weekday
SET OF 5 PANCAKE DAY MAGNETS,2,2.08,4.16,2011,January,Friday,12 PM,Weekday
SET OF 6 GIRLS CELEBRATION CANDLES,2,1.25,2.5,2011,January,Friday,12 PM,Weekday
SET OF 6 T-LIGHTS SANTA,2,2.95,5.9,2011,January,Friday,12 PM,Weekday
SET OF 9 HEART SHAPED BALLOONS,1,1.25,1.25,2011,January,Friday,12 PM,Weekday
SET OF 9 HEART SHAPED BALLOONS,1,1.25,1.25,2011,January,Friday,12 PM,Weekday
SET/4 COLOURFUL MIXING BOWLS,1,9.95,9.95,2011,January,Friday,12 PM,Weekday
SKETCHBOOK MAGNETIC SHOPPING LIST,1,1.45,1.45,2011,January,Friday,12 PM,Weekday
SMALL RED BABUSHKA NOTEBOOK,1,0.85,0.85,2011,January,Friday,12 PM,Weekday
SMALL YELLOW BABUSHKA NOTEBOOK,1,0.85,0.85,2011,January,Friday,12 PM,Weekday
SNACK TRAY I LOVE LONDON,1,1.95,1.95,2011,January,Friday,12 PM,Weekday
SPOTTY BUNTING,1,4.95,4.95,2011,January,Friday,12 PM,Weekday
SWIRLY CIRCULAR RUBBERS IN BAG,12,0.42,5.04,2011,January,Friday,12 PM,Weekday
TEA COSY BLUE STRIPE,1,2.55,2.55,2011,January,Friday,12 PM,Weekday
VINTAGE  2 METRE FOLDING RULER,3,1.65,4.95,2011,January,Friday,12 PM,Weekday
VINTAGE LEAF MAGNETIC NOTEPAD,1,1.45,1.45,2011,January,Friday,12 PM,Weekday
WHITE HANGING HEART T-LIGHT HOLDER,10,2.95,29.5,2011,January,Friday,12 PM,Weekday
WOOD STAMP SET BEST WISHES,1,0.83,0.83,2011,January,Friday,12 PM,Weekday
WOOD STAMP SET HAPPY BIRTHDAY,1,0.83,0.83,2011,January,Friday,12 PM,Weekday
WOOD STAMP SET THANK YOU,1,0.83,0.83,2011,January,Friday,12 PM,Weekday
