Description,Quantity,UnitPrice,Revenue,Year,Month,DayOfWeek,Hour,Weekday
WOODLAND CHARLOTTE BAG,10,0.85,8.5,2011,August,Friday,10 AM,Weekday
WRAP SUKI AND FRIENDS,25,0.42,10.5,2011,August,Friday,10 AM,Weekday
BAKING SET 9 PIECE RETROSPOT,3,4.95,14.85,2011,August,Sunday,10 AM,Weekend
BAKING SET SPACEBOY DESIGN,3,4.95,14.85,2011,August,Sunday,10 AM,Weekend
POSTAGE,1,18.0,18.0,2011,August,Sunday,10 AM,Weekend
RED RETROSPOT SUGAR JAM BOWL,6,2.55,15.3,2011,August,Sunday,10 AM,Weekend
RETROSPOT TEA SET CERAMIC 11 PC,3,4.95,14.85,2011,August,Sunday,10 AM,Weekend
SET OF 6 SOLDIER SKITTLES,4,3.75,15.0,2011,August,Sunday,10 AM,Weekend
SET/5 RED RETROSPOT LID GLASS BOWLS,6,2.95,17.7,2011,August,Sunday,10 AM,Weekend
TREASURE ISLAND BOOK BOX,8,2.25,18.0,2011,August,Sunday,10 AM,Weekend
BOX OF VINTAGE ALPHABET BLOCKS,2,11.95,23.9,2011,August,Sunday,2 PM,Weekend
FELTCRAFT CUSHION BUTTERFLY,4,3.75,15.0,2011,August,Sunday,2 PM,Weekend
FELTCRAFT PRINCESS CHARLOTTE DOLL,4,3.75,15.0,2011,August,Sunday,2 PM,Weekend
FELTCRAFT PRINCESS LOLA DOLL,4,3.75,15.0,2011,August,Sunday,2 PM,Weekend
JUMBO BAG RED RETROSPOT,10,2.08,20.8,2011,August,Sunday,2 PM,Weekend
JUMBO BAG SPACEBOY DESIGN,10,2.08,20.8,2011,August,Sunday,2 PM,Weekend
JUMBO BAG VINTAGE LEAF,10,2.08,20.8,2011,August,Sunday,2 PM,Weekend
JUMBO STORAGE BAG SUKI,10,2.08,20.8,2011,August,Sunday,2 PM,Weekend
PLASTERS IN TIN CIRCUS PARADE,12,1.65,19.8,2011,August,Sunday,2 PM,Weekend
PLASTERS IN TIN SKULLS,12,1.65,19.8,2011,August,Sunday,2 PM,Weekend
PLASTERS IN TIN WOODLAND ANIMALS,12,1.65,19.8,2011,August,Sunday,2 PM,Weekend
POSTAGE,2,18.0,36.0,2011,August,Sunday,2 PM,Weekend
RED RETROSPOT PICNIC BAG,5,2.95,14.75,2011,August,Sunday,2 PM,Weekend
RED TOADSTOOL LED NIGHT LIGHT,12,1.65,19.8,2011,August,Sunday,2 PM,Weekend
RETROSPOT TEA SET CERAMIC 11 PC,3,4.95,14.85,2011,August,Sunday,2 PM,Weekend
SET OF 9 BLACK SKULL BALLOONS,20,0.85,17.0,2011,August,Sunday,2 PM,Weekend
SET OF 9 HEART SHAPED BALLOONS,12,1.25,15.0,2011,August,Sunday,2 PM,Weekend
SET/4 BADGES BALLOON GIRL,10,1.25,12.5,2011,August,Sunday,2 PM,Weekend
SET/4 BADGES CUTE CREATURES,10,1.25,12.5,2011,August,Sunday,2 PM,Weekend
VINTAGE LEAF MAGNETIC NOTEPAD,12,1.45,17.4,2011,August,Sunday,2 PM,Weekend
WHITE SPOT RED CERAMIC DRAWER KNOB,12,1.25,15.0,2011,August,Sunday,2 PM,Weekend
WORLD WAR 2 GLIDERS ASSTD DESIGNS,48,0.29,13.92,2011,August,Sunday,2 PM,Weekend
DOLLY GIRL LUNCH BOX,12,1.95,23.4,2011,August,Tuesday,12 PM,Weekday
LUNCH BAG PINK POLKADOT,10,1.65,16.5,2011,August,Tuesday,12 PM,Weekday
LUNCH BAG SPACEBOY DESIGN,10,1.65,16.5,2011,August,Tuesday,12 PM,Weekday
LUNCH BAG WOODLAND,10,1.65,16.5,2011,August,Tuesday,12 PM,Weekday
SPACEBOY LUNCH BOX,12,1.95,23.4,2011,August,Tuesday,12 PM,Weekday
BLACK/BLUE POLKADOT UMBRELLA,3,5.95,17.85,2011,August,Tuesday,2 PM,Weekday
CIRCUS PARADE CHILDRENS EGG CUP,12,1.25,15.0,2011,August,Tuesday,2 PM,Weekday
CIRCUS PARADE LUNCH BOX,12,1.95,23.4,2011,August,Tuesday,2 PM,Weekday
CLASSIC CAFE SUGAR DISPENSER,12,1.25,15.0,2011,August,Tuesday,2 PM,Weekday
DOLLY GIRL LUNCH BOX,12,1.95,23.4,2011,August,Tuesday,2 PM,Weekday
EDWARDIAN PARASOL BLACK,3,5.95,17.85,2011,August,Tuesday,2 PM,Weekday
GIRAFFE WOODEN RULER,12,1.95,23.4,2011,August,Tuesday,2 PM,Weekday
HANGING MINI COLOURED BOTTLES,48,0.63,30.24,2011,August,Tuesday,2 PM,Weekday
LARGE CAMPHOR WOOD FIELD MUSHROOM,2,5.45,10.9,2011,August,Tuesday,2 PM,Weekday
LUNCH BAG ALPHABET DESIGN,10,1.65,16.5,2011,August,Tuesday,2 PM,Weekday
LUNCH BAG APPLE DESIGN,10,1.65,16.5,2011,August,Tuesday,2 PM,Weekday
LUNCH BAG RED RETROSPOT,10,1.65,16.5,2011,August,Tuesday,2 PM,Weekday
LUNCH BAG SPACEBOY DESIGN,10,1.65,16.5,2011,August,Tuesday,2 PM,Weekday
LUNCH BOX I LOVE LONDON,12,1.95,23.4,2011,August,Tuesday,2 PM,Weekday
MINI PAINT SET VINTAGE,36,0.65,23.4,2011,August,Tuesday,2 PM,Weekday
MODERN FLORAL STATIONERY SET,12,1.25,15.0,2011,August,Tuesday,2 PM,Weekday
PINK BABY BUNTING,5,2.95,14.75,2011,August,Tuesday,2 PM,Weekday
PLASTERS IN TIN CIRCUS PARADE,12,1.65,19.8,2011,August,Tuesday,2 PM,Weekday
PLASTERS IN TIN SPACEBOY,12,1.65,19.8,2011,August,Tuesday,2 PM,Weekday
POSTAGE,4,18.0,72.0,2011,August,Tuesday,2 PM,Weekday
RED  EGG  SPOON,24,0.12,2.88,2011,August,Tuesday,2 PM,Weekday
RED RETROSPOT PICNIC BAG,10,2.95,29.5,2011,August,Tuesday,2 PM,Weekday
RED RETROSPOT SHOPPER BAG,10,1.25,12.5,2011,August,Tuesday,2 PM,Weekday
RED RETROSPOT TEA CUP AND SAUCER,8,3.75,30.0,2011,August,Tuesday,2 PM,Weekday
RED RETROSPOT UMBRELLA,3,5.95,17.85,2011,August,Tuesday,2 PM,Weekday
RED VINTAGE SPOT BEAKER,8,0.85,6.8,2011,August,Tuesday,2 PM,Weekday
RETROSPOT CANDLE  LARGE,12,2.55,30.6,2011,August,Tuesday,2 PM,Weekday
ROUND SNACK BOXES SET OF4 WOODLAND,6,2.95,17.7,2011,August,Tuesday,2 PM,Weekday
SET OF 4 KNICK KNACK TINS LEAF,6,4.15,24.9,2011,August,Tuesday,2 PM,Weekday
SET OF 4 KNICK KNACK TINS LONDON,6,4.15,24.9,2011,August,Tuesday,2 PM,Weekday
SET OF 4 KNICK KNACK TINS POPPIES,6,4.15,24.9,2011,August,Tuesday,2 PM,Weekday
SMALL CAMPHOR WOOD FIELD  MUSHROOM,6,1.65,9.9,2011,August,Tuesday,2 PM,Weekday
SMALL WHITE RETROSPOT MUG IN BOX,6,3.75,22.5,2011,August,Tuesday,2 PM,Weekday
SPACEBOY CHILDRENS EGG CUP,12,1.25,15.0,2011,August,Tuesday,2 PM,Weekday
SPOTTY BUNTING,6,4.95,29.7,2011,August,Tuesday,2 PM,Weekday
STORAGE TIN VINTAGE LEAF,6,2.89,17.34,2011,August,Tuesday,2 PM,Weekday
UNION STRIPE WITH FRINGE  HAMMOCK,10,7.95,79.5,2011,August,Tuesday,2 PM,Weekday
WATERING CAN BLUE ELEPHANT,6,1.95,11.7,2011,August,Tuesday,2 PM,Weekday
WATERING CAN PINK BUNNY,6,1.95,11.7,2011,August,Tuesday,2 PM,Weekday
CERAMIC STRAWBERRY DESIGN MUG,12,1.49,17.88,2011,August,Wednesday,10 AM,Weekday
MINI JIGSAW PURDEY,24,0.42,10.08,2011,August,Wednesday,10 AM,Weekday
POSTAGE,2,18.0,36.0,2011,August,Wednesday,10 AM,Weekday
RED RETROSPOT SMALL MILK JUG,6,2.55,15.3,2011,August,Wednesday,10 AM,Weekday
RETROSPOT LARGE MILK JUG,3,4.95,14.85,2011,August,Wednesday,10 AM,Weekday
RETROSPOT TEA SET CERAMIC 11 PC,3,4.95,14.85,2011,August,Wednesday,10 AM,Weekday
SET/20 RED RETROSPOT PAPER NAPKINS,12,0.85,10.2,2011,August,Wednesday,10 AM,Weekday
STRAWBERRY CERAMIC TRINKET BOX,12,1.25,15.0,2011,August,Wednesday,10 AM,Weekday
STRAWBERRY FAIRY CAKE TEAPOT,8,4.95,39.6,2011,August,Wednesday,10 AM,Weekday
WRAP  VINTAGE DOILY,25,0.42,10.5,2011,August,Wednesday,10 AM,Weekday
ASSORTED TUTTI FRUTTI BRACELET,24,0.19,4.56,2011,August,Wednesday,12 PM,Weekday
DOORMAT MERRY CHRISTMAS RED,6,7.95,47.7,2011,August,Wednesday,12 PM,Weekday
DOORMAT UNION FLAG,4,7.95,31.8,2011,August,Wednesday,12 PM,Weekday
DOORMAT UNION JACK GUNS AND ROSES,2,7.95,15.9,2011,August,Wednesday,12 PM,Weekday
EMPIRE TISSUE BOX,36,0.39,14.04,2011,August,Wednesday,12 PM,Weekday
GINGHAM HEART  DOORSTOP RED,3,4.25,12.75,2011,August,Wednesday,12 PM,Weekday
NOEL GARLAND PAINTED ZINC,12,1.65,19.8,2011,August,Wednesday,12 PM,Weekday
PINK BLUE FELT CRAFT TRINKET BOX,12,1.25,15.0,2011,August,Wednesday,12 PM,Weekday
SET 2 TEA TOWELS I LOVE LONDON,6,3.25,19.5,2011,August,Wednesday,12 PM,Weekday
SET OF 3 REGENCY CAKE TINS,4,4.95,19.8,2011,August,Wednesday,12 PM,Weekday
SET OF 60 I LOVE LONDON CAKE CASES,24,0.55,13.2,2011,August,Wednesday,12 PM,Weekday
SPOTTY PINK DUCK DOORSTOP,3,4.25,12.75,2011,August,Wednesday,12 PM,Weekday
VINTAGE UNION JACK DOORSTOP,3,5.95,17.85,2011,August,Wednesday,12 PM,Weekday
10 COLOUR SPACEBOY PEN,24,0.85,20.4,2011,August,Thursday,9 AM,Weekday
12 MESSAGE CARDS WITH ENVELOPES,12,1.65,19.8,2011,August,Thursday,9 AM,Weekday
6 GIFT TAGS 50'S CHRISTMAS,12,0.83,9.96,2011,August,Thursday,9 AM,Weekday
6 GIFT TAGS VINTAGE CHRISTMAS,12,0.83,9.96,2011,August,Thursday,9 AM,Weekday
ASSORTED COLOUR MINI CASES,4,7.95,31.8,2011,August,Thursday,9 AM,Weekday
BLUE VINTAGE SPOT BEAKER,16,0.85,13.6,2011,August,Thursday,9 AM,Weekday
CARD BILLBOARD FONT,12,0.42,5.04,2011,August,Thursday,9 AM,Weekday
CARD CIRCUS PARADE,12,0.42,5.04,2011,August,Thursday,9 AM,Weekday
CARD GINGHAM ROSE,12,0.42,5.04,2011,August,Thursday,9 AM,Weekday
CARD SUKI BIRTHDAY,12,0.42,5.04,2011,August,Thursday,9 AM,Weekday
CARD WEDDING DAY,12,0.42,5.04,2011,August,Thursday,9 AM,Weekday
COWBOYS AND INDIANS BIRTHDAY CARD,12,0.42,5.04,2011,August,Thursday,9 AM,Weekday
DAISIES  HONEYCOMB GARLAND,12,1.65,19.8,2011,August,Thursday,9 AM,Weekday
DOLLY GIRL BEAKER,12,1.25,15.0,2011,August,Thursday,9 AM,Weekday
DOLLY GIRL CHILDRENS BOWL,8,1.25,10.0,2011,August,Thursday,9 AM,Weekday
DOLLY GIRL CHILDRENS CUP,8,1.25,10.0,2011,August,Thursday,9 AM,Weekday
EDWARDIAN PARASOL RED,3,5.95,17.85,2011,August,Thursday,9 AM,Weekday
"ELEPHANT, BIRTHDAY CARD, ",12,0.42,5.04,2011,August,Thursday,9 AM,Weekday
FAIRY TALE COTTAGE NIGHTLIGHT,12,1.95,23.4,2011,August,Thursday,9 AM,Weekday
FLYING PIG WATERING CAN,6,2.95,17.7,2011,August,Thursday,9 AM,Weekday
GREEN VINTAGE SPOT BEAKER,16,0.85,13.6,2011,August,Thursday,9 AM,Weekday
LUNCH BAG  BLACK SKULL.,20,1.65,33.0,2011,August,Thursday,9 AM,Weekday
LUNCH BAG ALPHABET DESIGN,20,1.65,33.0,2011,August,Thursday,9 AM,Weekday
LUNCH BAG APPLE DESIGN,20,1.65,33.0,2011,August,Thursday,9 AM,Weekday
LUNCH BAG CARS BLUE,10,1.65,16.5,2011,August,Thursday,9 AM,Weekday
LUNCH BAG RED RETROSPOT,30,1.65,49.5,2011,August,Thursday,9 AM,Weekday
LUNCH BAG SPACEBOY DESIGN,20,1.65,33.0,2011,August,Thursday,9 AM,Weekday
LUNCH BAG SUKI DESIGN,10,1.65,16.5,2011,August,Thursday,9 AM,Weekday
LUNCH BAG VINTAGE DOILY,10,1.65,16.5,2011,August,Thursday,9 AM,Weekday
LUNCH BAG VINTAGE LEAF DESIGN,10,1.65,16.5,2011,August,Thursday,9 AM,Weekday
MAGNETS PACK OF 4 HOME SWEET HOME,12,0.39,4.68,2011,August,Thursday,9 AM,Weekday
MAGNETS PACK OF 4 RETRO PHOTO,12,0.39,4.68,2011,August,Thursday,9 AM,Weekday
MAGNETS PACK OF 4 SWALLOWS,12,0.39,4.68,2011,August,Thursday,9 AM,Weekday
MAGNETS PACK OF 4 VINTAGE COLLAGE,12,0.39,4.68,2011,August,Thursday,9 AM,Weekday
MAGNETS PACK OF 4 VINTAGE LABELS,12,0.39,4.68,2011,August,Thursday,9 AM,Weekday
MULTICOLOUR 3D BALLS GARLAND,6,2.55,15.3,2011,August,Thursday,9 AM,Weekday
PACK OF 6 BIRDY GIFT TAGS,12,1.25,15.0,2011,August,Thursday,9 AM,Weekday
PENNY FARTHING BIRTHDAY CARD,12,0.42,5.04,2011,August,Thursday,9 AM,Weekday
PIGGY BANK RETROSPOT,4,2.55,10.2,2011,August,Thursday,9 AM,Weekday
PINK VINTAGE PAISLEY PICNIC BAG,10,1.65,16.5,2011,August,Thursday,9 AM,Weekday
PINK VINTAGE SPOT BEAKER,16,0.85,13.6,2011,August,Thursday,9 AM,Weekday
PLASTERS IN TIN CIRCUS PARADE,12,1.65,19.8,2011,August,Thursday,9 AM,Weekday
PLASTERS IN TIN SPACEBOY,12,1.65,19.8,2011,August,Thursday,9 AM,Weekday
PLASTERS IN TIN VINTAGE PAISLEY,12,1.65,19.8,2011,August,Thursday,9 AM,Weekday
POLYESTER FILLER PAD 40x40cm,4,1.45,5.8,2011,August,Thursday,9 AM,Weekday
POSTAGE,6,18.0,108.0,2011,August,Thursday,9 AM,Weekday
RAINY LADIES BIRTHDAY CARD,12,0.42,5.04,2011,August,Thursday,9 AM,Weekday
RED RETROSPOT MINI CASES,6,7.95,47.7,2011,August,Thursday,9 AM,Weekday
RED RETROSPOT PICNIC BAG,5,2.95,14.75,2011,August,Thursday,9 AM,Weekday
RED SPOTTY BISCUIT TIN,6,3.75,22.5,2011,August,Thursday,9 AM,Weekday
RED TOADSTOOL LED NIGHT LIGHT,12,1.65,19.8,2011,August,Thursday,9 AM,Weekday
RED VINTAGE SPOT BEAKER,16,0.85,13.6,2011,August,Thursday,9 AM,Weekday
ROLL WRAP 50'S RED CHRISTMAS,12,1.25,15.0,2011,August,Thursday,9 AM,Weekday
ROLL WRAP VINTAGE SPOT,12,1.25,15.0,2011,August,Thursday,9 AM,Weekday
ROUND SNACK BOXES SET OF 4 FRUITS,6,2.95,17.7,2011,August,Thursday,9 AM,Weekday
ROUND SNACK BOXES SET OF4 WOODLAND,6,2.95,17.7,2011,August,Thursday,9 AM,Weekday
SCANDINAVIAN PAISLEY PICNIC BAG,10,1.65,16.5,2011,August,Thursday,9 AM,Weekday
SET OF 12 FAIRY CAKE BAKING CASES,8,0.83,6.64,2011,August,Thursday,9 AM,Weekday
SET OF 6 SNACK LOAF BAKING CASES,8,0.83,6.64,2011,August,Thursday,9 AM,Weekday
SET OF 6 TEA TIME BAKING CASES,8,1.25,10.0,2011,August,Thursday,9 AM,Weekday
SILK PURSE BABUSHKA PINK,6,3.35,20.1,2011,August,Thursday,9 AM,Weekday
SKULL AND CROSSBONES  GARLAND,12,1.65,19.8,2011,August,Thursday,9 AM,Weekday
SPACEBOY BEAKER,12,1.25,15.0,2011,August,Thursday,9 AM,Weekday
SPACEBOY BIRTHDAY CARD,12,0.42,5.04,2011,August,Thursday,9 AM,Weekday
SPACEBOY CHILDRENS BOWL,8,1.25,10.0,2011,August,Thursday,9 AM,Weekday
SPACEBOY CHILDRENS CUP,8,1.25,10.0,2011,August,Thursday,9 AM,Weekday
TEA BAG PLATE RED RETROSPOT,12,0.85,10.2,2011,August,Thursday,9 AM,Weekday
TEA PARTY BIRTHDAY CARD,12,0.42,5.04,2011,August,Thursday,9 AM,Weekday
TEATIME ROUND PENCIL SHARPENER,24,0.12,2.88,2011,August,Thursday,9 AM,Weekday
ICE CREAM BUBBLES,20,0.83,16.6,2011,August,Thursday,12 PM,Weekday
POSTAGE,1,18.0,18.0,2011,August,Thursday,12 PM,Weekday
RETROSPOT CHILDRENS APRON,8,1.95,15.6,2011,August,Thursday,12 PM,Weekday
RIBBON REEL FLORA + FAUNA,10,1.65,16.5,2011,August,Thursday,12 PM,Weekday
RIBBON REEL POLKADOTS,20,1.65,33.0,2011,August,Thursday,12 PM,Weekday
RIBBON REEL STRIPES DESIGN,10,1.65,16.5,2011,August,Thursday,12 PM,Weekday
ROUND SNACK BOXES SET OF4 WOODLAND,18,2.95,53.1,2011,August,Thursday,12 PM,Weekday
SET OF 72 RETROSPOT PAPER  DOILIES,12,1.45,17.4,2011,August,Thursday,12 PM,Weekday
SET/20 RED RETROSPOT PAPER NAPKINS,24,0.85,20.4,2011,August,Thursday,12 PM,Weekday
SET/6 RED SPOTTY PAPER CUPS,24,0.65,15.6,2011,August,Thursday,12 PM,Weekday
SET/6 RED SPOTTY PAPER PLATES,24,0.85,20.4,2011,August,Thursday,12 PM,Weekday
BLACK/BLUE POLKADOT UMBRELLA,3,5.95,17.85,2011,August,Thursday,1 PM,Weekday
EDWARDIAN PARASOL BLACK,6,5.95,35.7,2011,August,Thursday,1 PM,Weekday
EDWARDIAN PARASOL RED,3,5.95,17.85,2011,August,Thursday,1 PM,Weekday
I LOVE LONDON BEAKER,12,1.25,15.0,2011,August,Thursday,1 PM,Weekday
JUMBO BAG APPLES,10,2.08,20.8,2011,August,Thursday,1 PM,Weekday
JUMBO BAG RED RETROSPOT,10,2.08,20.8,2011,August,Thursday,1 PM,Weekday
JUMBO BAG SPACEBOY DESIGN,10,2.08,20.8,2011,August,Thursday,1 PM,Weekday
JUMBO BAG VINTAGE DOILY,20,2.08,41.6,2011,August,Thursday,1 PM,Weekday
JUMBO SHOPPER VINTAGE RED PAISLEY,10,2.08,20.8,2011,August,Thursday,1 PM,Weekday
LUNCH BAG APPLE DESIGN,10,1.65,16.5,2011,August,Thursday,1 PM,Weekday
LUNCH BAG SPACEBOY DESIGN,10,1.65,16.5,2011,August,Thursday,1 PM,Weekday
LUNCH BAG VINTAGE DOILY,10,1.65,16.5,2011,August,Thursday,1 PM,Weekday
PLASTERS IN TIN CIRCUS PARADE,12,1.65,19.8,2011,August,Thursday,1 PM,Weekday
PLASTERS IN TIN SPACEBOY,12,1.65,19.8,2011,August,Thursday,1 PM,Weekday
PLASTERS IN TIN WOODLAND ANIMALS,12,1.65,19.8,2011,August,Thursday,1 PM,Weekday
POPCORN HOLDER,12,0.85,10.2,2011,August,Thursday,1 PM,Weekday
POSTAGE,2,18.0,36.0,2011,August,Thursday,1 PM,Weekday
RED RETROSPOT UMBRELLA,3,5.95,17.85,2011,August,Thursday,1 PM,Weekday
RED TOADSTOOL LED NIGHT LIGHT,12,1.65,19.8,2011,August,Thursday,1 PM,Weekday
SET OF 4 KNICK KNACK TINS LONDON,6,4.15,24.9,2011,August,Thursday,1 PM,Weekday
SET OF SALT AND PEPPER TOADSTOOLS,12,1.25,15.0,2011,August,Thursday,1 PM,Weekday
SPOTTY BUNTING,3,4.95,14.85,2011,August,Thursday,1 PM,Weekday
WATERING CAN PINK BUNNY,6,1.95,11.7,2011,August,Thursday,1 PM,Weekday
BAG 125g SWIRLY MARBLES,12,0.42,5.04,2011,August,Thursday,3 PM,Weekday
BIRD HOUSE HOT WATER BOTTLE,6,2.55,15.3,2011,August,Thursday,3 PM,Weekday
CHICK GREY HOT WATER BOTTLE,4,3.45,13.8,2011,August,Thursday,3 PM,Weekday
CIRCUS PARADE LUNCH BOX,12,1.95,23.4,2011,August,Thursday,3 PM,Weekday
GINGHAM HEART DECORATION,12,0.85,10.2,2011,August,Thursday,3 PM,Weekday
HAIRCLIPS FORTIES FABRIC ASSORTED,12,0.65,7.8,2011,August,Thursday,3 PM,Weekday
HOME BUILDING BLOCK WORD,3,5.95,17.85,2011,August,Thursday,3 PM,Weekday
LETS GO SHOPPING COTTON TOTE BAG,6,2.25,13.5,2011,August,Thursday,3 PM,Weekday
LOVE HOT WATER BOTTLE,3,5.95,17.85,2011,August,Thursday,3 PM,Weekday
POSTAGE,2,18.0,36.0,2011,August,Thursday,3 PM,Weekday
RED GINGHAM ROSE JEWELLERY BOX,8,1.95,15.6,2011,August,Thursday,3 PM,Weekday
REGENCY CAKESTAND 3 TIER,1,12.75,12.75,2011,August,Thursday,3 PM,Weekday
RETROSPOT HEART HOT WATER BOTTLE,6,4.95,29.7,2011,August,Thursday,3 PM,Weekday
RETROSPOT SMALL TUBE MATCHES,20,1.65,33.0,2011,August,Thursday,3 PM,Weekday
SAVE THE PLANET COTTON TOTE BAG,6,2.25,13.5,2011,August,Thursday,3 PM,Weekday
SET OF 3 NOTEBOOKS IN PARCEL,12,1.65,19.8,2011,August,Thursday,3 PM,Weekday
SET/3 RED GINGHAM ROSE STORAGE BOX,4,3.75,15.0,2011,August,Thursday,3 PM,Weekday
SPACEBOY LUNCH BOX,12,1.95,23.4,2011,August,Thursday,3 PM,Weekday
WOODLAND  HEIGHT CHART STICKERS,6,2.95,17.7,2011,August,Thursday,3 PM,Weekday
BISCUIT TIN VINTAGE GREEN,2,6.75,13.5,2011,August,Friday,3 PM,Weekday
BISCUIT TIN VINTAGE RED,2,6.75,13.5,2011,August,Friday,3 PM,Weekday
CHILDREN'S CIRCUS PARADE MUG,12,1.65,19.8,2011,August,Friday,3 PM,Weekday
CHILDREN'S SPACEBOY MUG,12,1.65,19.8,2011,August,Friday,3 PM,Weekday
CHILDRENS DOLLY GIRL MUG,12,1.65,19.8,2011,August,Friday,3 PM,Weekday
CHILDRENS TOY COOKING UTENSIL SET,6,2.08,12.48,2011,August,Friday,3 PM,Weekday
CIRCUS PARADE CHILDRENS EGG CUP,12,1.25,15.0,2011,August,Friday,3 PM,Weekday
CIRCUS PARADE LUNCH BOX,12,1.95,23.4,2011,August,Friday,3 PM,Weekday
DOLLY GIRL BEAKER,12,1.25,15.0,2011,August,Friday,3 PM,Weekday
FELT EGG COSY CHICKEN,24,0.85,20.4,2011,August,Friday,3 PM,Weekday
LOVELY BONBON STICKER SHEET,12,0.85,10.2,2011,August,Friday,3 PM,Weekday
MULTICOLOUR  CONFETTI IN TUBE,12,1.65,19.8,2011,August,Friday,3 PM,Weekday
PACK OF 20 NAPKINS RED APPLES,12,0.85,10.2,2011,August,Friday,3 PM,Weekday
PACK OF 20 SKULL PAPER NAPKINS,12,0.85,10.2,2011,August,Friday,3 PM,Weekday
PACK OF 6 SKULL PAPER CUPS,12,0.65,7.8,2011,August,Friday,3 PM,Weekday
PACK OF 6 SKULL PAPER PLATES,12,0.85,10.2,2011,August,Friday,3 PM,Weekday
PARTY BUNTING,4,4.95,19.8,2011,August,Friday,3 PM,Weekday
PINK  HEART CONFETTI IN TUBE,12,1.65,19.8,2011,August,Friday,3 PM,Weekday
POSTAGE,6,18.0,108.0,2011,August,Friday,3 PM,Weekday
REGENCY CAKESTAND 3 TIER,16,10.95,175.2,2011,August,Friday,3 PM,Weekday
ROUND WHITE CONFETTI IN TUBE,12,1.65,19.8,2011,August,Friday,3 PM,Weekday
RUSTIC STRAWBERRY JAM POT SMALL,12,1.65,19.8,2011,August,Friday,3 PM,Weekday
SET 40 HEART SHAPE PETIT FOUR CASES,16,1.65,26.4,2011,August,Friday,3 PM,Weekday
SET OF 12 FAIRY CAKE BAKING CASES,8,0.83,6.64,2011,August,Friday,3 PM,Weekday
SET OF 2 TEA TOWELS APPLE AND PEARS,6,3.25,19.5,2011,August,Friday,3 PM,Weekday
SET OF 20 KIDS COOKIE CUTTERS,12,2.1,25.2,2011,August,Friday,3 PM,Weekday
SET OF 5 MINI GROCERY MAGNETS,12,2.08,24.96,2011,August,Friday,3 PM,Weekday
SET OF 5 PANCAKE DAY MAGNETS,36,2.08,74.88,2011,August,Friday,3 PM,Weekday
SET OF 6 TEA TIME BAKING CASES,8,1.25,10.0,2011,August,Friday,3 PM,Weekday
SET OF 9 BLACK SKULL BALLOONS,20,0.85,17.0,2011,August,Friday,3 PM,Weekday
SET OF 9 HEART SHAPED BALLOONS,90,1.06,95.4,2011,August,Friday,3 PM,Weekday
SET/20 RED RETROSPOT PAPER NAPKINS,12,0.85,10.2,2011,August,Friday,3 PM,Weekday
SET/6 RED SPOTTY PAPER CUPS,12,0.65,7.8,2011,August,Friday,3 PM,Weekday
SET/6 RED SPOTTY PAPER PLATES,12,0.85,10.2,2011,August,Friday,3 PM,Weekday
SPACEBOY BEAKER,12,1.25,15.0,2011,August,Friday,3 PM,Weekday
SPACEBOY CHILDRENS EGG CUP,12,1.25,15.0,2011,August,Friday,3 PM,Weekday
SPOTTY BUNTING,3,4.95,14.85,2011,August,Friday,3 PM,Weekday
STORAGE TIN VINTAGE DOILY,6,2.89,17.34,2011,August,Friday,3 PM,Weekday
TEA PARTY  WRAPPING PAPER,25,0.42,10.5,2011,August,Friday,3 PM,Weekday
VINTAGE RED ENAMEL TRIM JUG,4,3.75,15.0,2011,August,Friday,3 PM,Weekday
VINTAGE RED ENAMEL TRIM MUG,12,1.25,15.0,2011,August,Friday,3 PM,Weekday
VINTAGE RED ENAMEL TRIM PLATE,12,1.65,19.8,2011,August,Friday,3 PM,Weekday
VINTAGE RED TRIM ENAMEL BOWL,12,1.25,15.0,2011,August,Friday,3 PM,Weekday
WHITE HEART CONFETTI IN TUBE,12,1.65,19.8,2011,August,Friday,3 PM,Weekday
WRAP  VINTAGE DOILY,25,0.42,10.5,2011,August,Friday,3 PM,Weekday
WRAP DOLLY GIRL,25,0.42,10.5,2011,August,Friday,3 PM,Weekday
WRAP GREEN PEARS,25,0.42,10.5,2011,August,Friday,3 PM,Weekday
WRAP RED APPLES,25,0.42,10.5,2011,August,Friday,3 PM,Weekday
POSTAGE,1,145.0,145.0,2011,August,Wednesday,10 AM,Weekday
ALARM CLOCK BAKELIKE GREEN,20,3.75,75.0,2011,August,Wednesday,11 AM,Weekday
ALARM CLOCK BAKELIKE PINK,20,3.75,75.0,2011,August,Wednesday,11 AM,Weekday
PLASTERS IN TIN CIRCUS PARADE,60,1.65,99.0,2011,August,Wednesday,11 AM,Weekday
PLASTERS IN TIN SPACEBOY,60,1.65,99.0,2011,August,Wednesday,11 AM,Weekday
PLASTERS IN TIN WOODLAND ANIMALS,60,1.65,99.0,2011,August,Wednesday,11 AM,Weekday
RABBIT NIGHT LIGHT,288,1.79,515.52,2011,August,Wednesday,11 AM,Weekday
SET 40 HEART SHAPE PETIT FOUR CASES,96,1.65,158.4,2011,August,Wednesday,11 AM,Weekday
SET OF 12 FAIRY CAKE BAKING CASES,72,0.83,59.76,2011,August,Wednesday,11 AM,Weekday
SET OF 12 MINI LOAF BAKING CASES,72,0.83,59.76,2011,August,Wednesday,11 AM,Weekday
SET OF 6 TEA TIME BAKING CASES,72,1.25,90.0,2011,August,Wednesday,11 AM,Weekday
POSTAGE,2,18.0,36.0,2011,August,Wednesday,12 PM,Weekday
RABBIT NIGHT LIGHT,120,1.79,214.8,2011,August,Wednesday,12 PM,Weekday
CHILDRENS CUTLERY POLKADOT PINK,4,4.15,16.6,2011,August,Wednesday,12 PM,Weekday
CHILDRENS CUTLERY RETROSPOT RED,4,4.15,16.6,2011,August,Wednesday,12 PM,Weekday
DOORMAT RED RETROSPOT,2,7.95,15.9,2011,August,Wednesday,12 PM,Weekday
JUMBO BAG APPLES,20,2.08,41.6,2011,August,Wednesday,12 PM,Weekday
JUMBO BAG PEARS,10,2.08,20.8,2011,August,Wednesday,12 PM,Weekday
JUMBO BAG RED RETROSPOT,20,2.08,41.6,2011,August,Wednesday,12 PM,Weekday
JUMBO BAG SPACEBOY DESIGN,10,2.08,20.8,2011,August,Wednesday,12 PM,Weekday
JUMBO BAG VINTAGE DOILY,10,2.08,20.8,2011,August,Wednesday,12 PM,Weekday
JUMBO BAG VINTAGE LEAF,10,2.08,20.8,2011,August,Wednesday,12 PM,Weekday
JUMBO BAG WOODLAND ANIMALS,10,2.08,20.8,2011,August,Wednesday,12 PM,Weekday
LUNCH BOX WITH CUTLERY RETROSPOT,6,2.55,15.3,2011,August,Wednesday,12 PM,Weekday
PAPER BUNTING RETROSPOT,6,2.95,17.7,2011,August,Wednesday,12 PM,Weekday
POSTAGE,3,18.0,54.0,2011,August,Wednesday,12 PM,Weekday
RABBIT NIGHT LIGHT,24,1.79,42.96,2011,August,Wednesday,12 PM,Weekday
RECYCLING BAG RETROSPOT,5,2.1,10.5,2011,August,Wednesday,12 PM,Weekday
RED RETROSPOT CUP,8,0.85,6.8,2011,August,Wednesday,12 PM,Weekday
RED TOADSTOOL LED NIGHT LIGHT,12,1.65,19.8,2011,August,Wednesday,12 PM,Weekday
SET/20 RED RETROSPOT PAPER NAPKINS,12,0.85,10.2,2011,August,Wednesday,12 PM,Weekday
WRAP RED APPLES,25,0.42,10.5,2011,August,Wednesday,12 PM,Weekday
BLACK/BLUE POLKADOT UMBRELLA,6,5.95,35.7,2011,September,Friday,9 AM,Weekday
CIRCUS PARADE LUNCH BOX,12,1.95,23.4,2011,September,Friday,9 AM,Weekday
CUTE CATS TAPE,12,0.65,7.8,2011,September,Friday,9 AM,Weekday
GIRAFFE WOODEN RULER,12,1.95,23.4,2011,September,Friday,9 AM,Weekday
ICE CREAM BUBBLES,20,0.83,16.6,2011,September,Friday,9 AM,Weekday
LUNCH BAG APPLE DESIGN,10,1.65,16.5,2011,September,Friday,9 AM,Weekday
LUNCH BAG RED RETROSPOT,10,1.65,16.5,2011,September,Friday,9 AM,Weekday
LUNCH BAG SPACEBOY DESIGN,10,1.65,16.5,2011,September,Friday,9 AM,Weekday
LUNCH BAG WOODLAND,10,1.65,16.5,2011,September,Friday,9 AM,Weekday
LUNCH BOX I LOVE LONDON,12,1.95,23.4,2011,September,Friday,9 AM,Weekday
LUNCH BOX WITH CUTLERY RETROSPOT,12,2.55,30.6,2011,September,Friday,9 AM,Weekday
POSTAGE,3,18.0,54.0,2011,September,Friday,9 AM,Weekday
RABBIT NIGHT LIGHT,6,2.08,12.48,2011,September,Friday,9 AM,Weekday
RED RETROSPOT TAPE,12,0.65,7.8,2011,September,Friday,9 AM,Weekday
RED RETROSPOT UMBRELLA,6,5.95,35.7,2011,September,Friday,9 AM,Weekday
RED TOADSTOOL LED NIGHT LIGHT,36,1.65,59.4,2011,September,Friday,9 AM,Weekday
REVOLVER WOODEN RULER,12,1.95,23.4,2011,September,Friday,9 AM,Weekday
SPACEBOY LUNCH BOX,12,1.95,23.4,2011,September,Friday,9 AM,Weekday
STARS GIFT TAPE,12,0.65,7.8,2011,September,Friday,9 AM,Weekday
STRAWBERRY LUNCH BOX WITH CUTLERY,12,2.55,30.6,2011,September,Friday,9 AM,Weekday
TOADSTOOL BEDSIDE LIGHT,6,8.95,53.7,2011,September,Friday,9 AM,Weekday
TOADSTOOL MONEY BOX,18,2.95,53.1,2011,September,Friday,9 AM,Weekday
WOODEN SCHOOL COLOURING SET,12,1.65,19.8,2011,September,Friday,9 AM,Weekday
PACK OF 6 SKULL PAPER CUPS,12,0.65,7.8,2011,September,Friday,1 PM,Weekday
PASTEL COLOUR HONEYCOMB FAN,12,0.39,4.68,2011,September,Friday,1 PM,Weekday
POSTAGE,2,18.0,36.0,2011,September,Friday,1 PM,Weekday
RED RETROSPOT CAKE STAND,6,10.95,65.7,2011,September,Friday,1 PM,Weekday
REGENCY CAKESTAND 3 TIER,6,12.75,76.5,2011,September,Friday,1 PM,Weekday
RETROSPOT PARTY BAG + STICKER SET,8,1.65,13.2,2011,September,Friday,1 PM,Weekday
SET/10 RED POLKADOT PARTY CANDLES,24,1.25,30.0,2011,September,Friday,1 PM,Weekday
SET/20 RED RETROSPOT PAPER NAPKINS,24,0.85,20.4,2011,September,Friday,1 PM,Weekday
SKULL LUNCH BOX WITH CUTLERY,6,2.55,15.3,2011,September,Friday,1 PM,Weekday
BLUE POLKADOT BOWL,8,1.25,10.0,2011,September,Friday,1 PM,Weekday
CHARLOTTE BAG PINK POLKADOT,10,0.85,8.5,2011,September,Friday,1 PM,Weekday
PARTY INVITES WOODLAND,12,0.85,10.2,2011,September,Friday,1 PM,Weekday
RED RETROSPOT BOWL,8,1.25,10.0,2011,September,Friday,1 PM,Weekday
WOODLAND PARTY BAG + STICKER SET,16,1.65,26.4,2011,September,Friday,1 PM,Weekday
12 PENCILS TALL TUBE RED RETROSPOT,12,0.85,10.2,2011,September,Sunday,2 PM,Weekend
12 PENCILS TALL TUBE WOODLAND,12,0.85,10.2,2011,September,Sunday,2 PM,Weekend
AIRLINE BAG VINTAGE JET SET RED,4,4.25,17.0,2011,September,Sunday,2 PM,Weekend
AIRLINE BAG VINTAGE TOKYO 78,4,4.25,17.0,2011,September,Sunday,2 PM,Weekend
ASSORTED COLOUR BIRD ORNAMENT,16,1.69,27.04,2011,September,Sunday,2 PM,Weekend
ASSORTED COLOURS SILK FAN,12,0.83,9.96,2011,September,Sunday,2 PM,Weekend
ASSORTED TUTTI FRUTTI MIRROR,12,1.25,15.0,2011,September,Sunday,2 PM,Weekend
ASSTD DESIGN RACING CAR PEN,16,1.69,27.04,2011,September,Sunday,2 PM,Weekend
BUFFALO BILL TREASURE BOOK BOX,8,2.25,18.0,2011,September,Sunday,2 PM,Weekend
BUNDLE OF 3 RETRO NOTE BOOKS,12,1.65,19.8,2011,September,Sunday,2 PM,Weekend
CAMOUFLAGE LED TORCH,12,1.69,20.28,2011,September,Sunday,2 PM,Weekend
CHILDRENS CUTLERY DOLLY GIRL,4,4.15,16.6,2011,September,Sunday,2 PM,Weekend
CHILDRENS CUTLERY SPACEBOY,4,4.15,16.6,2011,September,Sunday,2 PM,Weekend
DOLLY GIRL BEAKER,12,1.25,15.0,2011,September,Sunday,2 PM,Weekend
DOLLY GIRL CHILDRENS BOWL,8,1.25,10.0,2011,September,Sunday,2 PM,Weekend
DOLLY GIRL CHILDRENS CUP,8,1.25,10.0,2011,September,Sunday,2 PM,Weekend
GYMKHANA TREASURE BOOK BOX,8,2.25,18.0,2011,September,Sunday,2 PM,Weekend
ICE CREAM PEN LIP GLOSS,24,1.25,30.0,2011,September,Sunday,2 PM,Weekend
