Description,Quantity,UnitPrice,Revenue,Year,Month,DayOfWeek,Hour,Weekday
ALARM CLOCK BAKELIKE GREEN,12,3.75,45.0,2010,December,Wednesday,8 AM,Weekday
ALARM CLOCK BAKELIKE PINK,24,3.75,90.0,2010,December,Wednesday,8 AM,Weekday
ALARM CLOCK BAKELIKE RED,24,3.75,90.0,2010,December,Wednesday,8 AM,Weekday
CHARLOTTE BAG DOLLY GIRL DESIGN,20,0.85,17.0,2010,December,Wednesday,8 AM,Weekday
CIRCUS PARADE LUNCH BOX,24,1.95,46.8,2010,December,Wednesday,8 AM,Weekday
INFLATABLE POLITICAL GLOBE,48,0.85,40.8,2010,December,Wednesday,8 AM,Weekday
LUNCH BOX I LOVE LONDON,24,1.95,46.8,2010,December,Wednesday,8 AM,Weekday
MINI JIGSAW CIRCUS PARADE,24,0.42,10.08,2010,December,Wednesday,8 AM,Weekday
MINI JIGSAW SPACEBOY,24,0.42,10.08,2010,December,Wednesday,8 AM,Weekday
MINI PAINT SET VINTAGE,36,0.65,23.4,2010,December,Wednesday,8 AM,Weekday
PANDA AND BUNNIES STICKER SHEET,12,0.85,10.2,2010,December,Wednesday,8 AM,Weekday
POSTAGE,3,18.0,54.0,2010,December,Wednesday,8 AM,Weekday
RED TOADSTOOL LED NIGHT LIGHT,24,1.65,39.6,2010,December,Wednesday,8 AM,Weekday
ROUND SNACK BOXES SET OF4 WOODLAND,24,2.95,70.8,2010,December,Wednesday,8 AM,Weekday
SET 2 TEA TOWELS I LOVE LONDON,24,2.95,70.8,2010,December,Wednesday,8 AM,Weekday
SET/2 RED RETROSPOT TEA TOWELS,18,2.95,53.1,2010,December,Wednesday,8 AM,Weekday
SPACEBOY LUNCH BOX,24,1.95,46.8,2010,December,Wednesday,8 AM,Weekday
STARS GIFT TAPE,24,0.65,15.6,2010,December,Wednesday,8 AM,Weekday
VINTAGE HEADS AND TAILS CARD GAME,24,1.25,30.0,2010,December,Wednesday,8 AM,Weekday
VINTAGE SEASIDE JIGSAW PUZZLES,12,3.75,45.0,2010,December,Wednesday,8 AM,Weekday
CHARLOTTE BAG DOLLY GIRL DESIGN,10,0.85,8.5,2010,December,Friday,9 AM,Weekday
MINI JIGSAW DOLLY GIRL,24,0.42,10.08,2010,December,Friday,9 AM,Weekday
MINI JIGSAW SPACEBOY,24,0.42,10.08,2010,December,Friday,9 AM,Weekday
PICTURE DOMINOES,12,1.45,17.4,2010,December,Friday,9 AM,Weekday
POLKADOT RAIN HAT,24,0.42,10.08,2010,December,Friday,9 AM,Weekday
POSTAGE,1,18.0,18.0,2010,December,Friday,9 AM,Weekday
VINTAGE HEADS AND TAILS CARD GAME,12,1.25,15.0,2010,December,Friday,9 AM,Weekday
ASSORTED COLOUR MINI CASES,2,7.95,15.9,2010,December,Friday,1 PM,Weekday
BIG DOUGHNUT FRIDGE MAGNETS,12,0.85,10.2,2010,December,Friday,1 PM,Weekday
EDWARDIAN PARASOL BLACK,9,5.95,53.55,2010,December,Friday,1 PM,Weekday
EDWARDIAN PARASOL PINK,3,5.95,17.85,2010,December,Friday,1 PM,Weekday
EDWARDIAN PARASOL RED,6,5.95,35.7,2010,December,Friday,1 PM,Weekday
LUNCH BAG RED RETROSPOT,10,1.65,16.5,2010,December,Friday,1 PM,Weekday
LUNCH BAG WOODLAND,10,1.65,16.5,2010,December,Friday,1 PM,Weekday
LUNCH BOX I LOVE LONDON,12,1.95,23.4,2010,December,Friday,1 PM,Weekday
LUNCH BOX WITH CUTLERY RETROSPOT,12,2.55,30.6,2010,December,Friday,1 PM,Weekday
POPPY'S PLAYHOUSE KITCHEN,6,2.1,12.6,2010,December,Friday,1 PM,Weekday
POSTAGE,2,18.0,36.0,2010,December,Friday,1 PM,Weekday
RED  HARMONICA IN BOX,12,1.25,15.0,2010,December,Friday,1 PM,Weekday
RED RETROSPOT MINI CASES,2,7.95,15.9,2010,December,Friday,1 PM,Weekday
RIBBON REEL POLKADOTS,10,1.65,16.5,2010,December,Friday,1 PM,Weekday
SET OF SALT AND PEPPER TOADSTOOLS,12,1.25,15.0,2010,December,Friday,1 PM,Weekday
TEA PARTY BIRTHDAY CARD,12,0.42,5.04,2010,December,Friday,1 PM,Weekday
5 HOOK HANGER RED MAGIC TOADSTOOL,12,1.65,19.8,2010,December,Sunday,11 AM,Weekend
ALARM CLOCK BAKELIKE GREEN,4,3.75,15.0,2010,December,Sunday,11 AM,Weekend
ALARM CLOCK BAKELIKE ORANGE,4,3.75,15.0,2010,December,Sunday,11 AM,Weekend
ALARM CLOCK BAKELIKE PINK,4,3.75,15.0,2010,December,Sunday,11 AM,Weekend
ALARM CLOCK BAKELIKE RED,4,3.75,15.0,2010,December,Sunday,11 AM,Weekend
ASSORTED COLOUR MINI CASES,2,7.95,15.9,2010,December,Sunday,11 AM,Weekend
BASKET OF TOADSTOOLS,12,1.25,15.0,2010,December,Sunday,11 AM,Weekend
BLUE 3 PIECE POLKADOT CUTLERY SET,6,3.75,22.5,2010,December,Sunday,11 AM,Weekend
BLUE GEISHA GIRL,4,3.75,15.0,2010,December,Sunday,11 AM,Weekend
BREAD BIN DINER STYLE RED,1,16.95,16.95,2010,December,Sunday,11 AM,Weekend
CERAMIC CHERRY CAKE MONEY BANK,12,1.45,17.4,2010,December,Sunday,11 AM,Weekend
CERAMIC STRAWBERRY MONEY BOX,6,2.55,15.3,2010,December,Sunday,11 AM,Weekend
CERAMIC STRAWBERRY TRINKET TRAY,6,2.55,15.3,2010,December,Sunday,11 AM,Weekend
CHERRY BLOSSOM  DECORATIVE FLASK,4,3.75,15.0,2010,December,Sunday,11 AM,Weekend
CHILDS BREAKFAST SET CIRCUS PARADE,2,8.5,17.0,2010,December,Sunday,11 AM,Weekend
CHILDS BREAKFAST SET DOLLY GIRL,2,9.95,19.9,2010,December,Sunday,11 AM,Weekend
CHILDS BREAKFAST SET SPACEBOY,2,9.95,19.9,2010,December,Sunday,11 AM,Weekend
CLASSICAL ROSE SMALL VASE,6,2.55,15.3,2010,December,Sunday,11 AM,Weekend
DECORATIVE CATS BATHROOM BOTTLE,12,1.25,15.0,2010,December,Sunday,11 AM,Weekend
DINOSAUR KEYRINGS ASSORTED,36,0.21,7.56,2010,December,Sunday,11 AM,Weekend
FIVE HEART HANGING DECORATION,6,2.95,17.7,2010,December,Sunday,11 AM,Weekend
GREEN 3 PIECE POLKADOT CUTLERY SET,6,3.75,22.5,2010,December,Sunday,11 AM,Weekend
GREEN GEISHA GIRL,4,3.75,15.0,2010,December,Sunday,11 AM,Weekend
GUMBALL COAT RACK,6,2.55,15.3,2010,December,Sunday,11 AM,Weekend
HAND WARMER RED RETROSPOT,12,2.1,25.2,2010,December,Sunday,11 AM,Weekend
HOT WATER BOTTLE BABUSHKA,8,4.65,37.2,2010,December,Sunday,11 AM,Weekend
LUNCH BAG CARS BLUE,10,1.65,16.5,2010,December,Sunday,11 AM,Weekend
LUNCH BAG RED RETROSPOT,10,1.65,16.5,2010,December,Sunday,11 AM,Weekend
LUNCH BAG WOODLAND,20,1.65,33.0,2010,December,Sunday,11 AM,Weekend
LUNCH BOX WITH CUTLERY RETROSPOT,6,2.55,15.3,2010,December,Sunday,11 AM,Weekend
NURSE'S BAG SOFT TOY,6,8.95,53.7,2010,December,Sunday,11 AM,Weekend
PACK OF 12 CIRCUS PARADE TISSUES,24,0.29,6.96,2010,December,Sunday,11 AM,Weekend
PACK OF 12 RED RETROSPOT TISSUES,24,0.29,6.96,2010,December,Sunday,11 AM,Weekend
PACK OF 12 SPACEBOY TISSUES,24,0.29,6.96,2010,December,Sunday,11 AM,Weekend
PACK OF 12 SUKI TISSUES,24,0.29,6.96,2010,December,Sunday,11 AM,Weekend
PACK OF 12 WOODLAND TISSUES,24,0.29,6.96,2010,December,Sunday,11 AM,Weekend
PAPERWEIGHT CHILDHOOD MEMORIES,6,2.55,15.3,2010,December,Sunday,11 AM,Weekend
PARTY BUNTING,5,4.65,23.25,2010,December,Sunday,11 AM,Weekend
PARTY TIME PENCIL ERASERS,28,0.21,5.88,2010,December,Sunday,11 AM,Weekend
PINK  HONEYCOMB PAPER BALL,6,2.1,12.6,2010,December,Sunday,11 AM,Weekend
PINK PAINTED KASHMIRI CHAIR,4,42.95,171.8,2010,December,Sunday,11 AM,Weekend
PLASTERS IN TIN SPACEBOY,12,1.65,19.8,2010,December,Sunday,11 AM,Weekend
PLASTERS IN TIN WOODLAND ANIMALS,12,1.65,19.8,2010,December,Sunday,11 AM,Weekend
POLKADOT RAIN HAT,24,0.42,10.08,2010,December,Sunday,11 AM,Weekend
POSTAGE,9,18.0,162.0,2010,December,Sunday,11 AM,Weekend
RAIN PONCHO RETROSPOT,24,0.85,20.4,2010,December,Sunday,11 AM,Weekend
RED 3 PIECE RETROSPOT CUTLERY SET,6,3.75,22.5,2010,December,Sunday,11 AM,Weekend
RED GINGHAM TEDDY BEAR,6,2.95,17.7,2010,December,Sunday,11 AM,Weekend
RED RETROSPOT BUTTER DISH,3,4.95,14.85,2010,December,Sunday,11 AM,Weekend
RED RETROSPOT MINI CASES,6,7.95,47.7,2010,December,Sunday,11 AM,Weekend
RED RETROSPOT PURSE,6,2.95,17.7,2010,December,Sunday,11 AM,Weekend
REGENCY CAKESTAND 3 TIER,2,12.75,25.5,2010,December,Sunday,11 AM,Weekend
RETROSPOT LAMP,4,9.95,39.8,2010,December,Sunday,11 AM,Weekend
RETROSPOT LARGE MILK JUG,3,4.95,14.85,2010,December,Sunday,11 AM,Weekend
ROSE COTTAGE KEEPSAKE BOX,8,8.5,68.0,2010,December,Sunday,11 AM,Weekend
ROUND SNACK BOXES SET OF4 WOODLAND,6,2.95,17.7,2010,December,Sunday,11 AM,Weekend
SET OF 6 3D KIT CARDS FOR KIDS,12,0.85,10.2,2010,December,Sunday,11 AM,Weekend
SET OF 6 SOLDIER SKITTLES,4,3.75,15.0,2010,December,Sunday,11 AM,Weekend
SET OF SALT AND PEPPER TOADSTOOLS,12,1.25,15.0,2010,December,Sunday,11 AM,Weekend
SET/10 RED POLKADOT PARTY CANDLES,24,1.25,30.0,2010,December,Sunday,11 AM,Weekend
STRAWBERRY LUNCH BOX WITH CUTLERY,6,2.55,15.3,2010,December,Sunday,11 AM,Weekend
TOOL BOX SOFT TOY,6,8.95,53.7,2010,December,Sunday,11 AM,Weekend
TRADITIONAL WOODEN CATCH CUP GAME,12,1.25,15.0,2010,December,Sunday,11 AM,Weekend
BIG DOUGHNUT FRIDGE MAGNETS,12,0.85,10.2,2010,December,Tuesday,10 AM,Weekday
BLACK RECORD COVER FRAME,4,3.75,15.0,2010,December,Tuesday,10 AM,Weekday
BOOM BOX SPEAKER BOYS,4,5.95,23.8,2010,December,Tuesday,10 AM,Weekday
BOX OF 24 COCKTAIL PARASOLS,25,0.42,10.5,2010,December,Tuesday,10 AM,Weekday
CANDY SHOP  STICKER SHEET,12,0.85,10.2,2010,December,Tuesday,10 AM,Weekday
COFFEE MUG CAT + BIRD DESIGN,18,2.55,45.9,2010,December,Tuesday,10 AM,Weekday
COFFEE MUG DOG + BALL DESIGN,12,2.55,30.6,2010,December,Tuesday,10 AM,Weekday
DOORMAT RESPECTABLE HOUSE,2,7.95,15.9,2010,December,Tuesday,10 AM,Weekday
"FANCY FONT BIRTHDAY CARD, ",12,0.42,5.04,2010,December,Tuesday,10 AM,Weekday
GUMBALL COAT RACK,36,2.1,75.6,2010,December,Tuesday,10 AM,Weekday
IVORY DINER WALL CLOCK,2,8.5,17.0,2010,December,Tuesday,10 AM,Weekday
JAM MAKING SET PRINTED,12,1.45,17.4,2010,December,Tuesday,10 AM,Weekday
LOVELY BONBON STICKER SHEET,12,0.85,10.2,2010,December,Tuesday,10 AM,Weekday
LUNCH BOX WITH CUTLERY RETROSPOT,6,2.55,15.3,2010,December,Tuesday,10 AM,Weekday
METAL SIGN TAKE IT OR LEAVE IT,6,2.95,17.7,2010,December,Tuesday,10 AM,Weekday
OFFICE MUG WARMER PINK,18,2.95,53.1,2010,December,Tuesday,10 AM,Weekday
OFFICE MUG WARMER POLKADOT,24,2.95,70.8,2010,December,Tuesday,10 AM,Weekday
PACK OF 20 NAPKINS RED APPLES,12,0.85,10.2,2010,December,Tuesday,10 AM,Weekday
PACK OF 72 RETROSPOT CAKE CASES,24,0.55,13.2,2010,December,Tuesday,10 AM,Weekday
PINK POLKADOT CHILDRENS UMBRELLA,6,3.25,19.5,2010,December,Tuesday,10 AM,Weekday
PLASTERS IN TIN WOODLAND ANIMALS,12,1.65,19.8,2010,December,Tuesday,10 AM,Weekday
POSTAGE,4,18.0,72.0,2010,December,Tuesday,10 AM,Weekday
"RECORD FRAME 7"" SINGLE SIZE ",6,2.55,15.3,2010,December,Tuesday,10 AM,Weekday
RED RETROSPOT CHILDRENS UMBRELLA,6,3.25,19.5,2010,December,Tuesday,10 AM,Weekday
RED RETROSPOT CUP,16,0.85,13.6,2010,December,Tuesday,10 AM,Weekday
RED TOADSTOOL LED NIGHT LIGHT,72,1.65,118.8,2010,December,Tuesday,10 AM,Weekday
ROBOT BIRTHDAY CARD,12,0.42,5.04,2010,December,Tuesday,10 AM,Weekday
ROUND SNACK BOXES SET OF4 WOODLAND,18,2.95,53.1,2010,December,Tuesday,10 AM,Weekday
SET OF 2 TEA TOWELS APPLE AND PEARS,6,2.95,17.7,2010,December,Tuesday,10 AM,Weekday
SET OF SALT AND PEPPER TOADSTOOLS,12,1.25,15.0,2010,December,Tuesday,10 AM,Weekday
SET/10 BLUE POLKADOT PARTY CANDLES,24,1.25,30.0,2010,December,Tuesday,10 AM,Weekday
SET/10 RED POLKADOT PARTY CANDLES,24,1.25,30.0,2010,December,Tuesday,10 AM,Weekday
SET/4 SKULL BADGES,10,1.25,12.5,2010,December,Tuesday,10 AM,Weekday
SKULLS  WATER TRANSFER TATTOOS,12,0.85,10.2,2010,December,Tuesday,10 AM,Weekday
SNOWSTORM PHOTO FRAME FRIDGE MAGNET,12,0.85,10.2,2010,December,Tuesday,10 AM,Weekday
STRAWBERRY LUNCH BOX WITH CUTLERY,6,2.55,15.3,2010,December,Tuesday,10 AM,Weekday
TABLECLOTH RED APPLES DESIGN,4,8.5,34.0,2010,December,Tuesday,10 AM,Weekday
TEA BAG PLATE RED RETROSPOT,36,0.85,30.6,2010,December,Tuesday,10 AM,Weekday
TEA PARTY BIRTHDAY CARD,12,0.42,5.04,2010,December,Tuesday,10 AM,Weekday
WOODLAND  STICKERS,12,0.85,10.2,2010,December,Tuesday,10 AM,Weekday
WOODLAND CHARLOTTE BAG,10,0.85,8.5,2010,December,Tuesday,10 AM,Weekday
10 COLOUR SPACEBOY PEN,24,0.85,20.4,2010,December,Tuesday,10 AM,Weekday
BIRD HOUSE HOT WATER BOTTLE,12,2.55,30.6,2010,December,Tuesday,10 AM,Weekday
CLOTHES PEGS RETROSPOT PACK 24,12,1.49,17.88,2010,December,Tuesday,10 AM,Weekday
DELUXE SEWING KIT,9,5.95,53.55,2010,December,Tuesday,10 AM,Weekday
FELTCRAFT DOLL MARIA,6,2.95,17.7,2010,December,Tuesday,10 AM,Weekday
FELTCRAFT PRINCESS CHARLOTTE DOLL,4,3.75,15.0,2010,December,Tuesday,10 AM,Weekday
FELTCRAFT PRINCESS LOLA DOLL,4,3.75,15.0,2010,December,Tuesday,10 AM,Weekday
GREY HEART HOT WATER BOTTLE,4,3.75,15.0,2010,December,Tuesday,10 AM,Weekday
HOT WATER BOTTLE BABUSHKA,4,4.65,18.6,2010,December,Tuesday,10 AM,Weekday
HOT WATER BOTTLE TEA AND SYMPATHY,4,3.95,15.8,2010,December,Tuesday,10 AM,Weekday
LUNCH BAG RED RETROSPOT,10,1.65,16.5,2010,December,Tuesday,10 AM,Weekday
LUNCH BAG SPACEBOY DESIGN,10,1.65,16.5,2010,December,Tuesday,10 AM,Weekday
LUNCH BAG SUKI  DESIGN,10,1.65,16.5,2010,December,Tuesday,10 AM,Weekday
MAGIC DRAWING SLATE CIRCUS PARADE,24,0.42,10.08,2010,December,Tuesday,10 AM,Weekday
POPPY'S PLAYHOUSE BATHROOM,6,2.1,12.6,2010,December,Tuesday,10 AM,Weekday
POPPY'S PLAYHOUSE BEDROOM,6,2.1,12.6,2010,December,Tuesday,10 AM,Weekday
POPPY'S PLAYHOUSE KITCHEN,6,2.1,12.6,2010,December,Tuesday,10 AM,Weekday
POSTAGE,3,18.0,54.0,2010,December,Tuesday,10 AM,Weekday
RETROSPOT HEART HOT WATER BOTTLE,6,4.95,29.7,2010,December,Tuesday,10 AM,Weekday
SCOTTIE DOG HOT WATER BOTTLE,3,4.95,14.85,2010,December,Tuesday,10 AM,Weekday
BLUE SCANDINAVIAN PAISLEY WRAP,25,0.42,10.5,2010,December,Wednesday,10 AM,Weekday
FAIRY CAKE BIRTHDAY CANDLE SET,4,3.75,15.0,2010,December,Wednesday,10 AM,Weekday
MAKE YOUR OWN MONSOON CARD KIT,6,2.95,17.7,2010,December,Wednesday,10 AM,Weekday
MAKE YOUR OWN PLAYTIME CARD KIT,6,2.95,17.7,2010,December,Wednesday,10 AM,Weekday
PAPER CHAIN KIT 50'S CHRISTMAS,6,2.95,17.7,2010,December,Wednesday,10 AM,Weekday
PAPER CHAIN KIT VINTAGE CHRISTMAS,6,2.95,17.7,2010,December,Wednesday,10 AM,Weekday
POSTAGE,1,18.0,18.0,2010,December,Wednesday,10 AM,Weekday
TEA TIME PARTY BUNTING,5,4.65,23.25,2010,December,Wednesday,10 AM,Weekday
TRADITIONAL CHRISTMAS RIBBONS,12,1.25,15.0,2010,December,Wednesday,10 AM,Weekday
VINTAGE CARAVAN GIFT WRAP,25,0.42,10.5,2010,December,Wednesday,10 AM,Weekday
WRAP I LOVE LONDON,25,0.42,10.5,2010,December,Wednesday,10 AM,Weekday
CHARLOTTE BAG DOLLY GIRL DESIGN,20,0.85,17.0,2010,December,Thursday,10 AM,Weekday
CHILDRENS DOLLY GIRL MUG,12,1.65,19.8,2010,December,Thursday,10 AM,Weekday
CHRISTMAS RETROSPOT ANGEL WOOD,12,0.85,10.2,2010,December,Thursday,10 AM,Weekday
CLOTHES PEGS RETROSPOT PACK 24,12,1.49,17.88,2010,December,Thursday,10 AM,Weekday
DOORMAT RED RETROSPOT,2,7.95,15.9,2010,December,Thursday,10 AM,Weekday
FAWN BLUE HOT WATER BOTTLE,6,2.95,17.7,2010,December,Thursday,10 AM,Weekday
FELT TOADSTOOL  SMALL,12,0.85,10.2,2010,December,Thursday,10 AM,Weekday
MEASURING TAPE BABUSHKA RED,6,2.95,17.7,2010,December,Thursday,10 AM,Weekday
POSTAGE,1,18.0,18.0,2010,December,Thursday,10 AM,Weekday
RED TOADSTOOL LED NIGHT LIGHT,12,1.65,19.8,2010,December,Thursday,10 AM,Weekday
RED WOOLLY HOTTIE WHITE HEART.,4,3.75,15.0,2010,December,Thursday,10 AM,Weekday
SET 7 BABUSHKA NESTING BOXES,2,8.5,17.0,2010,December,Thursday,10 AM,Weekday
SET OF 2 ROUND TINS CAMEMBERT,6,2.95,17.7,2010,December,Thursday,10 AM,Weekday
POSTAGE,1,18.0,18.0,2010,December,Thursday,11 AM,Weekday
RECIPE BOX RETROSPOT,6,2.95,17.7,2010,December,Thursday,11 AM,Weekday
RED RETROSPOT CAKE STAND,2,10.95,21.9,2010,December,Thursday,11 AM,Weekday
60 CAKE CASES DOLLY GIRL DESIGN,24,0.55,13.2,2010,December,Thursday,12 PM,Weekday
72 SWEETHEART FAIRY CAKE CASES,24,0.55,13.2,2010,December,Thursday,12 PM,Weekday
BLUE PARTY BAGS,12,2.1,25.2,2010,December,Thursday,12 PM,Weekday
CHILDREN'S APRON DOLLY GIRL,12,2.1,25.2,2010,December,Thursday,12 PM,Weekday
CHILDREN'S CIRCUS PARADE MUG,12,1.65,19.8,2010,December,Thursday,12 PM,Weekday
CHILDREN'S SPACEBOY MUG,12,1.65,19.8,2010,December,Thursday,12 PM,Weekday
CHILDRENS APRON APPLES DESIGN,8,1.95,15.6,2010,December,Thursday,12 PM,Weekday
CHILDRENS DOLLY GIRL MUG,12,1.65,19.8,2010,December,Thursday,12 PM,Weekday
CHILDS BREAKFAST SET CIRCUS PARADE,4,8.5,34.0,2010,December,Thursday,12 PM,Weekday
CIRCUS PARADE CHILDRENS EGG CUP,12,1.25,15.0,2010,December,Thursday,12 PM,Weekday
CUPCAKE LACE PAPER SET 6,12,1.95,23.4,2010,December,Thursday,12 PM,Weekday
DOLLY GIRL CHILDRENS EGG CUP,12,1.25,15.0,2010,December,Thursday,12 PM,Weekday
DOLLY GIRL LUNCH BOX,12,1.95,23.4,2010,December,Thursday,12 PM,Weekday
EASTER TIN BUNNY BOUQUET,6,1.65,9.9,2010,December,Thursday,12 PM,Weekday
LUNCH BOX WITH CUTLERY RETROSPOT,6,2.55,15.3,2010,December,Thursday,12 PM,Weekday
OVEN MITT APPLES DESIGN,10,1.45,14.5,2010,December,Thursday,12 PM,Weekday
PACK OF 20 NAPKINS PANTRY DESIGN,24,0.85,20.4,2010,December,Thursday,12 PM,Weekday
PACK OF 20 NAPKINS RED APPLES,24,0.85,20.4,2010,December,Thursday,12 PM,Weekday
PINK 3 PIECE POLKADOT CUTLERY SET,6,3.75,22.5,2010,December,Thursday,12 PM,Weekday
PINK CREAM FELT CRAFT TRINKET BOX,12,1.25,15.0,2010,December,Thursday,12 PM,Weekday
PINK PARTY BAGS,12,2.1,25.2,2010,December,Thursday,12 PM,Weekday
POSTAGE,5,18.0,90.0,2010,December,Thursday,12 PM,Weekday
RED RETROSPOT CAKE STAND,2,10.95,21.9,2010,December,Thursday,12 PM,Weekday
RED RETROSPOT OVEN GLOVE,10,1.25,12.5,2010,December,Thursday,12 PM,Weekday
RETROSPOT PARTY BAG + STICKER SET,16,1.65,26.4,2010,December,Thursday,12 PM,Weekday
SET OF 2 TEA TOWELS APPLE AND PEARS,6,2.95,17.7,2010,December,Thursday,12 PM,Weekday
SET OF 20 VINTAGE CHRISTMAS NAPKINS,12,0.85,10.2,2010,December,Thursday,12 PM,Weekday
SET OF 9 BLACK SKULL BALLOONS,20,0.85,17.0,2010,December,Thursday,12 PM,Weekday
SET OF 9 HEART SHAPED BALLOONS,12,1.25,15.0,2010,December,Thursday,12 PM,Weekday
SET/10 BLUE POLKADOT PARTY CANDLES,24,1.25,30.0,2010,December,Thursday,12 PM,Weekday
SET/10 IVORY POLKADOT PARTY CANDLES,24,1.25,30.0,2010,December,Thursday,12 PM,Weekday
SET/10 PINK POLKADOT PARTY CANDLES,24,1.25,30.0,2010,December,Thursday,12 PM,Weekday
SET/10 RED POLKADOT PARTY CANDLES,24,1.25,30.0,2010,December,Thursday,12 PM,Weekday
SET/6 RED SPOTTY PAPER CUPS,12,0.65,7.8,2010,December,Thursday,12 PM,Weekday
SET/6 RED SPOTTY PAPER PLATES,12,0.85,10.2,2010,December,Thursday,12 PM,Weekday
SPACEBOY CHILDRENS EGG CUP,12,1.25,15.0,2010,December,Thursday,12 PM,Weekday
STRAWBERRY LUNCH BOX WITH CUTLERY,6,2.55,15.3,2010,December,Thursday,12 PM,Weekday
TABLECLOTH RED APPLES DESIGN,2,8.5,17.0,2010,December,Thursday,12 PM,Weekday
WOODLAND PARTY BAG + STICKER SET,16,1.65,26.4,2010,December,Thursday,12 PM,Weekday
WRAP GREEN PEARS,25,0.42,10.5,2010,December,Thursday,12 PM,Weekday
WRAP RED APPLES,25,0.42,10.5,2010,December,Thursday,12 PM,Weekday
4 TRADITIONAL SPINNING TOPS,12,1.25,15.0,2010,December,Thursday,2 PM,Weekday
6 RIBBONS RUSTIC CHARM,12,1.65,19.8,2010,December,Thursday,2 PM,Weekday
ASSORTED COLOUR MINI CASES,2,7.95,15.9,2010,December,Thursday,2 PM,Weekday
BIG DOUGHNUT FRIDGE MAGNETS,12,0.85,10.2,2010,December,Thursday,2 PM,Weekday
BIRD DECORATION RED RETROSPOT,12,0.85,10.2,2010,December,Thursday,2 PM,Weekday
EDWARDIAN PARASOL BLACK,12,5.95,71.4,2010,December,Thursday,2 PM,Weekday
EDWARDIAN PARASOL RED,12,5.95,71.4,2010,December,Thursday,2 PM,Weekday
HAIRCLIPS FORTIES FABRIC ASSORTED,12,0.65,7.8,2010,December,Thursday,2 PM,Weekday
INFLATABLE POLITICAL GLOBE,12,0.85,10.2,2010,December,Thursday,2 PM,Weekday
JAM MAKING SET PRINTED,12,1.45,17.4,2010,December,Thursday,2 PM,Weekday
JUMBO BAG PINK POLKADOT,10,1.95,19.5,2010,December,Thursday,2 PM,Weekday
JUMBO BAG SPACEBOY DESIGN,10,1.95,19.5,2010,December,Thursday,2 PM,Weekday
LUNCH BAG RED RETROSPOT,10,1.65,16.5,2010,December,Thursday,2 PM,Weekday
LUNCH BAG SPACEBOY DESIGN,10,1.65,16.5,2010,December,Thursday,2 PM,Weekday
LUNCH BAG SUKI  DESIGN,10,1.65,16.5,2010,December,Thursday,2 PM,Weekday
LUNCH BAG WOODLAND,10,1.65,16.5,2010,December,Thursday,2 PM,Weekday
METAL DECORATION NAUGHTY CHILDREN,24,0.85,20.4,2010,December,Thursday,2 PM,Weekday
PLASTERS IN TIN CIRCUS PARADE,12,1.65,19.8,2010,December,Thursday,2 PM,Weekday
PLASTERS IN TIN SPACEBOY,12,1.65,19.8,2010,December,Thursday,2 PM,Weekday
PLASTERS IN TIN WOODLAND ANIMALS,12,1.65,19.8,2010,December,Thursday,2 PM,Weekday
POSTAGE,5,18.0,90.0,2010,December,Thursday,2 PM,Weekday
RED RETROSPOT MINI CASES,4,7.95,31.8,2010,December,Thursday,2 PM,Weekday
RED TOADSTOOL LED NIGHT LIGHT,12,1.65,19.8,2010,December,Thursday,2 PM,Weekday
RIBBON REEL MAKING SNOWMEN,10,1.65,16.5,2010,December,Thursday,2 PM,Weekday
RIBBON REEL SNOWY VILLAGE,10,1.65,16.5,2010,December,Thursday,2 PM,Weekday
RIBBON REEL STRIPES DESIGN,10,1.65,16.5,2010,December,Thursday,2 PM,Weekday
SET OF 20 VINTAGE CHRISTMAS NAPKINS,12,0.85,10.2,2010,December,Thursday,2 PM,Weekday
SET/3 DECOUPAGE STACKING TINS,3,4.95,14.85,2010,December,Thursday,2 PM,Weekday
SKULL LUNCH BOX WITH CUTLERY,6,2.55,15.3,2010,December,Thursday,2 PM,Weekday
SMALL POPCORN HOLDER,12,0.85,10.2,2010,December,Thursday,2 PM,Weekday
STRAWBERRY LUNCH BOX WITH CUTLERY,12,2.55,30.6,2010,December,Thursday,2 PM,Weekday
TOADSTOOL MONEY BOX,6,2.95,17.7,2010,December,Thursday,2 PM,Weekday
VINTAGE HEADS AND TAILS CARD GAME,12,1.25,15.0,2010,December,Thursday,2 PM,Weekday
ASSORTED COLOUR BIRD ORNAMENT,120,1.69,202.8,2010,December,Friday,10 AM,Weekday
BLUE HARMONICA IN BOX,24,1.25,30.0,2010,December,Friday,10 AM,Weekday
CLOTHES PEGS RETROSPOT PACK 24,24,1.49,35.76,2010,December,Friday,10 AM,Weekday
DOORMAT RED RETROSPOT,20,6.75,135.0,2010,December,Friday,10 AM,Weekday
DOORMAT UNION FLAG,20,6.75,135.0,2010,December,Friday,10 AM,Weekday
"ELEPHANT, BIRTHDAY CARD, ",12,0.42,5.04,2010,December,Friday,10 AM,Weekday
INFLATABLE POLITICAL GLOBE,36,0.85,30.6,2010,December,Friday,10 AM,Weekday
LUNCH BAG RED RETROSPOT,10,1.65,16.5,2010,December,Friday,10 AM,Weekday
PICTURE DOMINOES,24,1.45,34.8,2010,December,Friday,10 AM,Weekday
POSTAGE,8,18.0,144.0,2010,December,Friday,10 AM,Weekday
RED  HARMONICA IN BOX,24,1.25,30.0,2010,December,Friday,10 AM,Weekday
RED RETROSPOT CHILDRENS UMBRELLA,24,3.25,78.0,2010,December,Friday,10 AM,Weekday
RED RETROSPOT TRADITIONAL TEAPOT,12,6.95,83.4,2010,December,Friday,10 AM,Weekday
RETROSPOT LARGE MILK JUG,12,4.25,51.0,2010,December,Friday,10 AM,Weekday
TRADITIONAL MODELLING CLAY,24,1.25,30.0,2010,December,Friday,10 AM,Weekday
WOODEN BOX OF DOMINOES,24,1.25,30.0,2010,December,Friday,10 AM,Weekday
12 PENCILS TALL TUBE RED RETROSPOT,1,0.85,0.85,2010,December,Wednesday,4 PM,Weekday
6 RIBBONS EMPIRE,1,1.65,1.65,2010,December,Wednesday,4 PM,Weekday
AGED GLASS SILVER T-LIGHT HOLDER,12,0.65,7.8,2010,December,Wednesday,4 PM,Weekday
AIRLINE BAG VINTAGE JET SET BROWN,1,4.25,4.25,2010,December,Wednesday,4 PM,Weekday
AIRLINE BAG VINTAGE JET SET RED,1,4.25,4.25,2010,December,Wednesday,4 PM,Weekday
ANTIQUE ALL GLASS CANDLESTICK,2,2.1,4.2,2010,December,Wednesday,4 PM,Weekday
ANTIQUE GLASS PEDESTAL BOWL,1,3.75,3.75,2010,December,Wednesday,4 PM,Weekday
ANTIQUE SILVER TEA GLASS ENGRAVED,12,1.25,15.0,2010,December,Wednesday,4 PM,Weekday
ASSTD DESIGN 3D PAPER STICKERS,2,0.85,1.7,2010,December,Wednesday,4 PM,Weekday
BALLOONS  WRITING SET,1,1.65,1.65,2010,December,Wednesday,4 PM,Weekday
BLACK CANDELABRA T-LIGHT HOLDER,3,2.1,6.3,2010,December,Wednesday,4 PM,Weekday
BLUE TEA TOWEL CLASSIC DESIGN,2,1.25,2.5,2010,December,Wednesday,4 PM,Weekday
CAROUSEL DESIGN WASHBAG,1,1.95,1.95,2010,December,Wednesday,4 PM,Weekday
CHRISTMAS METAL TAGS ASSORTED,6,0.85,5.1,2010,December,Wednesday,4 PM,Weekday
CIRCUS PARADE LUNCH BOX,1,1.95,1.95,2010,December,Wednesday,4 PM,Weekday
ETCHED GLASS COASTER,4,1.25,5.0,2010,December,Wednesday,4 PM,Weekday
FELTCRAFT CHRISTMAS FAIRY,1,4.25,4.25,2010,December,Wednesday,4 PM,Weekday
FELTCRAFT PRINCESS CHARLOTTE DOLL,1,3.75,3.75,2010,December,Wednesday,4 PM,Weekday
FUNKY WASHING UP GLOVES ASSORTED,1,2.1,2.1,2010,December,Wednesday,4 PM,Weekday
GREY FLORAL FELTCRAFT SHOULDER BAG,1,3.75,3.75,2010,December,Wednesday,4 PM,Weekday
HEART OF WICKER SMALL,2,1.65,3.3,2010,December,Wednesday,4 PM,Weekday
KEEP OUT BOYS DOOR HANGER,1,1.45,1.45,2010,December,Wednesday,4 PM,Weekday
"KEY FOB , BACK DOOR ",1,0.65,0.65,2010,December,Wednesday,4 PM,Weekday
"KEY FOB , SHED",1,0.65,0.65,2010,December,Wednesday,4 PM,Weekday
LETS GO SHOPPING COTTON TOTE BAG,2,2.25,4.5,2010,December,Wednesday,4 PM,Weekday
MAGNETS PACK OF 4 CHILDHOOD MEMORY,1,1.25,1.25,2010,December,Wednesday,4 PM,Weekday
MAGNETS PACK OF 4 VINTAGE COLLAGE,1,1.25,1.25,2010,December,Wednesday,4 PM,Weekday
MAGNETS PACK OF 4 VINTAGE LABELS,1,1.25,1.25,2010,December,Wednesday,4 PM,Weekday
METAL SIGN TAKE IT OR LEAVE IT,1,2.95,2.95,2010,December,Wednesday,4 PM,Weekday
MOTORING TISSUE BOX,1,1.25,1.25,2010,December,Wednesday,4 PM,Weekday
NINJA RABBIT PINK,1,1.25,1.25,2010,December,Wednesday,4 PM,Weekday
PACK OF 12 HEARTS DESIGN TISSUES,1,0.29,0.29,2010,December,Wednesday,4 PM,Weekday
PACK OF 12 PINK POLKADOT TISSUES,1,0.29,0.29,2010,December,Wednesday,4 PM,Weekday
PACK OF 12 RED RETROSPOT TISSUES,1,0.29,0.29,2010,December,Wednesday,4 PM,Weekday
PACK OF 12 SUKI TISSUES,2,0.29,0.58,2010,December,Wednesday,4 PM,Weekday
PACK OF 12 WOODLAND TISSUES,1,0.29,0.29,2010,December,Wednesday,4 PM,Weekday
PAPER CHAIN KIT VINTAGE CHRISTMAS,1,2.95,2.95,2010,December,Wednesday,4 PM,Weekday
PHOTO CUBE,6,1.65,9.9,2010,December,Wednesday,4 PM,Weekday
PINK CREAM FELT CRAFT TRINKET BOX,1,1.25,1.25,2010,December,Wednesday,4 PM,Weekday
PLACE SETTING WHITE HEART,10,0.42,4.2,2010,December,Wednesday,4 PM,Weekday
RED RETROSPOT TISSUE BOX,1,1.25,1.25,2010,December,Wednesday,4 PM,Weekday
RED TEA TOWEL CLASSIC DESIGN,2,1.25,2.5,2010,December,Wednesday,4 PM,Weekday
REX CASH+CARRY JUMBO SHOPPER,1,0.95,0.95,2010,December,Wednesday,4 PM,Weekday
RIBBON REEL CHRISTMAS SOCK BAUBLE,1,1.65,1.65,2010,December,Wednesday,4 PM,Weekday
RIBBON REEL HEARTS DESIGN,1,1.65,1.65,2010,December,Wednesday,4 PM,Weekday
RIBBON REEL LACE DESIGN,1,2.1,2.1,2010,December,Wednesday,4 PM,Weekday
RIBBON REEL STRIPES DESIGN,1,1.65,1.65,2010,December,Wednesday,4 PM,Weekday
S/6 SEW ON CROCHET FLOWERS,1,1.25,1.25,2010,December,Wednesday,4 PM,Weekday
SANDWICH BATH SPONGE,1,1.25,1.25,2010,December,Wednesday,4 PM,Weekday
SCANDINAVIAN REDS RIBBONS,1,1.25,1.25,2010,December,Wednesday,4 PM,Weekday
SCOTTIES DESIGN WASHBAG,1,1.95,1.95,2010,December,Wednesday,4 PM,Weekday
SET OF 20 VINTAGE CHRISTMAS NAPKINS,1,0.85,0.85,2010,December,Wednesday,4 PM,Weekday
SET OF 3 CAKE TINS PANTRY DESIGN,1,4.95,4.95,2010,December,Wednesday,4 PM,Weekday
SET OF 3 HEART COOKIE CUTTERS,1,1.25,1.25,2010,December,Wednesday,4 PM,Weekday
SET OF 3 NOTEBOOKS IN PARCEL,2,1.65,3.3,2010,December,Wednesday,4 PM,Weekday
SET OF 4 NAPKIN CHARMS CROWNS,1,2.55,2.55,2010,December,Wednesday,4 PM,Weekday
SET OF 4 NAPKIN CHARMS CUTLERY,1,2.55,2.55,2010,December,Wednesday,4 PM,Weekday
SET OF 9 HEART SHAPED BALLOONS,2,1.25,2.5,2010,December,Wednesday,4 PM,Weekday
SPACE CADET RED,1,1.25,1.25,2010,December,Wednesday,4 PM,Weekday
SPACE OWL,1,1.25,1.25,2010,December,Wednesday,4 PM,Weekday
