Description,Quantity,UnitPrice,Revenue,Year,Month,DayOfWeek,Hour,Weekday
CHILDS GARDEN RAKE BLUE,6,2.1,12.6,2011,April,Thursday,1 PM,Weekday
CHILDS GARDEN RAKE PINK,6,2.1,12.6,2011,April,Thursday,1 PM,Weekday
CHILDS GARDEN SPADE BLUE,6,2.1,12.6,2011,April,Thursday,1 PM,Weekday
CHILDS GARDEN SPADE PINK,6,2.1,12.6,2011,April,Thursday,1 PM,Weekday
COWBOYS AND INDIANS BIRTHDAY CARD,12,0.42,5.04,2011,April,Thursday,1 PM,Weekday
DOLLY GIRL BABY GIFT SET,1,16.95,16.95,2011,April,Thursday,1 PM,Weekday
DOLLY GIRL LUNCH BOX,12,1.95,23.4,2011,April,Thursday,1 PM,Weekday
"ELEPHANT, BIRTHDAY CARD, ",12,0.42,5.04,2011,April,Thursday,1 PM,Weekday
JUMBO BAG SPACEBOY DESIGN,10,2.08,20.8,2011,April,Thursday,1 PM,Weekday
LUNCH BAG WOODLAND,10,1.65,16.5,2011,April,Thursday,1 PM,Weekday
POSTAGE,3,18.0,54.0,2011,April,Thursday,1 PM,Weekday
RED RETROSPOT WRAP,25,0.42,10.5,2011,April,Thursday,1 PM,Weekday
RING OF ROSES BIRTHDAY CARD,12,0.42,5.04,2011,April,Thursday,1 PM,Weekday
SPACEBOY BABY GIFT SET,1,16.95,16.95,2011,April,Thursday,1 PM,Weekday
TEA PARTY BIRTHDAY CARD,24,0.42,10.08,2011,April,Thursday,1 PM,Weekday
WATERING CAN BLUE ELEPHANT,6,1.95,11.7,2011,April,Thursday,1 PM,Weekday
WATERING CAN PINK BUNNY,6,1.95,11.7,2011,April,Thursday,1 PM,Weekday
WRAP CAROUSEL,25,0.42,10.5,2011,April,Thursday,1 PM,Weekday
ALARM CLOCK BAKELIKE CHOCOLATE,8,3.75,30.0,2011,April,Thursday,2 PM,Weekday
ALARM CLOCK BAKELIKE ORANGE,4,3.75,15.0,2011,April,Thursday,2 PM,Weekday
ALARM CLOCK BAKELIKE PINK,12,3.75,45.0,2011,April,Thursday,2 PM,Weekday
ALARM CLOCK BAKELIKE RED,8,3.75,30.0,2011,April,Thursday,2 PM,Weekday
BLACK/BLUE POLKADOT UMBRELLA,3,5.95,17.85,2011,April,Thursday,2 PM,Weekday
DOORMAT WELCOME TO OUR HOME,2,7.95,15.9,2011,April,Thursday,2 PM,Weekday
EASTER TIN BUNNY BOUQUET,6,1.65,9.9,2011,April,Thursday,2 PM,Weekday
FRENCH ENAMEL WATER BASIN,4,3.75,15.0,2011,April,Thursday,2 PM,Weekday
GIRAFFE WOODEN RULER,12,1.95,23.4,2011,April,Thursday,2 PM,Weekday
JAM JAR WITH GREEN LID,12,0.85,10.2,2011,April,Thursday,2 PM,Weekday
JAM JAR WITH PINK LID,12,0.85,10.2,2011,April,Thursday,2 PM,Weekday
JUMBO BAG DOLLY GIRL DESIGN,10,2.08,20.8,2011,April,Thursday,2 PM,Weekday
JUMBO BAG SPACEBOY DESIGN,10,2.08,20.8,2011,April,Thursday,2 PM,Weekday
LUNCH BAG DOLLY GIRL DESIGN,10,1.65,16.5,2011,April,Thursday,2 PM,Weekday
LUNCH BAG SPACEBOY DESIGN,10,1.65,16.5,2011,April,Thursday,2 PM,Weekday
LUNCH BAG WOODLAND,10,1.65,16.5,2011,April,Thursday,2 PM,Weekday
MINI PAINT SET VINTAGE,36,0.65,23.4,2011,April,Thursday,2 PM,Weekday
PLASTERS IN TIN CIRCUS PARADE,12,1.65,19.8,2011,April,Thursday,2 PM,Weekday
PLASTERS IN TIN SPACEBOY,24,1.65,39.6,2011,April,Thursday,2 PM,Weekday
PLASTERS IN TIN WOODLAND ANIMALS,12,1.65,19.8,2011,April,Thursday,2 PM,Weekday
POSTAGE,3,18.0,54.0,2011,April,Thursday,2 PM,Weekday
RECYCLED ACAPULCO MAT LAVENDER,2,8.25,16.5,2011,April,Thursday,2 PM,Weekday
RECYCLED ACAPULCO MAT PINK,4,8.25,33.0,2011,April,Thursday,2 PM,Weekday
RECYCLED ACAPULCO MAT RED,2,8.25,16.5,2011,April,Thursday,2 PM,Weekday
RECYCLED ACAPULCO MAT TURQUOISE,4,8.25,33.0,2011,April,Thursday,2 PM,Weekday
RED RETROSPOT TAPE,12,0.65,7.8,2011,April,Thursday,2 PM,Weekday
REGENCY CAKESTAND 3 TIER,1,12.75,12.75,2011,April,Thursday,2 PM,Weekday
REVOLVER WOODEN RULER,12,1.95,23.4,2011,April,Thursday,2 PM,Weekday
ROUND SNACK BOXES SET OF4 WOODLAND,6,2.95,17.7,2011,April,Thursday,2 PM,Weekday
SMALL RED RETROSPOT WINDMILL,12,1.25,15.0,2011,April,Thursday,2 PM,Weekday
SPACEBOY LUNCH BOX,12,1.95,23.4,2011,April,Thursday,2 PM,Weekday
4 TRADITIONAL SPINNING TOPS,12,1.45,17.4,2011,April,Sunday,11 AM,Weekend
BLUE POLKADOT CUP,8,0.85,6.8,2011,April,Sunday,11 AM,Weekend
CIRCUS PARADE CHILDRENS EGG CUP,12,1.25,15.0,2011,April,Sunday,11 AM,Weekend
DOORMAT RESPECTABLE HOUSE,4,7.95,31.8,2011,April,Sunday,11 AM,Weekend
DOORMAT UNION FLAG,2,7.95,15.9,2011,April,Sunday,11 AM,Weekend
ENAMEL FLOWER JUG CREAM,3,5.95,17.85,2011,April,Sunday,11 AM,Weekend
ICE CREAM SUNDAE LIP GLOSS,48,1.25,60.0,2011,April,Sunday,11 AM,Weekend
KNICKERBOCKERGLORY MAGNET ASSORTED,24,0.83,19.92,2011,April,Sunday,11 AM,Weekend
LOVELY BONBON STICKER SHEET,12,0.85,10.2,2011,April,Sunday,11 AM,Weekend
OFFICE MUG WARMER POLKADOT,6,2.95,17.7,2011,April,Sunday,11 AM,Weekend
PLASTERS IN TIN CIRCUS PARADE,12,1.65,19.8,2011,April,Sunday,11 AM,Weekend
POLKADOT RAIN HAT,24,0.42,10.08,2011,April,Sunday,11 AM,Weekend
POSTAGE,2,18.0,36.0,2011,April,Sunday,11 AM,Weekend
RAINY LADIES BIRTHDAY CARD,12,0.42,5.04,2011,April,Sunday,11 AM,Weekend
RED RETROSPOT CUP,8,0.85,6.8,2011,April,Sunday,11 AM,Weekend
RED TOADSTOOL LED NIGHT LIGHT,24,1.65,39.6,2011,April,Sunday,11 AM,Weekend
REVOLVER WOODEN RULER,12,1.95,23.4,2011,April,Sunday,11 AM,Weekend
ROBOT BIRTHDAY CARD,12,0.42,5.04,2011,April,Sunday,11 AM,Weekend
ROUND SNACK BOXES SET OF4 WOODLAND,12,2.95,35.4,2011,April,Sunday,11 AM,Weekend
SET OF 2 TEA TOWELS APPLE AND PEARS,6,3.25,19.5,2011,April,Sunday,11 AM,Weekend
SET OF 5 LUCKY CAT MAGNETS,24,2.08,49.92,2011,April,Sunday,11 AM,Weekend
SET OF 5 PANCAKE DAY MAGNETS,12,2.08,24.96,2011,April,Sunday,11 AM,Weekend
TEA PARTY BIRTHDAY CARD,12,0.42,5.04,2011,April,Sunday,11 AM,Weekend
TRAVEL SEWING KIT,10,1.65,16.5,2011,April,Sunday,11 AM,Weekend
WOODLAND CHARLOTTE BAG,10,0.85,8.5,2011,April,Sunday,11 AM,Weekend
WOODLAND DESIGN  COTTON TOTE BAG,6,2.25,13.5,2011,April,Sunday,11 AM,Weekend
WORLD WAR 2 GLIDERS ASSTD DESIGNS,48,0.29,13.92,2011,April,Sunday,11 AM,Weekend
BLACK/BLUE POLKADOT UMBRELLA,3,5.95,17.85,2011,April,Sunday,3 PM,Weekend
JUMBO BAG RED RETROSPOT,10,2.08,20.8,2011,April,Sunday,3 PM,Weekend
RECYCLED ACAPULCO MAT BLUE,2,8.25,16.5,2011,April,Sunday,3 PM,Weekend
RED RETROSPOT PICNIC BAG,10,2.95,29.5,2011,April,Sunday,3 PM,Weekend
AIRLINE BAG VINTAGE JET SET RED,4,4.25,17.0,2011,April,Wednesday,9 AM,Weekday
AIRLINE BAG VINTAGE JET SET WHITE,4,4.25,17.0,2011,April,Wednesday,9 AM,Weekday
AIRLINE BAG VINTAGE TOKYO 78,4,4.25,17.0,2011,April,Wednesday,9 AM,Weekday
CHERRY BLOSSOM  DECORATIVE FLASK,4,3.75,15.0,2011,April,Wednesday,9 AM,Weekday
CHERRY BLOSSOM DECORATIVE FLASK,4,3.75,15.0,2011,April,Wednesday,9 AM,Weekday
DOLLY GIRL LUNCH BOX,12,1.95,23.4,2011,April,Wednesday,9 AM,Weekday
LUNCH BAG DOLLY GIRL DESIGN,20,1.65,33.0,2011,April,Wednesday,9 AM,Weekday
LUNCH BAG PINK POLKADOT,20,1.65,33.0,2011,April,Wednesday,9 AM,Weekday
LUNCH BAG RED RETROSPOT,20,1.65,33.0,2011,April,Wednesday,9 AM,Weekday
LUNCH BAG SPACEBOY DESIGN,20,1.65,33.0,2011,April,Wednesday,9 AM,Weekday
LUNCH BAG WOODLAND,20,1.65,33.0,2011,April,Wednesday,9 AM,Weekday
POSTAGE,4,18.0,72.0,2011,April,Wednesday,9 AM,Weekday
RECYCLED ACAPULCO MAT PINK,2,8.25,16.5,2011,April,Wednesday,9 AM,Weekday
RECYCLED ACAPULCO MAT TURQUOISE,2,8.25,16.5,2011,April,Wednesday,9 AM,Weekday
RED RETROSPOT PICNIC BAG,30,2.95,88.5,2011,April,Wednesday,9 AM,Weekday
ROUND SNACK BOXES SET OF4 WOODLAND,12,2.95,35.4,2011,April,Wednesday,9 AM,Weekday
SET 2 PANTRY DESIGN TEA TOWELS,6,3.25,19.5,2011,April,Wednesday,9 AM,Weekday
SPACEBOY LUNCH BOX,12,1.95,23.4,2011,April,Wednesday,9 AM,Weekday
BAKING MOULD EASTER EGG MILK CHOC,1,2.95,2.95,2011,April,Thursday,8 AM,Weekday
BAKING MOULD EASTER EGG WHITE CHOC,1,2.95,2.95,2011,April,Thursday,8 AM,Weekday
GLASS  BEURRE DISH,1,3.95,3.95,2011,April,Thursday,8 AM,Weekday
GREEN GIANT GARDEN THERMOMETER,1,5.95,5.95,2011,April,Thursday,8 AM,Weekday
IVORY GIANT GARDEN THERMOMETER,1,5.95,5.95,2011,April,Thursday,8 AM,Weekday
JAM JAR WITH GREEN LID,1,0.85,0.85,2011,April,Thursday,8 AM,Weekday
JAM JAR WITH PINK LID,1,0.85,0.85,2011,April,Thursday,8 AM,Weekday
JAM MAKING SET WITH JARS,1,4.25,4.25,2011,April,Thursday,8 AM,Weekday
PACK OF 20 NAPKINS PANTRY DESIGN,1,0.85,0.85,2011,April,Thursday,8 AM,Weekday
PANTRY ROLLING PIN,1,3.75,3.75,2011,April,Thursday,8 AM,Weekday
PAPER BUNTING RETROSPOT,1,2.95,2.95,2011,April,Thursday,8 AM,Weekday
ROUND CAKE TIN VINTAGE GREEN,1,7.95,7.95,2011,April,Thursday,8 AM,Weekday
ROUND CAKE TIN VINTAGE RED,1,7.95,7.95,2011,April,Thursday,8 AM,Weekday
ROUND SNACK BOXES SET OF 4 FRUITS,1,2.95,2.95,2011,April,Thursday,8 AM,Weekday
SET 2 PANTRY DESIGN TEA TOWELS,1,3.25,3.25,2011,April,Thursday,8 AM,Weekday
SET OF 20 KIDS COOKIE CUTTERS,1,2.1,2.1,2011,April,Thursday,8 AM,Weekday
SET OF 3 HEART COOKIE CUTTERS,1,1.25,1.25,2011,April,Thursday,8 AM,Weekday
SET OF 36 PAISLEY FLOWER DOILIES,1,1.45,1.45,2011,April,Thursday,8 AM,Weekday
SET OF 36 TEATIME PAPER DOILIES,1,1.45,1.45,2011,April,Thursday,8 AM,Weekday
SET OF 4 NAPKIN CHARMS CUTLERY,1,2.55,2.55,2011,April,Thursday,8 AM,Weekday
SET OF 6 SPICE TINS PANTRY DESIGN,1,3.95,3.95,2011,April,Thursday,8 AM,Weekday
SET OF 72 PINK HEART PAPER DOILIES,1,1.45,1.45,2011,April,Thursday,8 AM,Weekday
WATERING CAN PINK BUNNY,1,1.95,1.95,2011,April,Thursday,8 AM,Weekday
CIRCUS PARADE LUNCH BOX,12,1.95,23.4,2011,April,Thursday,10 AM,Weekday
COFFEE MUG APPLES DESIGN,12,2.55,30.6,2011,April,Thursday,10 AM,Weekday
FELT TOADSTOOL  SMALL,24,0.85,20.4,2011,April,Thursday,10 AM,Weekday
FELT TOADSTOOL LARGE,12,1.25,15.0,2011,April,Thursday,10 AM,Weekday
LUNCH BAG APPLE DESIGN,10,1.65,16.5,2011,April,Thursday,10 AM,Weekday
LUNCH BAG RED RETROSPOT,20,1.65,33.0,2011,April,Thursday,10 AM,Weekday
LUNCH BAG SPACEBOY DESIGN,10,1.65,16.5,2011,April,Thursday,10 AM,Weekday
LUNCH BOX I LOVE LONDON,12,1.95,23.4,2011,April,Thursday,10 AM,Weekday
LUNCH BOX WITH CUTLERY RETROSPOT,12,2.55,30.6,2011,April,Thursday,10 AM,Weekday
PLASTERS IN TIN CIRCUS PARADE,12,1.65,19.8,2011,April,Thursday,10 AM,Weekday
PLASTERS IN TIN SPACEBOY,12,1.65,19.8,2011,April,Thursday,10 AM,Weekday
POLKADOT PEN,48,0.85,40.8,2011,April,Thursday,10 AM,Weekday
POSTAGE,3,18.0,54.0,2011,April,Thursday,10 AM,Weekday
RED RETROSPOT CHILDRENS UMBRELLA,6,3.25,19.5,2011,April,Thursday,10 AM,Weekday
RED RETROSPOT MINI CASES,8,7.95,63.6,2011,April,Thursday,10 AM,Weekday
RED RETROSPOT PICNIC BAG,5,2.95,14.75,2011,April,Thursday,10 AM,Weekday
RED RETROSPOT UMBRELLA,6,5.95,35.7,2011,April,Thursday,10 AM,Weekday
SET 2 TEA TOWELS I LOVE LONDON,12,3.25,39.0,2011,April,Thursday,10 AM,Weekday
SET OF 2 TEA TOWELS APPLE AND PEARS,12,3.25,39.0,2011,April,Thursday,10 AM,Weekday
SET/2 RED RETROSPOT TEA TOWELS,12,3.25,39.0,2011,April,Thursday,10 AM,Weekday
SPACEBOY LUNCH BOX,12,1.95,23.4,2011,April,Thursday,10 AM,Weekday
STRAWBERRY LUNCH BOX WITH CUTLERY,6,2.55,15.3,2011,April,Thursday,10 AM,Weekday
ASSORTED COLOUR BIRD ORNAMENT,4,1.69,6.76,2011,April,Tuesday,3 PM,Weekday
CAST IRON HOOK GARDEN TROWEL,1,2.55,2.55,2011,April,Tuesday,3 PM,Weekday
CHILDREN'S SPACEBOY MUG,2,1.65,3.3,2011,April,Tuesday,3 PM,Weekday
CHILDRENS DOLLY GIRL MUG,2,1.65,3.3,2011,April,Tuesday,3 PM,Weekday
CIRCUS PARADE CHILDRENS EGG CUP,1,1.25,1.25,2011,April,Tuesday,3 PM,Weekday
CIRCUS PARADE CHILDRENS EGG CUP,2,1.25,2.5,2011,April,Tuesday,3 PM,Weekday
DOLLY GIRL CHILDRENS EGG CUP,2,1.25,2.5,2011,April,Tuesday,3 PM,Weekday
"ELEPHANT, BIRTHDAY CARD, ",12,0.42,5.04,2011,April,Tuesday,3 PM,Weekday
FRIDGE MAGNETS LA VIE EN ROSE,12,0.85,10.2,2011,April,Tuesday,3 PM,Weekday
HANGING SPRING FLOWER EGG SMALL,1,0.65,0.65,2011,April,Tuesday,3 PM,Weekday
IVORY HANGING DECORATION  HEART,2,0.85,1.7,2011,April,Tuesday,3 PM,Weekday
IVORY HANGING DECORATION  HEART,1,0.85,0.85,2011,April,Tuesday,3 PM,Weekday
KINGS CHOICE TEA CADDY,1,2.95,2.95,2011,April,Tuesday,3 PM,Weekday
LARGE RED RETROSPOT WINDMILL,4,2.1,8.4,2011,April,Tuesday,3 PM,Weekday
MAGNETS PACK OF 4 VINTAGE LABELS,1,1.25,1.25,2011,April,Tuesday,3 PM,Weekday
PAPER CHAIN KIT RETROSPOT,1,2.95,2.95,2011,April,Tuesday,3 PM,Weekday
PARTY BUNTING,2,4.95,9.9,2011,April,Tuesday,3 PM,Weekday
PICNIC BASKET WICKER LARGE,1,9.95,9.95,2011,April,Tuesday,3 PM,Weekday
PSYCHEDELIC TILE HOOK,1,2.1,2.1,2011,April,Tuesday,3 PM,Weekday
RED RETROSPOT SUGAR JAM BOWL,1,2.55,2.55,2011,April,Tuesday,3 PM,Weekday
SMALL SILVER TRELLIS CANDLEPOT,12,2.95,35.4,2011,April,Tuesday,3 PM,Weekday
SPACEBOY CHILDRENS EGG CUP,1,1.25,1.25,2011,April,Tuesday,3 PM,Weekday
TRAVEL CARD WALLET VINTAGE ROSE,1,0.42,0.42,2011,April,Tuesday,3 PM,Weekday
TRAVEL CARD WALLET VINTAGE TICKET,1,0.42,0.42,2011,April,Tuesday,3 PM,Weekday
WAKE UP COCKEREL TILE HOOK,1,2.1,2.1,2011,April,Tuesday,3 PM,Weekday
WATERING CAN BLUE ELEPHANT,1,1.95,1.95,2011,April,Tuesday,3 PM,Weekday
WHITE HANGING HEART T-LIGHT HOLDER,9,2.95,26.55,2011,April,Tuesday,3 PM,Weekday
WHITE LOVEBIRD LANTERN,4,2.95,11.8,2011,April,Tuesday,3 PM,Weekday
GROW A FLYTRAP OR SUNFLOWER IN TIN,24,1.25,30.0,2011,April,Thursday,11 AM,Weekday
PACK OF 72 RETROSPOT CAKE CASES,24,0.55,13.2,2011,April,Thursday,11 AM,Weekday
PAPER BUNTING RETROSPOT,24,2.95,70.8,2011,April,Thursday,11 AM,Weekday
PINK LOVE HEART SHAPE CUP,12,0.85,10.2,2011,April,Thursday,11 AM,Weekday
POSTAGE,1,18.0,18.0,2011,April,Thursday,11 AM,Weekday
RED LOVE HEART SHAPE CUP,12,0.85,10.2,2011,April,Thursday,11 AM,Weekday
REGENCY CAKESTAND 3 TIER,2,12.75,25.5,2011,April,Thursday,11 AM,Weekday
SET/6 RED SPOTTY PAPER CUPS,48,0.65,31.2,2011,April,Thursday,11 AM,Weekday
BIG DOUGHNUT FRIDGE MAGNETS,48,0.85,40.8,2011,May,Tuesday,8 AM,Weekday
CHARLOTTE BAG APPLES DESIGN,20,0.85,17.0,2011,May,Tuesday,8 AM,Weekday
CHARLOTTE BAG DOLLY GIRL DESIGN,10,0.85,8.5,2011,May,Tuesday,8 AM,Weekday
CHILDREN'S SPACEBOY MUG,12,1.65,19.8,2011,May,Tuesday,8 AM,Weekday
CHILDRENS CUTLERY CIRCUS PARADE,8,4.15,33.2,2011,May,Tuesday,8 AM,Weekday
CHILDRENS CUTLERY DOLLY GIRL,8,4.15,33.2,2011,May,Tuesday,8 AM,Weekday
CHILDRENS CUTLERY POLKADOT PINK,8,4.15,33.2,2011,May,Tuesday,8 AM,Weekday
CHILDRENS CUTLERY SPACEBOY,8,4.15,33.2,2011,May,Tuesday,8 AM,Weekday
CHILDRENS DOLLY GIRL MUG,12,1.65,19.8,2011,May,Tuesday,8 AM,Weekday
COFFEE MUG APPLES DESIGN,12,2.55,30.6,2011,May,Tuesday,8 AM,Weekday
DOUGHNUT LIP GLOSS,20,1.25,25.0,2011,May,Tuesday,8 AM,Weekday
ICE CREAM PEN LIP GLOSS,48,1.25,60.0,2011,May,Tuesday,8 AM,Weekday
ICE CREAM SUNDAE LIP GLOSS,48,1.25,60.0,2011,May,Tuesday,8 AM,Weekday
KNICKERBOCKERGLORY MAGNET ASSORTED,24,0.83,19.92,2011,May,Tuesday,8 AM,Weekday
RED RETROSPOT CHARLOTTE BAG,20,0.85,17.0,2011,May,Tuesday,8 AM,Weekday
SET OF 5 LUCKY CAT MAGNETS,12,2.08,24.96,2011,May,Tuesday,8 AM,Weekday
SNOWSTORM PHOTO FRAME FRIDGE MAGNET,24,0.85,20.4,2011,May,Tuesday,8 AM,Weekday
STRAWBERRY CHARLOTTE BAG,10,0.85,8.5,2011,May,Tuesday,8 AM,Weekday
STRAWBERRY LUNCH BOX WITH CUTLERY,6,2.55,15.3,2011,May,Tuesday,8 AM,Weekday
WOODLAND CHARLOTTE BAG,10,0.85,8.5,2011,May,Tuesday,8 AM,Weekday
BLACK KITCHEN SCALES,2,8.5,17.0,2011,May,Tuesday,9 AM,Weekday
BLUE PARTY BAGS,18,2.1,37.8,2011,May,Tuesday,9 AM,Weekday
HOMEMADE JAM SCENTED CANDLES,12,1.45,17.4,2011,May,Tuesday,9 AM,Weekday
ICE CREAM SUNDAE LIP GLOSS,24,1.25,30.0,2011,May,Tuesday,9 AM,Weekday
JAM MAKING SET WITH JARS,6,4.25,25.5,2011,May,Tuesday,9 AM,Weekday
JUNGLE POPSICLES ICE LOLLY MOULDS,12,1.25,15.0,2011,May,Tuesday,9 AM,Weekday
LUNCH BAG APPLE DESIGN,10,1.65,16.5,2011,May,Tuesday,9 AM,Weekday
LUNCH BAG DOLLY GIRL DESIGN,10,1.65,16.5,2011,May,Tuesday,9 AM,Weekday
LUNCH BOX WITH CUTLERY RETROSPOT,12,2.55,30.6,2011,May,Tuesday,9 AM,Weekday
PANTRY ROLLING PIN,6,3.75,22.5,2011,May,Tuesday,9 AM,Weekday
PAPER BUNTING RETROSPOT,40,2.55,102.0,2011,May,Tuesday,9 AM,Weekday
PINK PARTY BAGS,30,2.1,63.0,2011,May,Tuesday,9 AM,Weekday
POSTAGE,4,18.0,72.0,2011,May,Tuesday,9 AM,Weekday
ROUND SNACK BOXES SET OF 4 FRUITS,12,2.95,35.4,2011,May,Tuesday,9 AM,Weekday
SET OF 4 PANTRY JELLY MOULDS,12,1.25,15.0,2011,May,Tuesday,9 AM,Weekday
SET OF 5 MINI GROCERY MAGNETS,24,2.08,49.92,2011,May,Tuesday,9 AM,Weekday
SET OF 5 PANCAKE DAY MAGNETS,24,2.08,49.92,2011,May,Tuesday,9 AM,Weekday
SET/20 RED RETROSPOT PAPER NAPKINS,24,0.85,20.4,2011,May,Tuesday,9 AM,Weekday
SET/6 POSIES PAPER PLATES,24,0.85,20.4,2011,May,Tuesday,9 AM,Weekday
SET/6 RED SPOTTY PAPER CUPS,24,0.65,15.6,2011,May,Tuesday,9 AM,Weekday
SET/6 RED SPOTTY PAPER PLATES,24,0.85,20.4,2011,May,Tuesday,9 AM,Weekday
CHILDRENS CUTLERY POLKADOT BLUE,6,4.15,24.9,2011,May,Tuesday,9 AM,Weekday
POSTAGE,2,18.0,36.0,2011,May,Tuesday,10 AM,Weekday
POSTAGE,2,20.0,40.0,2011,May,Tuesday,12 PM,Weekday
SMALL RED RETROSPOT WINDMILL,48,1.06,50.88,2011,May,Tuesday,12 PM,Weekday
SMALL SKULL WINDMILL,48,1.05,50.4,2011,May,Tuesday,12 PM,Weekday
WOODEN HAPPY BIRTHDAY GARLAND,24,2.55,61.2,2011,May,Tuesday,12 PM,Weekday
PACK OF 72 RETROSPOT CAKE CASES,24,0.42,10.08,2011,May,Tuesday,12 PM,Weekday
PACK OF 72 SKULL CAKE CASES,48,0.42,20.16,2011,May,Tuesday,12 PM,Weekday
PAPER BUNTING RETROSPOT,80,2.55,204.0,2011,May,Tuesday,12 PM,Weekday
PAPER CHAIN KIT RETROSPOT,40,2.55,102.0,2011,May,Tuesday,12 PM,Weekday
POSTAGE,2,1.0,2.0,2011,May,Tuesday,12 PM,Weekday
DOLLY GIRL LUNCH BOX,12,1.95,23.4,2011,May,Thursday,9 AM,Weekday
ICE CREAM DESIGN GARDEN PARASOL,10,3.95,39.5,2011,May,Thursday,9 AM,Weekday
LUNCH BAG DOLLY GIRL DESIGN,10,1.65,16.5,2011,May,Thursday,9 AM,Weekday
LUNCH BAG SPACEBOY DESIGN,10,1.65,16.5,2011,May,Thursday,9 AM,Weekday
LUNCH BAG WOODLAND,10,1.65,16.5,2011,May,Thursday,9 AM,Weekday
LUNCH BOX I LOVE LONDON,12,1.95,23.4,2011,May,Thursday,9 AM,Weekday
POSTAGE,2,18.0,36.0,2011,May,Thursday,9 AM,Weekday
RED TOADSTOOL LED NIGHT LIGHT,12,1.65,19.8,2011,May,Thursday,9 AM,Weekday
SPACEBOY LUNCH BOX,12,1.95,23.4,2011,May,Thursday,9 AM,Weekday
TOY TIDY DOLLY GIRL DESIGN,5,2.1,10.5,2011,May,Thursday,9 AM,Weekday
TOY TIDY SPACEBOY,5,2.1,10.5,2011,May,Thursday,9 AM,Weekday
10 COLOUR SPACEBOY PEN,24,0.85,20.4,2011,May,Sunday,4 PM,Weekend
60 CAKE CASES DOLLY GIRL DESIGN,24,0.55,13.2,2011,May,Sunday,4 PM,Weekend
72 SWEETHEART FAIRY CAKE CASES,24,0.55,13.2,2011,May,Sunday,4 PM,Weekend
ABC TREASURE BOOK BOX,8,2.25,18.0,2011,May,Sunday,4 PM,Weekend
ASSORTED COLOUR BIRD ORNAMENT,16,1.69,27.04,2011,May,Sunday,4 PM,Weekend
BIG DOUGHNUT FRIDGE MAGNETS,12,0.85,10.2,2011,May,Sunday,4 PM,Weekend
CARD DOLLY GIRL,12,0.42,5.04,2011,May,Sunday,4 PM,Weekend
CARD GINGHAM ROSE,12,0.42,5.04,2011,May,Sunday,4 PM,Weekend
CERAMIC STRAWBERRY CAKE MONEY BANK,12,1.45,17.4,2011,May,Sunday,4 PM,Weekend
CHARLOTTE BAG APPLES DESIGN,10,0.85,8.5,2011,May,Sunday,4 PM,Weekend
CHARLOTTE BAG DOLLY GIRL DESIGN,10,0.85,8.5,2011,May,Sunday,4 PM,Weekend
CHILDRENS CUTLERY DOLLY GIRL,4,4.15,16.6,2011,May,Sunday,4 PM,Weekend
CHILDRENS CUTLERY POLKADOT PINK,4,4.15,16.6,2011,May,Sunday,4 PM,Weekend
CHILDRENS CUTLERY SPACEBOY,4,4.15,16.6,2011,May,Sunday,4 PM,Weekend
CHOCOLATE BOX RIBBONS,12,1.25,15.0,2011,May,Sunday,4 PM,Weekend
CIRCUS PARADE CHILDRENS EGG CUP,12,1.25,15.0,2011,May,Sunday,4 PM,Weekend
DOLLY GIRL LUNCH BOX,12,1.95,23.4,2011,May,Sunday,4 PM,Weekend
DOUGHNUT LIP GLOSS,20,1.25,25.0,2011,May,Sunday,4 PM,Weekend
GROW A FLYTRAP OR SUNFLOWER IN TIN,24,1.25,30.0,2011,May,Sunday,4 PM,Weekend
GYMKHANA TREASURE BOOK BOX,8,2.25,18.0,2011,May,Sunday,4 PM,Weekend
ICE CREAM PEN LIP GLOSS,24,1.25,30.0,2011,May,Sunday,4 PM,Weekend
ICE CREAM SUNDAE LIP GLOSS,24,1.25,30.0,2011,May,Sunday,4 PM,Weekend
JUMBO  BAG BAROQUE BLACK WHITE,10,2.08,20.8,2011,May,Sunday,4 PM,Weekend
JUMBO BAG APPLES,10,2.08,20.8,2011,May,Sunday,4 PM,Weekend
LARGE DECO JEWELLERY STAND,4,12.5,50.0,2011,May,Sunday,4 PM,Weekend
LUNCH BAG APPLE DESIGN,10,1.65,16.5,2011,May,Sunday,4 PM,Weekend
LUNCH BAG DOLLY GIRL DESIGN,10,1.65,16.5,2011,May,Sunday,4 PM,Weekend
LUNCH BAG VINTAGE LEAF DESIGN,10,1.65,16.5,2011,May,Sunday,4 PM,Weekend
LUNCH BAG WOODLAND,10,1.65,16.5,2011,May,Sunday,4 PM,Weekend
PACK OF 60 MUSHROOM CAKE CASES,24,0.55,13.2,2011,May,Sunday,4 PM,Weekend
PACK OF 60 SPACEBOY CAKE CASES,24,0.55,13.2,2011,May,Sunday,4 PM,Weekend
PACK OF 72 RETROSPOT CAKE CASES,24,0.55,13.2,2011,May,Sunday,4 PM,Weekend
PAPERWEIGHT CHILDHOOD MEMORIES,6,2.55,15.3,2011,May,Sunday,4 PM,Weekend
PAPERWEIGHT VINTAGE COLLAGE,6,2.55,15.3,2011,May,Sunday,4 PM,Weekend
PENNY FARTHING BIRTHDAY CARD,12,0.42,5.04,2011,May,Sunday,4 PM,Weekend
PIGGY BANK RETROSPOT,4,2.55,10.2,2011,May,Sunday,4 PM,Weekend
PINK LOVE BIRD CANDLE,12,1.25,15.0,2011,May,Sunday,4 PM,Weekend
PLASTERS IN TIN CIRCUS PARADE,12,1.65,19.8,2011,May,Sunday,4 PM,Weekend
PLASTERS IN TIN SPACEBOY,12,1.65,19.8,2011,May,Sunday,4 PM,Weekend
PLASTERS IN TIN STRONGMAN,12,1.65,19.8,2011,May,Sunday,4 PM,Weekend
PLASTERS IN TIN WOODLAND ANIMALS,12,1.65,19.8,2011,May,Sunday,4 PM,Weekend
POSTAGE,6,18.0,108.0,2011,May,Sunday,4 PM,Weekend
QUEENS GUARD COFFEE MUG,6,2.55,15.3,2011,May,Sunday,4 PM,Weekend
RAINY LADIES BIRTHDAY CARD,12,0.42,5.04,2011,May,Sunday,4 PM,Weekend
REGENCY CAKESTAND 3 TIER,1,12.75,12.75,2011,May,Sunday,4 PM,Weekend
RING OF ROSES BIRTHDAY CARD,12,0.42,5.04,2011,May,Sunday,4 PM,Weekend
ROBOT BIRTHDAY CARD,12,0.42,5.04,2011,May,Sunday,4 PM,Weekend
ROMANTIC PINKS RIBBONS,12,1.25,15.0,2011,May,Sunday,4 PM,Weekend
ROSES REGENCY TEACUP AND SAUCER,12,2.95,35.4,2011,May,Sunday,4 PM,Weekend
SET OF 6 STRAWBERRY CHOPSTICKS,12,1.25,15.0,2011,May,Sunday,4 PM,Weekend
SET/4 BADGES BALLOON GIRL,10,1.25,12.5,2011,May,Sunday,4 PM,Weekend
SKULLS  WATER TRANSFER TATTOOS,12,0.85,10.2,2011,May,Sunday,4 PM,Weekend
SLEEPING CAT ERASERS,30,0.21,6.3,2011,May,Sunday,4 PM,Weekend
SMALL DECO JEWELLERY STAND,4,8.25,33.0,2011,May,Sunday,4 PM,Weekend
SPACEBOY BIRTHDAY CARD,12,0.42,5.04,2011,May,Sunday,4 PM,Weekend
SPACEBOY CHILDRENS EGG CUP,12,1.25,15.0,2011,May,Sunday,4 PM,Weekend
SPACEBOY LUNCH BOX,12,1.95,23.4,2011,May,Sunday,4 PM,Weekend
STRAWBERRY LUNCH BOX WITH CUTLERY,6,2.55,15.3,2011,May,Sunday,4 PM,Weekend
TEA PARTY BIRTHDAY CARD,12,0.42,5.04,2011,May,Sunday,4 PM,Weekend
TEATIME ROUND PENCIL SHARPENER,24,0.42,10.08,2011,May,Sunday,4 PM,Weekend
URBAN BLACK RIBBONS,12,1.25,15.0,2011,May,Sunday,4 PM,Weekend
VINTAGE KID DOLLY CARD,12,0.42,5.04,2011,May,Sunday,4 PM,Weekend
CHARLOTTE BAG APPLES DESIGN,20,0.85,17.0,2011,May,Monday,9 AM,Weekday
COFFEE MUG APPLES DESIGN,12,2.55,30.6,2011,May,Monday,9 AM,Weekday
COFFEE MUG PEARS  DESIGN,6,2.55,15.3,2011,May,Monday,9 AM,Weekday
JUMBO BAG APPLES,20,2.08,41.6,2011,May,Monday,9 AM,Weekday
JUMBO BAG PINK POLKADOT,10,2.08,20.8,2011,May,Monday,9 AM,Weekday
JUMBO BAG RED RETROSPOT,10,2.08,20.8,2011,May,Monday,9 AM,Weekday
JUMBO BAG WOODLAND ANIMALS,10,2.08,20.8,2011,May,Monday,9 AM,Weekday
LUNCH BAG APPLE DESIGN,10,1.65,16.5,2011,May,Monday,9 AM,Weekday
LUNCH BAG RED RETROSPOT,10,1.65,16.5,2011,May,Monday,9 AM,Weekday
PAPER BUNTING RETROSPOT,6,2.95,17.7,2011,May,Monday,9 AM,Weekday
PINK  POLKADOT CUP,8,0.85,6.8,2011,May,Monday,9 AM,Weekday
POSTAGE,2,18.0,36.0,2011,May,Monday,9 AM,Weekday
RECYCLING BAG RETROSPOT,10,2.1,21.0,2011,May,Monday,9 AM,Weekday
RED RETROSPOT CHARLOTTE BAG,10,0.85,8.5,2011,May,Monday,9 AM,Weekday
RED RETROSPOT CUP,8,0.85,6.8,2011,May,Monday,9 AM,Weekday
SET OF 2 TEA TOWELS APPLE AND PEARS,6,3.25,19.5,2011,May,Monday,9 AM,Weekday
STRAWBERRY LUNCH BOX WITH CUTLERY,6,2.55,15.3,2011,May,Monday,9 AM,Weekday
4 TRADITIONAL SPINNING TOPS,24,1.45,34.8,2011,May,Monday,3 PM,Weekday
DINOSAUR KEYRINGS ASSORTED,72,0.21,15.12,2011,May,Monday,3 PM,Weekday
MAGIC DRAWING SLATE CIRCUS PARADE,96,0.42,40.32,2011,May,Monday,3 PM,Weekday
MINI JIGSAW LEAP FROG,48,0.42,20.16,2011,May,Monday,3 PM,Weekday
POSTAGE,1,18.0,18.0,2011,May,Monday,3 PM,Weekday
SET OF 9 BLACK SKULL BALLOONS,20,0.85,17.0,2011,May,Monday,3 PM,Weekday
SET OF 9 HEART SHAPED BALLOONS,24,1.25,30.0,2011,May,Monday,3 PM,Weekday
SET/10 PINK POLKADOT PARTY CANDLES,24,1.25,30.0,2011,May,Monday,3 PM,Weekday
SET/6 RED SPOTTY PAPER CUPS,12,0.65,7.8,2011,May,Monday,3 PM,Weekday
SET/6 RED SPOTTY PAPER PLATES,12,0.85,10.2,2011,May,Monday,3 PM,Weekday
10 COLOUR SPACEBOY PEN,24,0.85,20.4,2011,May,Tuesday,12 PM,Weekday
12 PENCILS SMALL TUBE RED RETROSPOT,24,0.65,15.6,2011,May,Tuesday,12 PM,Weekday
12 PENCILS SMALL TUBE SKULL,24,0.65,15.6,2011,May,Tuesday,12 PM,Weekday
12 PENCILS TALL TUBE RED RETROSPOT,12,0.85,10.2,2011,May,Tuesday,12 PM,Weekday
4 TRADITIONAL SPINNING TOPS,12,1.45,17.4,2011,May,Tuesday,12 PM,Weekday
ALARM CLOCK BAKELIKE PINK,4,3.75,15.0,2011,May,Tuesday,12 PM,Weekday
BUTTERFLIES STICKERS,12,0.85,10.2,2011,May,Tuesday,12 PM,Weekday
CHILDRENS CUTLERY SPACEBOY,4,4.15,16.6,2011,May,Tuesday,12 PM,Weekday
FELTCRAFT DOLL MOLLY,6,2.95,17.7,2011,May,Tuesday,12 PM,Weekday
MAGIC DRAWING SLATE SPACEBOY,24,0.42,10.08,2011,May,Tuesday,12 PM,Weekday
MINI JIGSAW CIRCUS PARADE,24,0.42,10.08,2011,May,Tuesday,12 PM,Weekday
MINI PAINT SET VINTAGE,36,0.65,23.4,2011,May,Tuesday,12 PM,Weekday
PACK OF 12 COLOURED PENCILS,12,0.85,10.2,2011,May,Tuesday,12 PM,Weekday
PACK OF 12 TRADITIONAL CRAYONS,24,0.42,10.08,2011,May,Tuesday,12 PM,Weekday
PAINT YOUR OWN CANVAS SET,12,1.65,19.8,2011,May,Tuesday,12 PM,Weekday
PAISLEY PATTERN  STICKERS,12,0.85,10.2,2011,May,Tuesday,12 PM,Weekday
PARTY INVITES FOOTBALL,24,0.85,20.4,2011,May,Tuesday,12 PM,Weekday
PARTY INVITES WOODLAND,12,0.85,10.2,2011,May,Tuesday,12 PM,Weekday
PLASTERS IN TIN CIRCUS PARADE,12,1.65,19.8,2011,May,Tuesday,12 PM,Weekday
PLASTERS IN TIN VINTAGE PAISLEY,12,1.65,19.8,2011,May,Tuesday,12 PM,Weekday
POSTAGE,2,18.0,36.0,2011,May,Tuesday,12 PM,Weekday
RED  HARMONICA IN BOX,12,1.25,15.0,2011,May,Tuesday,12 PM,Weekday
REVOLVER WOODEN RULER,12,1.95,23.4,2011,May,Tuesday,12 PM,Weekday
SET 12 KIDS  WHITE CHALK STICKS,24,0.42,10.08,2011,May,Tuesday,12 PM,Weekday
SET 12 KIDS COLOUR  CHALK STICKS,24,0.42,10.08,2011,May,Tuesday,12 PM,Weekday
SKULL LUNCH BOX WITH CUTLERY,6,2.55,15.3,2011,May,Tuesday,12 PM,Weekday
SPACEBOY LUNCH BOX,12,1.95,23.4,2011,May,Tuesday,12 PM,Weekday
STARS GIFT TAPE,12,0.65,7.8,2011,May,Tuesday,12 PM,Weekday
STRAWBERRY LUNCH BOX WITH CUTLERY,6,2.55,15.3,2011,May,Tuesday,12 PM,Weekday
TRADITIONAL MODELLING CLAY,24,1.25,30.0,2011,May,Tuesday,12 PM,Weekday
12 PENCILS TALL TUBE RED RETROSPOT,24,0.85,20.4,2011,May,Wednesday,1 PM,Weekday
3 TIER CAKE TIN RED AND CREAM,2,14.95,29.9,2011,May,Wednesday,1 PM,Weekday
AREA PATROLLED METAL SIGN,4,2.1,8.4,2011,May,Wednesday,1 PM,Weekday
BEWARE OF THE CAT METAL SIGN,1,1.69,1.69,2011,May,Wednesday,1 PM,Weekday
BEWARE OF THE CAT METAL SIGN,4,1.69,6.76,2011,May,Wednesday,1 PM,Weekday
BISCUIT TIN VINTAGE RED,2,6.75,13.5,2011,May,Wednesday,1 PM,Weekday
BLACK KITCHEN SCALES,1,8.5,8.5,2011,May,Wednesday,1 PM,Weekday
BLUE COAT RACK PARIS FASHION,6,4.95,29.7,2011,May,Wednesday,1 PM,Weekday
BLUE DRAWER KNOB ACRYLIC EDWARDIAN,12,1.25,15.0,2011,May,Wednesday,1 PM,Weekday
