Description,Quantity,UnitPrice,Revenue,Year,Month,DayOfWeek,Hour,Weekday
HOLIDAY FUN LUDO,4,3.75,15.0,2011,February,Tuesday,2 PM,Weekday
HOME SWEET HOME METAL SIGN,6,2.95,17.7,2011,February,Tuesday,2 PM,Weekday
HOME SWEET HOME MUG,12,1.65,19.8,2011,February,Tuesday,2 PM,Weekday
HOT WATER BOTTLE KEEP CALM,4,4.95,19.8,2011,February,Tuesday,2 PM,Weekday
HYACINTH BULB T-LIGHT CANDLES,16,0.42,6.72,2011,February,Tuesday,2 PM,Weekday
ICE CREAM PEN LIP GLOSS,24,1.25,30.0,2011,February,Tuesday,2 PM,Weekday
ICE CREAM SUNDAE LIP GLOSS,24,1.25,30.0,2011,February,Tuesday,2 PM,Weekday
JAM MAKING SET WITH JARS,6,4.25,25.5,2011,February,Tuesday,2 PM,Weekday
JIGSAW TOADSTOOLS 3 PIECE,16,0.59,9.44,2011,February,Tuesday,2 PM,Weekday
JUMBO BAG RED RETROSPOT,10,2.08,20.8,2011,February,Tuesday,2 PM,Weekday
JUNGLE POPSICLES ICE LOLLY MOULDS,12,1.25,15.0,2011,February,Tuesday,2 PM,Weekday
KINGS CHOICE BISCUIT TIN,4,4.25,17.0,2011,February,Tuesday,2 PM,Weekday
KINGS CHOICE MUG,12,1.25,15.0,2011,February,Tuesday,2 PM,Weekday
LARGE HANGING IVORY & RED WOOD BIRD,12,0.65,7.8,2011,February,Tuesday,2 PM,Weekday
LAVENDER SCENTED FABRIC HEART,10,1.25,12.5,2011,February,Tuesday,2 PM,Weekday
LETS GO SHOPPING COTTON TOTE BAG,6,2.25,13.5,2011,February,Tuesday,2 PM,Weekday
LONDON BUS COFFEE MUG,6,2.55,15.3,2011,February,Tuesday,2 PM,Weekday
LUNCH BOX I LOVE LONDON,12,1.95,23.4,2011,February,Tuesday,2 PM,Weekday
MAGIC DRAWING SLATE DINOSAUR,24,0.42,10.08,2011,February,Tuesday,2 PM,Weekday
MAGIC DRAWING SLATE DOLLY GIRL,24,0.42,10.08,2011,February,Tuesday,2 PM,Weekday
MAGIC DRAWING SLATE LEAP FROG,24,0.42,10.08,2011,February,Tuesday,2 PM,Weekday
MAGIC DRAWING SLATE SPACEBOY,24,0.42,10.08,2011,February,Tuesday,2 PM,Weekday
MAGNETS PACK OF 4 HOME SWEET HOME,24,0.39,9.36,2011,February,Tuesday,2 PM,Weekday
MAGNETS PACK OF 4 RETRO PHOTO,24,0.39,9.36,2011,February,Tuesday,2 PM,Weekday
MAGNETS PACK OF 4 SWALLOWS,24,0.39,9.36,2011,February,Tuesday,2 PM,Weekday
MAGNETS PACK OF 4 VINTAGE LABELS,12,0.39,4.68,2011,February,Tuesday,2 PM,Weekday
MEMO BOARD COTTAGE DESIGN,4,4.95,19.8,2011,February,Tuesday,2 PM,Weekday
MEMO BOARD RETROSPOT  DESIGN,4,4.95,19.8,2011,February,Tuesday,2 PM,Weekday
METAL SIGN EMPIRE TEA,12,0.79,9.48,2011,February,Tuesday,2 PM,Weekday
METAL SIGN TAKE IT OR LEAVE IT,6,2.95,17.7,2011,February,Tuesday,2 PM,Weekday
MILK PAN BLUE POLKADOT,4,3.75,15.0,2011,February,Tuesday,2 PM,Weekday
MILK PAN RED RETROSPOT,4,3.75,15.0,2011,February,Tuesday,2 PM,Weekday
MONEY BOX CONFECTIONERY DESIGN,12,1.25,15.0,2011,February,Tuesday,2 PM,Weekday
MORE BUTTER METAL SIGN,12,0.79,9.48,2011,February,Tuesday,2 PM,Weekday
MOUSE TOY WITH PINK T-SHIRT,4,3.75,15.0,2011,February,Tuesday,2 PM,Weekday
MR ROBOT SOFT TOY,2,6.95,13.9,2011,February,Tuesday,2 PM,Weekday
OPEN CLOSED METAL SIGN,2,4.95,9.9,2011,February,Tuesday,2 PM,Weekday
ORIGAMI JASMINE INCENSE/CANDLE SET,24,0.85,20.4,2011,February,Tuesday,2 PM,Weekday
ORIGAMI VANILLA INCENSE/CANDLE SET,24,0.85,20.4,2011,February,Tuesday,2 PM,Weekday
PACK OF 12 COLOURED PENCILS,12,0.85,10.2,2011,February,Tuesday,2 PM,Weekday
PACK OF 12 LONDON TISSUES,24,0.39,9.36,2011,February,Tuesday,2 PM,Weekday
PACK OF 12 TRADITIONAL CRAYONS,24,0.42,10.08,2011,February,Tuesday,2 PM,Weekday
PACK OF 72 RETROSPOT CAKE CASES,24,0.55,13.2,2011,February,Tuesday,2 PM,Weekday
PAINTED METAL PEARS ASSORTED,8,1.69,13.52,2011,February,Tuesday,2 PM,Weekday
PANTRY MAGNETIC  SHOPPING LIST,12,1.45,17.4,2011,February,Tuesday,2 PM,Weekday
PAPERWEIGHT CHILDHOOD MEMORIES,6,2.55,15.3,2011,February,Tuesday,2 PM,Weekday
PAPERWEIGHT SAVE THE PLANET,6,2.55,15.3,2011,February,Tuesday,2 PM,Weekday
PAPERWEIGHT VINTAGE COLLAGE,6,2.55,15.3,2011,February,Tuesday,2 PM,Weekday
PENCIL CASE LIFE IS BEAUTIFUL,6,2.95,17.7,2011,February,Tuesday,2 PM,Weekday
PENS ASSORTED FUNKY JEWELED,36,0.19,6.84,2011,February,Tuesday,2 PM,Weekday
PENS ASSORTED FUNNY FACE,36,0.19,6.84,2011,February,Tuesday,2 PM,Weekday
PHARMACIE FIRST AID TIN,2,6.75,13.5,2011,February,Tuesday,2 PM,Weekday
PICNIC BOXES SET OF 3 RETROSPOT,4,4.95,19.8,2011,February,Tuesday,2 PM,Weekday
PINK FLOWER FABRIC PONY,4,3.75,15.0,2011,February,Tuesday,2 PM,Weekday
PINK HEART SHAPE EGG FRYING PAN,6,1.65,9.9,2011,February,Tuesday,2 PM,Weekday
PINK LOVE HEART SHAPE CUP,12,0.85,10.2,2011,February,Tuesday,2 PM,Weekday
PINK POLKADOT BOWL,8,1.25,10.0,2011,February,Tuesday,2 PM,Weekday
PINK VINTAGE SPOT BEAKER,8,0.85,6.8,2011,February,Tuesday,2 PM,Weekday
PLASTERS IN TIN CIRCUS PARADE,12,1.65,19.8,2011,February,Tuesday,2 PM,Weekday
PLASTERS IN TIN SPACEBOY,12,1.65,19.8,2011,February,Tuesday,2 PM,Weekday
PLASTERS IN TIN STRONGMAN,12,1.65,19.8,2011,February,Tuesday,2 PM,Weekday
PLASTERS IN TIN WOODLAND ANIMALS,12,1.65,19.8,2011,February,Tuesday,2 PM,Weekday
PLAYING CARDS VINTAGE DOILY,12,1.25,15.0,2011,February,Tuesday,2 PM,Weekday
POPPY'S PLAYHOUSE BATHROOM,6,2.1,12.6,2011,February,Tuesday,2 PM,Weekday
POPPY'S PLAYHOUSE BEDROOM,6,2.1,12.6,2011,February,Tuesday,2 PM,Weekday
POPPY'S PLAYHOUSE KITCHEN,6,2.1,12.6,2011,February,Tuesday,2 PM,Weekday
POPPY'S PLAYHOUSE LIVINGROOM,6,2.1,12.6,2011,February,Tuesday,2 PM,Weekday
QUEENS GUARD COFFEE MUG,6,2.55,15.3,2011,February,Tuesday,2 PM,Weekday
RED  HARMONICA IN BOX,12,1.25,15.0,2011,February,Tuesday,2 PM,Weekday
RED FLOCK LOVE HEART PHOTO FRAME,24,0.39,9.36,2011,February,Tuesday,2 PM,Weekday
RED GINGHAM TEDDY BEAR,6,2.95,17.7,2011,February,Tuesday,2 PM,Weekday
RED LOVE HEART SHAPE CUP,24,0.85,20.4,2011,February,Tuesday,2 PM,Weekday
RED RETROSPOT BOWL,8,1.25,10.0,2011,February,Tuesday,2 PM,Weekday
RED RETROSPOT CHARLOTTE BAG,10,0.85,8.5,2011,February,Tuesday,2 PM,Weekday
RED RETROSPOT CHILDRENS UMBRELLA,6,3.25,19.5,2011,February,Tuesday,2 PM,Weekday
RED RETROSPOT MINI CASES,2,7.95,15.9,2011,February,Tuesday,2 PM,Weekday
RED RETROSPOT MUG,6,2.95,17.7,2011,February,Tuesday,2 PM,Weekday
RED RETROSPOT PEG BAG,6,2.55,15.3,2011,February,Tuesday,2 PM,Weekday
RED RETROSPOT PLATE,8,1.69,13.52,2011,February,Tuesday,2 PM,Weekday
RED RETROSPOT PURSE,6,2.95,17.7,2011,February,Tuesday,2 PM,Weekday
RED RETROSPOT SHOPPER BAG,10,1.25,12.5,2011,February,Tuesday,2 PM,Weekday
RED RETROSPOT SHOPPING BAG,6,2.55,15.3,2011,February,Tuesday,2 PM,Weekday
RED RETROSPOT SMALL MILK JUG,6,2.55,15.3,2011,February,Tuesday,2 PM,Weekday
RED RETROSPOT SUGAR JAM BOWL,6,2.55,15.3,2011,February,Tuesday,2 PM,Weekday
RED SPOT PAPER GIFT BAG,10,0.82,8.2,2011,February,Tuesday,2 PM,Weekday
RED SPOTTY BISCUIT TIN,6,3.75,22.5,2011,February,Tuesday,2 PM,Weekday
RED VINTAGE SPOT BEAKER,8,0.85,6.8,2011,February,Tuesday,2 PM,Weekday
REGENCY CAKESTAND 3 TIER,2,12.75,25.5,2011,February,Tuesday,2 PM,Weekday
REGENCY SUGAR BOWL GREEN,4,4.15,16.6,2011,February,Tuesday,2 PM,Weekday
REGENCY TEA PLATE ROSES,12,1.65,19.8,2011,February,Tuesday,2 PM,Weekday
REGENCY TEAPOT ROSES,2,9.95,19.9,2011,February,Tuesday,2 PM,Weekday
RETROSPOT LAMP,4,9.95,39.8,2011,February,Tuesday,2 PM,Weekday
RETROSPOT LARGE MILK JUG,3,4.95,14.85,2011,February,Tuesday,2 PM,Weekday
RETROSPOT TEA SET CERAMIC 11 PC,3,4.95,14.85,2011,February,Tuesday,2 PM,Weekday
ROCKING HORSE RED CHRISTMAS,12,0.85,10.2,2011,February,Tuesday,2 PM,Weekday
ROUND CAKE TIN VINTAGE RED,2,7.95,15.9,2011,February,Tuesday,2 PM,Weekday
ROUND SNACK BOXES SET OF 4 FRUITS,6,2.95,17.7,2011,February,Tuesday,2 PM,Weekday
ROUND SNACK BOXES SET OF4 WOODLAND,6,2.95,17.7,2011,February,Tuesday,2 PM,Weekday
RUSTIC STRAWBERRY JAM POT SMALL,12,1.65,19.8,2011,February,Tuesday,2 PM,Weekday
S/4 PINK FLOWER CANDLES IN BOWL,12,1.65,19.8,2011,February,Tuesday,2 PM,Weekday
SAVE THE PLANET COTTON TOTE BAG,6,2.25,13.5,2011,February,Tuesday,2 PM,Weekday
SAVE THE PLANET MUG,12,1.65,19.8,2011,February,Tuesday,2 PM,Weekday
SET 12 COLOUR PENCILS DOLLY GIRL,16,0.65,10.4,2011,February,Tuesday,2 PM,Weekday
SET 12 COLOUR PENCILS LOVE LONDON,16,0.65,10.4,2011,February,Tuesday,2 PM,Weekday
SET 12 KIDS COLOUR  CHALK STICKS,24,0.42,10.08,2011,February,Tuesday,2 PM,Weekday
SET 12 RETRO WHITE CHALK STICKS,24,0.42,10.08,2011,February,Tuesday,2 PM,Weekday
SET 2 PANTRY DESIGN TEA TOWELS,6,3.25,19.5,2011,February,Tuesday,2 PM,Weekday
SET 2 TEA TOWELS I LOVE LONDON,6,3.25,19.5,2011,February,Tuesday,2 PM,Weekday
SET 6 FOOTBALL CELEBRATION CANDLES,12,1.25,15.0,2011,February,Tuesday,2 PM,Weekday
SET OF 10 LED DOLLY LIGHTS,2,6.25,12.5,2011,February,Tuesday,2 PM,Weekday
SET OF 2 CERAMIC CHRISTMAS TREES,12,1.45,17.4,2011,February,Tuesday,2 PM,Weekday
SET OF 2 CERAMIC PAINTED HEARTS,12,1.45,17.4,2011,February,Tuesday,2 PM,Weekday
SET OF 2 WOODEN MARKET CRATES,2,12.75,25.5,2011,February,Tuesday,2 PM,Weekday
SET OF 3 HANGING OWLS OLLIE BEAK,12,1.25,15.0,2011,February,Tuesday,2 PM,Weekday
SET OF 3 NOTEBOOKS IN PARCEL,24,1.65,39.6,2011,February,Tuesday,2 PM,Weekday
SET OF 3 REGENCY CAKE TINS,12,4.95,59.4,2011,February,Tuesday,2 PM,Weekday
SET OF 3 WOODEN HEART DECORATIONS,12,1.25,15.0,2011,February,Tuesday,2 PM,Weekday
SET OF 3 WOODEN STOCKING DECORATION,12,1.25,15.0,2011,February,Tuesday,2 PM,Weekday
SET OF 4 KNICK KNACK TINS LONDON,6,4.15,24.9,2011,February,Tuesday,2 PM,Weekday
SET OF 5 MINI GROCERY MAGNETS,12,2.08,24.96,2011,February,Tuesday,2 PM,Weekday
SET OF 5 PANCAKE DAY MAGNETS,24,2.08,49.92,2011,February,Tuesday,2 PM,Weekday
SET OF 6 3D KIT CARDS FOR KIDS,12,0.85,10.2,2011,February,Tuesday,2 PM,Weekday
SET OF 6 HALLOWEEN GHOST T-LIGHTS,36,0.42,15.12,2011,February,Tuesday,2 PM,Weekday
SET OF 6 HEART CHOPSTICKS,12,1.25,15.0,2011,February,Tuesday,2 PM,Weekday
SET OF 6 NATIVITY MAGNETS,12,2.08,24.96,2011,February,Tuesday,2 PM,Weekday
SET OF 6 SOLDIER SKITTLES,4,3.75,15.0,2011,February,Tuesday,2 PM,Weekday
SET OF 6 T-LIGHTS TOADSTOOLS,6,2.95,17.7,2011,February,Tuesday,2 PM,Weekday
SET OF 60 I LOVE LONDON CAKE CASES,24,0.55,13.2,2011,February,Tuesday,2 PM,Weekday
SET/10 PINK POLKADOT PARTY CANDLES,24,1.25,30.0,2011,February,Tuesday,2 PM,Weekday
SET/10 RED POLKADOT PARTY CANDLES,24,1.25,30.0,2011,February,Tuesday,2 PM,Weekday
SET/3 RED GINGHAM ROSE STORAGE BOX,4,3.75,15.0,2011,February,Tuesday,2 PM,Weekday
SET/4 BADGES BALLOON GIRL,10,1.25,12.5,2011,February,Tuesday,2 PM,Weekday
SET/4 RED MINI ROSE CANDLE IN BOWL,12,1.65,19.8,2011,February,Tuesday,2 PM,Weekday
SET/4 SKULL BADGES,10,1.25,12.5,2011,February,Tuesday,2 PM,Weekday
SET/5 RED RETROSPOT LID GLASS BOWLS,6,2.95,17.7,2011,February,Tuesday,2 PM,Weekday
SET/6 PINK BIRD T-LIGHT CANDLES,6,2.1,12.6,2011,February,Tuesday,2 PM,Weekday
SET3 BOOK BOX GREEN GINGHAM FLOWER,4,4.25,17.0,2011,February,Tuesday,2 PM,Weekday
SILK PURSE BABUSHKA PINK,6,3.35,20.1,2011,February,Tuesday,2 PM,Weekday
SKULL SHOULDER BAG,10,1.65,16.5,2011,February,Tuesday,2 PM,Weekday
SMALL RED RETROSPOT MUG IN BOX,6,3.75,22.5,2011,February,Tuesday,2 PM,Weekday
SMALL WHITE RETROSPOT MUG IN BOX,6,3.75,22.5,2011,February,Tuesday,2 PM,Weekday
SOLDIERS EGG CUP,24,1.25,30.0,2011,February,Tuesday,2 PM,Weekday
SPACEBOY BABY GIFT SET,3,16.95,50.85,2011,February,Tuesday,2 PM,Weekday
STORAGE TIN VINTAGE DOILY,6,2.89,17.34,2011,February,Tuesday,2 PM,Weekday
STRAWBERRY CERAMIC TRINKET BOX,24,1.25,30.0,2011,February,Tuesday,2 PM,Weekday
STRAWBERRY CHARLOTTE BAG,10,0.85,8.5,2011,February,Tuesday,2 PM,Weekday
STRAWBERRY SHOPPER BAG,10,1.25,12.5,2011,February,Tuesday,2 PM,Weekday
TEA BAG PLATE RED RETROSPOT,12,0.85,10.2,2011,February,Tuesday,2 PM,Weekday
TEA COSY RED  STRIPE,6,2.55,15.3,2011,February,Tuesday,2 PM,Weekday
THREE CANVAS LUGGAGE TAGS,8,1.95,15.6,2011,February,Tuesday,2 PM,Weekday
TOAST ITS - BEST MUM,12,1.25,15.0,2011,February,Tuesday,2 PM,Weekday
TOAST ITS - FAIRY FLOWER,12,1.25,15.0,2011,February,Tuesday,2 PM,Weekday
TOOL BOX SOFT TOY,1,8.95,8.95,2011,February,Tuesday,2 PM,Weekday
TOTE BAG I LOVE LONDON,12,2.1,25.2,2011,February,Tuesday,2 PM,Weekday
TRADITIONAL WOODEN SKIPPING ROPE,12,1.45,17.4,2011,February,Tuesday,2 PM,Weekday
TRAVEL CARD WALLET I LOVE LONDON,24,0.42,10.08,2011,February,Tuesday,2 PM,Weekday
TRAVEL CARD WALLET KEEP CALM,24,0.42,10.08,2011,February,Tuesday,2 PM,Weekday
TRAVEL CARD WALLET RETROSPOT,24,0.42,10.08,2011,February,Tuesday,2 PM,Weekday
TRAVEL CARD WALLET VINTAGE TICKET,24,0.42,10.08,2011,February,Tuesday,2 PM,Weekday
TREASURE TIN GYMKHANA DESIGN,6,2.08,12.48,2011,February,Tuesday,2 PM,Weekday
UNION JACK FLAG LUGGAGE TAG,12,1.25,15.0,2011,February,Tuesday,2 PM,Weekday
VINTAGE CHRISTMAS GIFT SACK,4,4.15,16.6,2011,February,Tuesday,2 PM,Weekday
VINTAGE CREAM DOG FOOD CONTAINER,2,8.5,17.0,2011,February,Tuesday,2 PM,Weekday
VINTAGE DOILY TRAVEL SEWING KIT,10,1.95,19.5,2011,February,Tuesday,2 PM,Weekday
WOODEN BOX OF DOMINOES,12,1.25,15.0,2011,February,Tuesday,2 PM,Weekday
WOODEN SCHOOL COLOURING SET,12,1.65,19.8,2011,February,Tuesday,2 PM,Weekday
WOODEN UNION JACK BUNTING,3,5.95,17.85,2011,February,Tuesday,2 PM,Weekday
WOODLAND CHARLOTTE BAG,10,0.85,8.5,2011,February,Tuesday,2 PM,Weekday
WOODLAND STORAGE BOX LARGE,6,2.95,17.7,2011,February,Tuesday,2 PM,Weekday
WORLD WAR 2 GLIDERS ASSTD DESIGNS,48,0.29,13.92,2011,February,Tuesday,2 PM,Weekday
WRAP CHRISTMAS VILLAGE,25,0.42,10.5,2011,February,Tuesday,2 PM,Weekday
WRAP PAISLEY PARK,25,0.42,10.5,2011,February,Tuesday,2 PM,Weekday
BOX OF VINTAGE ALPHABET BLOCKS,2,11.95,23.9,2011,February,Wednesday,11 AM,Weekday
EMBROIDERED RIBBON REEL REBECCA,6,2.89,17.34,2011,February,Wednesday,11 AM,Weekday
EMBROIDERED RIBBON REEL ROSIE,6,2.08,12.48,2011,February,Wednesday,11 AM,Weekday
MINI PLAYING CARDS BUFFALO BILL,20,0.42,8.4,2011,February,Wednesday,11 AM,Weekday
MINI PLAYING CARDS DOLLY GIRL,20,0.42,8.4,2011,February,Wednesday,11 AM,Weekday
MINI PLAYING CARDS FUN FAIR,20,0.42,8.4,2011,February,Wednesday,11 AM,Weekday
MINI PLAYING CARDS SPACEBOY,20,0.42,8.4,2011,February,Wednesday,11 AM,Weekday
PLAYING CARDS I LOVE LONDON,12,1.25,15.0,2011,February,Wednesday,11 AM,Weekday
PLAYING CARDS JUBILEE UNION JACK,12,1.25,15.0,2011,February,Wednesday,11 AM,Weekday
PLAYING CARDS VINTAGE DOILY,12,1.25,15.0,2011,February,Wednesday,11 AM,Weekday
SET 12 COLOUR PENCILS LOVE LONDON,16,0.65,10.4,2011,February,Wednesday,11 AM,Weekday
SET 12 COLOURING PENCILS DOILY,16,0.65,10.4,2011,February,Wednesday,11 AM,Weekday
POSTAGE,2,18.0,36.0,2011,February,Wednesday,12 PM,Weekday
STRAWBERRY CERAMIC TRINKET BOX,72,1.06,76.32,2011,February,Wednesday,12 PM,Weekday
CHILDRENS CUTLERY DOLLY GIRL,24,4.15,99.6,2011,February,Wednesday,12 PM,Weekday
CHILDRENS CUTLERY SPACEBOY,24,4.15,99.6,2011,February,Wednesday,12 PM,Weekday
DOLLY GIRL CHILDRENS BOWL,8,1.25,10.0,2011,February,Wednesday,12 PM,Weekday
DOLLY GIRL CHILDRENS CUP,8,1.25,10.0,2011,February,Wednesday,12 PM,Weekday
GUMBALL COAT RACK,12,2.55,30.6,2011,February,Wednesday,12 PM,Weekday
POSTAGE,1,18.0,18.0,2011,February,Wednesday,12 PM,Weekday
SPACEBOY CHILDRENS BOWL,8,1.25,10.0,2011,February,Wednesday,12 PM,Weekday
SPACEBOY CHILDRENS CUP,8,1.25,10.0,2011,February,Wednesday,12 PM,Weekday
STRAWBERRY LUNCH BOX WITH CUTLERY,6,2.55,15.3,2011,February,Wednesday,12 PM,Weekday
BOX OF VINTAGE ALPHABET BLOCKS,4,11.95,47.8,2011,February,Wednesday,2 PM,Weekday
CHARLOTTE BAG SUKI DESIGN,10,0.85,8.5,2011,February,Wednesday,2 PM,Weekday
DOLLY GIRL MINI BACKPACK,4,4.15,16.6,2011,February,Wednesday,2 PM,Weekday
JUMBO BAG APPLES,10,2.08,20.8,2011,February,Wednesday,2 PM,Weekday
JUMBO BAG RED RETROSPOT,20,2.08,41.6,2011,February,Wednesday,2 PM,Weekday
JUMBO BAG VINTAGE LEAF,10,2.08,20.8,2011,February,Wednesday,2 PM,Weekday
JUMBO BAG WOODLAND ANIMALS,10,2.08,20.8,2011,February,Wednesday,2 PM,Weekday
JUMBO STORAGE BAG SUKI,10,2.08,20.8,2011,February,Wednesday,2 PM,Weekday
LUNCH BAG APPLE DESIGN,10,1.65,16.5,2011,February,Wednesday,2 PM,Weekday
LUNCH BAG RED RETROSPOT,10,1.65,16.5,2011,February,Wednesday,2 PM,Weekday
PAPER BUNTING RETROSPOT,6,2.95,17.7,2011,February,Wednesday,2 PM,Weekday
PLASTERS IN TIN WOODLAND ANIMALS,12,1.65,19.8,2011,February,Wednesday,2 PM,Weekday
POPPY'S PLAYHOUSE BEDROOM,6,2.1,12.6,2011,February,Wednesday,2 PM,Weekday
POSTAGE,2,18.0,36.0,2011,February,Wednesday,2 PM,Weekday
RECYCLING BAG RETROSPOT,5,2.1,10.5,2011,February,Wednesday,2 PM,Weekday
RED RETROSPOT CHARLOTTE BAG,10,0.85,8.5,2011,February,Wednesday,2 PM,Weekday
RED RETROSPOT PICNIC BAG,5,2.95,14.75,2011,February,Wednesday,2 PM,Weekday
RED RETROSPOT SHOPPING BAG,12,2.55,30.6,2011,February,Wednesday,2 PM,Weekday
RED TOADSTOOL LED NIGHT LIGHT,24,1.65,39.6,2011,February,Wednesday,2 PM,Weekday
ROLL WRAP VINTAGE SPOT,12,1.25,15.0,2011,February,Wednesday,2 PM,Weekday
SPACEBOY MINI BACKPACK,4,4.15,16.6,2011,February,Wednesday,2 PM,Weekday
STARS GIFT TAPE,12,0.65,7.8,2011,February,Wednesday,2 PM,Weekday
WHITE SPOT RED CERAMIC DRAWER KNOB,12,1.45,17.4,2011,February,Wednesday,2 PM,Weekday
DOLLY GIRL MINI BACKPACK,16,4.15,66.4,2011,February,Wednesday,2 PM,Weekday
POPCORN HOLDER,12,0.85,10.2,2011,February,Wednesday,2 PM,Weekday
POSTAGE,1,18.0,18.0,2011,February,Wednesday,2 PM,Weekday
RED RETROSPOT CHARLOTTE BAG,24,0.85,20.4,2011,February,Wednesday,2 PM,Weekday
SPACEBOY MINI BACKPACK,32,4.15,132.8,2011,February,Wednesday,2 PM,Weekday
WOODLAND MINI BACKPACK,16,4.15,66.4,2011,February,Wednesday,2 PM,Weekday
AIRLINE BAG VINTAGE JET SET RED,8,4.25,34.0,2011,February,Thursday,8 AM,Weekday
AIRLINE BAG VINTAGE WORLD CHAMPION,12,3.95,47.4,2011,February,Thursday,8 AM,Weekday
ALARM CLOCK BAKELIKE CHOCOLATE,8,3.75,30.0,2011,February,Thursday,8 AM,Weekday
ALARM CLOCK BAKELIKE GREEN,4,3.75,15.0,2011,February,Thursday,8 AM,Weekday
ALARM CLOCK BAKELIKE RED,12,3.75,45.0,2011,February,Thursday,8 AM,Weekday
COSY SLIPPER SHOES SMALL GREEN,6,2.95,17.7,2011,February,Thursday,8 AM,Weekday
FAIRY CAKE FLANNEL ASSORTED COLOUR,18,0.79,14.22,2011,February,Thursday,8 AM,Weekday
ICE CREAM PEN LIP GLOSS,24,1.25,30.0,2011,February,Thursday,8 AM,Weekday
JUMBO BAG PINK POLKADOT,10,2.08,20.8,2011,February,Thursday,8 AM,Weekday
JUMBO BAG RED RETROSPOT,10,2.08,20.8,2011,February,Thursday,8 AM,Weekday
JUMBO BAG WOODLAND ANIMALS,10,2.08,20.8,2011,February,Thursday,8 AM,Weekday
POSTAGE,2,18.0,36.0,2011,February,Thursday,8 AM,Weekday
ALARM CLOCK BAKELIKE CHOCOLATE,4,3.75,15.0,2011,February,Friday,2 PM,Weekday
ALARM CLOCK BAKELIKE PINK,4,3.75,15.0,2011,February,Friday,2 PM,Weekday
BOX OF 6 CHRISTMAS CAKE DECORATIONS,4,3.75,15.0,2011,February,Friday,2 PM,Weekday
DOLLY GIRL BABY GIFT SET,1,16.95,16.95,2011,February,Friday,2 PM,Weekday
DOLLY GIRL MINI BACKPACK,4,4.15,16.6,2011,February,Friday,2 PM,Weekday
JUMBO BAG 50'S CHRISTMAS,10,2.08,20.8,2011,February,Friday,2 PM,Weekday
JUMBO BAG APPLES,10,2.08,20.8,2011,February,Friday,2 PM,Weekday
JUMBO BAG PEARS,10,2.08,20.8,2011,February,Friday,2 PM,Weekday
JUMBO BAG PINK POLKADOT,10,2.08,20.8,2011,February,Friday,2 PM,Weekday
JUMBO BAG PINK VINTAGE PAISLEY,10,2.08,20.8,2011,February,Friday,2 PM,Weekday
JUMBO BAG RED RETROSPOT,10,2.08,20.8,2011,February,Friday,2 PM,Weekday
JUMBO BAG VINTAGE DOILY,10,2.08,20.8,2011,February,Friday,2 PM,Weekday
JUMBO BAG WOODLAND ANIMALS,10,2.08,20.8,2011,February,Friday,2 PM,Weekday
LUNCH BAG APPLE DESIGN,10,1.65,16.5,2011,February,Friday,2 PM,Weekday
LUNCH BAG DOLLY GIRL DESIGN,10,1.65,16.5,2011,February,Friday,2 PM,Weekday
LUNCH BAG PINK POLKADOT,10,1.65,16.5,2011,February,Friday,2 PM,Weekday
LUNCH BAG RED RETROSPOT,10,1.65,16.5,2011,February,Friday,2 PM,Weekday
LUNCH BAG SPACEBOY DESIGN,10,1.65,16.5,2011,February,Friday,2 PM,Weekday
LUNCH BAG SUKI DESIGN,10,1.65,16.5,2011,February,Friday,2 PM,Weekday
LUNCH BAG VINTAGE DOILY,10,1.65,16.5,2011,February,Friday,2 PM,Weekday
LUNCH BAG WOODLAND,10,1.65,16.5,2011,February,Friday,2 PM,Weekday
PIGGY BANK RETROSPOT,4,2.55,10.2,2011,February,Friday,2 PM,Weekday
POSTAGE,2,18.0,36.0,2011,February,Friday,2 PM,Weekday
SET 12 COLOUR PENCILS DOLLY GIRL,16,0.65,10.4,2011,February,Friday,2 PM,Weekday
SET 12 COLOUR PENCILS SPACEBOY,16,0.65,10.4,2011,February,Friday,2 PM,Weekday
SPACEBOY BABY GIFT SET,1,16.95,16.95,2011,February,Friday,2 PM,Weekday
VINTAGE DOILY TRAVEL SEWING KIT,10,1.95,19.5,2011,February,Friday,2 PM,Weekday
WOODLAND MINI BACKPACK,8,4.15,33.2,2011,February,Friday,2 PM,Weekday
FAWN BLUE HOT WATER BOTTLE,36,3.39,122.04,2011,February,Wednesday,1 PM,Weekday
I LOVE LONDON BABY GIFT SET,24,14.95,358.8,2011,February,Wednesday,1 PM,Weekday
LONDON BUS COFFEE MUG,12,2.55,30.6,2011,February,Wednesday,1 PM,Weekday
MINI PAINT SET VINTAGE,72,0.65,46.8,2011,February,Wednesday,1 PM,Weekday
PLASTERS IN TIN SKULLS,48,1.65,79.2,2011,February,Wednesday,1 PM,Weekday
PLASTERS IN TIN STRONGMAN,48,1.65,79.2,2011,February,Wednesday,1 PM,Weekday
RED RETROSPOT BUTTER DISH,18,4.25,76.5,2011,February,Wednesday,1 PM,Weekday
RED RETROSPOT SMALL MILK JUG,12,2.55,30.6,2011,February,Wednesday,1 PM,Weekday
RED RETROSPOT SUGAR JAM BOWL,12,2.55,30.6,2011,February,Wednesday,1 PM,Weekday
RED RETROSPOT UMBRELLA,96,4.95,475.2,2011,February,Wednesday,1 PM,Weekday
RED WOOLLY HOTTIE WHITE HEART.,48,3.75,180.0,2011,February,Wednesday,1 PM,Weekday
REGENCY CAKESTAND 3 TIER,32,10.95,350.4,2011,February,Wednesday,1 PM,Weekday
RETROSPOT LARGE MILK JUG,12,4.25,51.0,2011,February,Wednesday,1 PM,Weekday
RETROSPOT TEA SET CERAMIC 11 PC,48,4.25,204.0,2011,February,Wednesday,1 PM,Weekday
SOLDIERS EGG CUP,24,1.25,30.0,2011,February,Wednesday,1 PM,Weekday
SPACEBOY BABY GIFT SET,24,14.95,358.8,2011,February,Wednesday,1 PM,Weekday
ALARM CLOCK BAKELIKE CHOCOLATE,4,3.75,15.0,2011,February,Wednesday,4 PM,Weekday
ALARM CLOCK BAKELIKE GREEN,4,3.75,15.0,2011,February,Wednesday,4 PM,Weekday
ALARM CLOCK BAKELIKE PINK,4,3.75,15.0,2011,February,Wednesday,4 PM,Weekday
ALARM CLOCK BAKELIKE RED,4,3.75,15.0,2011,February,Wednesday,4 PM,Weekday
BAKING SET 9 PIECE RETROSPOT,3,4.95,14.85,2011,February,Wednesday,4 PM,Weekday
BLUE VINTAGE SPOT BEAKER,8,0.85,6.8,2011,February,Wednesday,4 PM,Weekday
BOTTLE BAG RETROSPOT,5,2.1,10.5,2011,February,Wednesday,4 PM,Weekday
JUMBO BAG 50'S CHRISTMAS,10,2.08,20.8,2011,February,Wednesday,4 PM,Weekday
JUMBO BAG DOLLY GIRL DESIGN,10,2.08,20.8,2011,February,Wednesday,4 PM,Weekday
PENS ASSORTED FUNKY JEWELED,36,0.19,6.84,2011,February,Wednesday,4 PM,Weekday
PENS ASSORTED FUNNY FACE,36,0.19,6.84,2011,February,Wednesday,4 PM,Weekday
PINK VINTAGE SPOT BEAKER,8,0.85,6.8,2011,February,Wednesday,4 PM,Weekday
POSTAGE,2,18.0,36.0,2011,February,Wednesday,4 PM,Weekday
RED RETROSPOT CAKE STAND,2,10.95,21.9,2011,February,Wednesday,4 PM,Weekday
RED RETROSPOT UMBRELLA,3,5.95,17.85,2011,February,Wednesday,4 PM,Weekday
SET OF 12 MINI LOAF BAKING CASES,8,0.83,6.64,2011,February,Wednesday,4 PM,Weekday
SET OF 4 KNICK KNACK TINS DOILY,6,4.15,24.9,2011,February,Wednesday,4 PM,Weekday
SET OF 6 TEA TIME BAKING CASES,8,1.25,10.0,2011,February,Wednesday,4 PM,Weekday
SET/5 RED RETROSPOT LID GLASS BOWLS,6,2.95,17.7,2011,February,Wednesday,4 PM,Weekday
BISCUIT TIN VINTAGE RED,2,6.75,13.5,2011,February,Thursday,2 PM,Weekday
BLUE PARTY BAGS,6,2.1,12.6,2011,February,Thursday,2 PM,Weekday
CAKES AND RABBITS DESIGN FLANNEL,12,0.85,10.2,2011,February,Thursday,2 PM,Weekday
CHILDRENS TOY COOKING UTENSIL SET,6,2.08,12.48,2011,February,Thursday,2 PM,Weekday
CHILDS BREAKFAST SET CIRCUS PARADE,8,7.65,61.2,2011,February,Thursday,2 PM,Weekday
CIRCUS PARADE LUNCH BOX,12,1.95,23.4,2011,February,Thursday,2 PM,Weekday
CLASSIC GLASS COOKIE JAR,6,4.15,24.9,2011,February,Thursday,2 PM,Weekday
DOLLY GIRL LUNCH BOX,12,1.95,23.4,2011,February,Thursday,2 PM,Weekday
ICE CREAM BUBBLES,20,0.83,16.6,2011,February,Thursday,2 PM,Weekday
LUNCH BOX WITH CUTLERY RETROSPOT,6,2.55,15.3,2011,February,Thursday,2 PM,Weekday
MULTICOLOUR HONEYCOMB FAN,12,0.39,4.68,2011,February,Thursday,2 PM,Weekday
PACK OF 20 SKULL PAPER NAPKINS,12,0.85,10.2,2011,February,Thursday,2 PM,Weekday
PACK OF 6 SKULL PAPER CUPS,12,0.65,7.8,2011,February,Thursday,2 PM,Weekday
PACK OF 6 SKULL PAPER PLATES,12,0.85,10.2,2011,February,Thursday,2 PM,Weekday
PARTY TIME DESIGN FLANNEL,12,0.85,10.2,2011,February,Thursday,2 PM,Weekday
PASTEL COLOUR HONEYCOMB FAN,12,0.39,4.68,2011,February,Thursday,2 PM,Weekday
POSTAGE,6,18.0,108.0,2011,February,Thursday,2 PM,Weekday
RED KITCHEN SCALES,2,8.5,17.0,2011,February,Thursday,2 PM,Weekday
REGENCY CAKESTAND 3 TIER,16,10.95,175.2,2011,February,Thursday,2 PM,Weekday
RUSTIC STRAWBERRY JAM POT SMALL,48,1.45,69.6,2011,February,Thursday,2 PM,Weekday
SET 6 FOOTBALL CELEBRATION CANDLES,12,1.25,15.0,2011,February,Thursday,2 PM,Weekday
SET OF 20 KIDS COOKIE CUTTERS,12,2.1,25.2,2011,February,Thursday,2 PM,Weekday
SET OF 3 REGENCY CAKE TINS,4,4.95,19.8,2011,February,Thursday,2 PM,Weekday
SET OF 5 MINI GROCERY MAGNETS,12,2.08,24.96,2011,February,Thursday,2 PM,Weekday
SET OF 5 PANCAKE DAY MAGNETS,12,2.08,24.96,2011,February,Thursday,2 PM,Weekday
SET OF 6 CAKE CHOPSTICKS,12,1.25,15.0,2011,February,Thursday,2 PM,Weekday
SET OF 6 HEART CHOPSTICKS,12,1.25,15.0,2011,February,Thursday,2 PM,Weekday
SET OF 6 STRAWBERRY CHOPSTICKS,12,1.25,15.0,2011,February,Thursday,2 PM,Weekday
SET/10 BLUE POLKADOT PARTY CANDLES,24,1.25,30.0,2011,February,Thursday,2 PM,Weekday
SET/10 IVORY POLKADOT PARTY CANDLES,24,1.25,30.0,2011,February,Thursday,2 PM,Weekday
SET/10 PINK POLKADOT PARTY CANDLES,48,1.25,60.0,2011,February,Thursday,2 PM,Weekday
SET/10 RED POLKADOT PARTY CANDLES,48,1.25,60.0,2011,February,Thursday,2 PM,Weekday
SET/20 RED RETROSPOT PAPER NAPKINS,12,0.85,10.2,2011,February,Thursday,2 PM,Weekday
SET/6 RED SPOTTY PAPER CUPS,12,0.65,7.8,2011,February,Thursday,2 PM,Weekday
SET/6 RED SPOTTY PAPER PLATES,12,0.85,10.2,2011,February,Thursday,2 PM,Weekday
STORAGE TIN VINTAGE DOILY,6,2.89,17.34,2011,February,Thursday,2 PM,Weekday
STRAWBERRY LUNCH BOX WITH CUTLERY,6,2.55,15.3,2011,February,Thursday,2 PM,Weekday
VINTAGE RED ENAMEL TRIM JUG,4,3.75,15.0,2011,February,Thursday,2 PM,Weekday
VINTAGE RED TRIM ENAMEL BOWL,12,1.25,15.0,2011,February,Thursday,2 PM,Weekday
ANGEL DECORATION STARS ON DRESS,48,0.42,20.16,2011,February,Thursday,9 AM,Weekday
BOTANICAL GARDENS WALL CLOCK,1,25.0,25.0,2011,February,Thursday,9 AM,Weekday
EMBROIDERED RIBBON REEL EMILY,6,2.08,12.48,2011,February,Thursday,9 AM,Weekday
EMBROIDERED RIBBON REEL ROSIE,6,2.08,12.48,2011,February,Thursday,9 AM,Weekday
FAWN BLUE HOT WATER BOTTLE,6,3.75,22.5,2011,February,Thursday,9 AM,Weekday
HEART WREATH DECORATION WITH BELL,12,1.25,15.0,2011,February,Thursday,9 AM,Weekday
