Description,Quantity,UnitPrice,Revenue,Year,Month,DayOfWeek,Hour,Weekday
6 EGG HOUSE PAINTED WOOD,1,7.95,7.95,2011,August,Sunday,1 PM,Weekend
6 RIBBONS ELEGANT CHRISTMAS,1,1.65,1.65,2011,August,Sunday,1 PM,Weekend
6 RIBBONS SHIMMERING PINKS,6,1.65,9.9,2011,August,Sunday,1 PM,Weekend
ASSTD DESIGN 3D PAPER STICKERS,60,0.85,51.0,2011,August,Sunday,1 PM,Weekend
ASSTD DESIGN RACING CAR PEN,16,1.69,27.04,2011,August,Sunday,1 PM,Weekend
BABY BOOM RIBBONS,6,1.25,7.5,2011,August,Sunday,1 PM,Weekend
BAKING MOULD CHOCOLATE CUPCAKES,6,2.55,15.3,2011,August,Sunday,1 PM,Weekend
BAKING MOULD HEART WHITE CHOCOLATE,3,2.55,7.65,2011,August,Sunday,1 PM,Weekend
BAKING MOULD TOFFEE CUP CHOCOLATE,3,2.55,7.65,2011,August,Sunday,1 PM,Weekend
BALLOONS  WRITING SET,6,1.65,9.9,2011,August,Sunday,1 PM,Weekend
BLACK CANDELABRA T-LIGHT HOLDER,5,0.65,3.25,2011,August,Sunday,1 PM,Weekend
BLUE HAPPY BIRTHDAY BUNTING,4,5.45,21.8,2011,August,Sunday,1 PM,Weekend
BLUE POLKADOT WRAP,25,0.42,10.5,2011,August,Sunday,1 PM,Weekend
BUBBLEGUM RING ASSORTED,36,0.42,15.12,2011,August,Sunday,1 PM,Weekend
BULL DOG BOTTLE OPENER,2,4.95,9.9,2011,August,Sunday,1 PM,Weekend
CANDLEHOLDER PINK HANGING HEART,3,2.95,8.85,2011,August,Sunday,1 PM,Weekend
CARD HOLDER GINGHAM HEART,3,2.89,8.67,2011,August,Sunday,1 PM,Weekend
CERAMIC HEART FAIRY CAKE MONEY BANK,4,1.45,5.8,2011,August,Sunday,1 PM,Weekend
CHARLOTTE BAG SUKI DESIGN,6,0.85,5.1,2011,August,Sunday,1 PM,Weekend
CHILDRENS APRON SPACEBOY DESIGN,4,1.95,7.8,2011,August,Sunday,1 PM,Weekend
CHOCOLATE BOX RIBBONS,1,1.25,1.25,2011,August,Sunday,1 PM,Weekend
CHOCOLATE BOX RIBBONS,5,1.25,6.25,2011,August,Sunday,1 PM,Weekend
COLUMBIAN  CUBE CANDLE,2,0.85,1.7,2011,August,Sunday,1 PM,Weekend
COLUMBIAN CANDLE RECTANGLE,1,1.95,1.95,2011,August,Sunday,1 PM,Weekend
COLUMBIAN CANDLE RECTANGLE,1,1.95,1.95,2011,August,Sunday,1 PM,Weekend
COLUMBIAN CUBE CANDLE,2,1.95,3.9,2011,August,Sunday,1 PM,Weekend
COTTON APRON PANTRY DESIGN,6,4.95,29.7,2011,August,Sunday,1 PM,Weekend
CREAM HEART CARD HOLDER,2,3.95,7.9,2011,August,Sunday,1 PM,Weekend
CUPCAKE LACE PAPER SET 6,12,1.95,23.4,2011,August,Sunday,1 PM,Weekend
DINOSAUR HEIGHT CHART STICKER SET,6,2.95,17.7,2011,August,Sunday,1 PM,Weekend
DINOSAUR LUNCH BOX WITH CUTLERY,6,2.55,15.3,2011,August,Sunday,1 PM,Weekend
DINOSAURS  WRITING SET,6,1.65,9.9,2011,August,Sunday,1 PM,Weekend
DOLLY MIXTURE CHILDREN'S UMBRELLA,2,3.25,6.5,2011,August,Sunday,1 PM,Weekend
ENAMEL MEASURING JUG CREAM,3,4.25,12.75,2011,August,Sunday,1 PM,Weekend
"FEATHER PEN,HOT PINK",12,0.39,4.68,2011,August,Sunday,1 PM,Weekend
"FEATHER PEN,LIGHT PINK",12,0.39,4.68,2011,August,Sunday,1 PM,Weekend
FELTCRAFT CHRISTMAS FAIRY,6,4.25,25.5,2011,August,Sunday,1 PM,Weekend
FLORAL FOLK STATIONERY SET,3,1.25,3.75,2011,August,Sunday,1 PM,Weekend
FLOWER FAIRY 5 DRAWER LINERS,4,2.55,10.2,2011,August,Sunday,1 PM,Weekend
GINGERBREAD MAN COOKIE CUTTER,2,1.25,2.5,2011,August,Sunday,1 PM,Weekend
GIRAFFE WOODEN RULER,6,1.95,11.7,2011,August,Sunday,1 PM,Weekend
GROW A FLYTRAP OR SUNFLOWER IN TIN,24,1.25,30.0,2011,August,Sunday,1 PM,Weekend
ICE CREAM SUNDAE LIP GLOSS,24,1.25,30.0,2011,August,Sunday,1 PM,Weekend
JAZZ HEARTS PURSE NOTEBOOK,6,0.39,2.34,2011,August,Sunday,1 PM,Weekend
JUMBO BAG TOYS,6,2.08,12.48,2011,August,Sunday,1 PM,Weekend
LARGE HEART MEASURING SPOONS,2,1.65,3.3,2011,August,Sunday,1 PM,Weekend
LUNCH BAG  BLACK SKULL.,4,1.65,6.6,2011,August,Sunday,1 PM,Weekend
LUNCH BAG CARS BLUE,3,1.65,4.95,2011,August,Sunday,1 PM,Weekend
LUNCH BAG PINK POLKADOT,4,1.65,6.6,2011,August,Sunday,1 PM,Weekend
LUNCH BAG SPACEBOY DESIGN,3,1.65,4.95,2011,August,Sunday,1 PM,Weekend
LUNCH BAG SUKI DESIGN,6,1.65,9.9,2011,August,Sunday,1 PM,Weekend
MAKE YOUR OWN FLOWERPOWER CARD KIT,4,2.95,11.8,2011,August,Sunday,1 PM,Weekend
MAKE YOUR OWN PLAYTIME CARD KIT,4,2.95,11.8,2011,August,Sunday,1 PM,Weekend
MEMO BOARD COTTAGE DESIGN,3,4.95,14.85,2011,August,Sunday,1 PM,Weekend
MEMO BOARD RETROSPOT  DESIGN,4,4.95,19.8,2011,August,Sunday,1 PM,Weekend
OVERNIGHT BAG VINTAGE ROSE PAISLEY,3,4.95,14.85,2011,August,Sunday,1 PM,Weekend
OVERNIGHT BAG VINTAGE ROSE PAISLEY,2,4.95,9.9,2011,August,Sunday,1 PM,Weekend
PANTRY MAGNETIC  SHOPPING LIST,2,1.45,2.9,2011,August,Sunday,1 PM,Weekend
PAPER BUNTING RETROSPOT,2,2.95,5.9,2011,August,Sunday,1 PM,Weekend
PAPER CHAIN KIT RETROSPOT,6,2.95,17.7,2011,August,Sunday,1 PM,Weekend
PARTY BUNTING,3,4.95,14.85,2011,August,Sunday,1 PM,Weekend
PARTY INVITES DINOSAURS,8,0.85,6.8,2011,August,Sunday,1 PM,Weekend
PARTY INVITES JAZZ HEARTS,6,0.85,5.1,2011,August,Sunday,1 PM,Weekend
PINK BLUE FELT CRAFT TRINKET BOX,6,1.25,7.5,2011,August,Sunday,1 PM,Weekend
PINK FAIRY CAKE CHILDRENS APRON,4,1.95,7.8,2011,August,Sunday,1 PM,Weekend
PINK FLORAL FELTCRAFT SHOULDER BAG,4,3.75,15.0,2011,August,Sunday,1 PM,Weekend
PINK HAPPY BIRTHDAY BUNTING,4,5.45,21.8,2011,August,Sunday,1 PM,Weekend
PINK POLKADOT WRAP,25,0.42,10.5,2011,August,Sunday,1 PM,Weekend
POPCORN HOLDER,18,0.85,15.3,2011,August,Sunday,1 PM,Weekend
REVOLVER WOODEN RULER,6,1.95,11.7,2011,August,Sunday,1 PM,Weekend
ROSE SCENT CANDLE IN JEWELLED BOX,3,4.25,12.75,2011,August,Sunday,1 PM,Weekend
ROSE SCENT CANDLE JEWELLED DRAWER,3,4.25,12.75,2011,August,Sunday,1 PM,Weekend
SCANDINAVIAN REDS RIBBONS,1,1.25,1.25,2011,August,Sunday,1 PM,Weekend
SET 2 PANTRY DESIGN TEA TOWELS,6,3.25,19.5,2011,August,Sunday,1 PM,Weekend
SET 7 BABUSHKA NESTING BOXES,1,8.5,8.5,2011,August,Sunday,1 PM,Weekend
SET OF 20 KIDS COOKIE CUTTERS,6,2.1,12.6,2011,August,Sunday,1 PM,Weekend
SET OF 3 BUTTERFLY COOKIE CUTTERS,5,1.25,6.25,2011,August,Sunday,1 PM,Weekend
SET OF 3 CAKE TINS PANTRY DESIGN,2,4.95,9.9,2011,August,Sunday,1 PM,Weekend
SET OF 3 HEART COOKIE CUTTERS,6,1.25,7.5,2011,August,Sunday,1 PM,Weekend
SET OF 36 DINOSAUR PAPER DOILIES,5,1.45,7.25,2011,August,Sunday,1 PM,Weekend
SET OF 36 DOILIES PANTRY DESIGN,6,1.45,8.7,2011,August,Sunday,1 PM,Weekend
SET OF 36 DOILIES SPACEBOY DESIGN,3,1.45,4.35,2011,August,Sunday,1 PM,Weekend
SET OF 36 TEATIME PAPER DOILIES,6,1.45,8.7,2011,August,Sunday,1 PM,Weekend
SET OF 4 PANTRY JELLY MOULDS,6,1.25,7.5,2011,August,Sunday,1 PM,Weekend
SET OF 6 GIRLS CELEBRATION CANDLES,6,1.25,7.5,2011,August,Sunday,1 PM,Weekend
SET OF 72 SKULL PAPER  DOILIES,3,1.45,4.35,2011,August,Sunday,1 PM,Weekend
SET/10 BLUE POLKADOT PARTY CANDLES,24,1.25,30.0,2011,August,Sunday,1 PM,Weekend
SET/10 PINK POLKADOT PARTY CANDLES,24,1.25,30.0,2011,August,Sunday,1 PM,Weekend
SET/3 ROSE CANDLE IN JEWELLED BOX,3,4.25,12.75,2011,August,Sunday,1 PM,Weekend
SET/6 PINK  BUTTERFLY T-LIGHTS,4,2.1,8.4,2011,August,Sunday,1 PM,Weekend
SET/6 PURPLE BUTTERFLY T-LIGHTS,5,2.1,10.5,2011,August,Sunday,1 PM,Weekend
SKULLS  WATER TRANSFER TATTOOS,10,0.85,8.5,2011,August,Sunday,1 PM,Weekend
SMALL CHOCOLATES PINK BOWL,8,0.42,3.36,2011,August,Sunday,1 PM,Weekend
SMALL DOLLY MIX DESIGN ORANGE BOWL,16,0.42,6.72,2011,August,Sunday,1 PM,Weekend
SMALL MARSHMALLOWS PINK BOWL,16,0.42,6.72,2011,August,Sunday,1 PM,Weekend
SPACEBOY LUNCH BOX,3,1.95,5.85,2011,August,Sunday,1 PM,Weekend
SPOTTY BUNTING,3,4.95,14.85,2011,August,Sunday,1 PM,Weekend
TEA TIME DES TEA COSY,1,2.55,2.55,2011,August,Sunday,1 PM,Weekend
TEA TIME DES TEA COSY,1,2.55,2.55,2011,August,Sunday,1 PM,Weekend
TEA TIME KITCHEN APRON,5,5.95,29.75,2011,August,Sunday,1 PM,Weekend
TEA TIME OVEN GLOVE,1,1.25,1.25,2011,August,Sunday,1 PM,Weekend
TEA TIME OVEN GLOVE,3,1.25,3.75,2011,August,Sunday,1 PM,Weekend
TEA TIME PARTY BUNTING,3,4.95,14.85,2011,August,Sunday,1 PM,Weekend
TOAST ITS - FAIRY FLOWER,6,1.25,7.5,2011,August,Sunday,1 PM,Weekend
TOAST ITS - HAPPY BIRTHDAY,6,1.25,7.5,2011,August,Sunday,1 PM,Weekend
TOY TIDY SPACEBOY,1,2.1,2.1,2011,August,Sunday,1 PM,Weekend
TRADITIONAL CHRISTMAS RIBBONS,1,1.25,1.25,2011,August,Sunday,1 PM,Weekend
VANILLA INCENSE IN TIN,6,0.38,2.28,2011,August,Sunday,1 PM,Weekend
VINTAGE PAISLEY STATIONERY SET,3,1.25,3.75,2011,August,Sunday,1 PM,Weekend
VINTAGE UNION JACK APRON,1,6.95,6.95,2011,August,Sunday,1 PM,Weekend
VINTAGE UNION JACK DOORSTOP,1,5.95,5.95,2011,August,Sunday,1 PM,Weekend
VINTAGE UNION JACK MEMOBOARD,1,9.95,9.95,2011,August,Sunday,1 PM,Weekend
VINTAGE UNION JACK SHOPPING BAG,1,4.95,4.95,2011,August,Sunday,1 PM,Weekend
WASH BAG VINTAGE ROSE PAISLEY,2,2.55,5.1,2011,August,Sunday,1 PM,Weekend
WOOD STAMP SET BEST WISHES,3,0.83,2.49,2011,August,Sunday,1 PM,Weekend
WOOD STAMP SET HAPPY BIRTHDAY,3,0.83,2.49,2011,August,Sunday,1 PM,Weekend
WOODEN FRAME ANTIQUE WHITE,2,2.95,5.9,2011,August,Sunday,1 PM,Weekend
WOODEN PICTURE FRAME WHITE FINISH,2,2.55,5.1,2011,August,Sunday,1 PM,Weekend
WORLD WAR 2 GLIDERS ASSTD DESIGNS,48,0.29,13.92,2011,August,Sunday,1 PM,Weekend
POSTAGE,5,28.0,140.0,2011,August,Wednesday,9 AM,Weekday
DECORATIVE CATS BATHROOM BOTTLE,6,1.25,7.5,2011,August,Wednesday,3 PM,Weekday
HOMEMADE JAM SCENTED CANDLES,12,1.45,17.4,2011,August,Wednesday,3 PM,Weekday
RED RETROSPOT ROUND CAKE TINS,1,9.95,9.95,2011,August,Wednesday,3 PM,Weekday
REGENCY MILK JUG PINK,1,3.25,3.25,2011,August,Wednesday,3 PM,Weekday
REGENCY SUGAR BOWL GREEN,1,4.15,4.15,2011,August,Wednesday,3 PM,Weekday
REGENCY TEA PLATE GREEN,2,1.65,3.3,2011,August,Wednesday,3 PM,Weekday
REGENCY TEA PLATE PINK,2,1.65,3.3,2011,August,Wednesday,3 PM,Weekday
REGENCY TEA PLATE ROSES,2,1.65,3.3,2011,August,Wednesday,3 PM,Weekday
REGENCY TEAPOT ROSES,4,9.95,39.8,2011,August,Wednesday,3 PM,Weekday
REX CASH+CARRY JUMBO SHOPPER,1,0.95,0.95,2011,August,Wednesday,3 PM,Weekday
ROSES REGENCY TEACUP AND SAUCER,4,2.95,11.8,2011,August,Wednesday,3 PM,Weekday
"SET 3 RETROSPOT TEA,COFFEE,SUGAR",1,4.95,4.95,2011,August,Wednesday,3 PM,Weekday
VICTORIAN  METAL POSTCARD SPRING,2,1.69,3.38,2011,August,Wednesday,3 PM,Weekday
VICTORIAN  METAL POSTCARD SPRING,8,1.69,13.52,2011,August,Wednesday,3 PM,Weekday
WHITE HANGING HEART T-LIGHT HOLDER,2,2.95,5.9,2011,August,Wednesday,3 PM,Weekday
WHITE SOAP RACK WITH 2 BOTTLES,1,5.95,5.95,2011,August,Wednesday,3 PM,Weekday
ADULT APRON APPLE DELIGHT,4,4.95,19.8,2011,September,Monday,11 AM,Weekday
ALARM CLOCK BAKELIKE CHOCOLATE,4,3.75,15.0,2011,September,Monday,11 AM,Weekday
BLACK/BLUE POLKADOT UMBRELLA,3,5.95,17.85,2011,September,Monday,11 AM,Weekday
BREAD BIN DINER STYLE RED,2,16.95,33.9,2011,September,Monday,11 AM,Weekday
CAKE STAND LOVEBIRD 2 TIER WHITE,2,9.95,19.9,2011,September,Monday,11 AM,Weekday
CAKE STAND WHITE TWO TIER LACE,4,8.5,34.0,2011,September,Monday,11 AM,Weekday
COTTON APRON PANTRY DESIGN,2,4.95,9.9,2011,September,Monday,11 AM,Weekday
DOORMAT HEARTS,2,8.25,16.5,2011,September,Monday,11 AM,Weekday
DOORMAT NEW ENGLAND,2,8.25,16.5,2011,September,Monday,11 AM,Weekday
DOORMAT RED RETROSPOT,2,8.25,16.5,2011,September,Monday,11 AM,Weekday
DOORMAT SPOTTY HOME SWEET HOME,2,8.25,16.5,2011,September,Monday,11 AM,Weekday
DOORMAT WELCOME PUPPIES,2,8.25,16.5,2011,September,Monday,11 AM,Weekday
DOORMAT WELCOME SUNRISE,2,8.25,16.5,2011,September,Monday,11 AM,Weekday
DOORMAT WELCOME TO OUR HOME,2,8.25,16.5,2011,September,Monday,11 AM,Weekday
FUNKY DIVA PEN,48,0.85,40.8,2011,September,Monday,11 AM,Weekday
GREEN REGENCY TEACUP AND SAUCER,6,2.95,17.7,2011,September,Monday,11 AM,Weekday
GREEN VINTAGE EARRINGS,4,3.75,15.0,2011,September,Monday,11 AM,Weekday
IVORY ENCHANTED FOREST PLACEMAT,12,1.65,19.8,2011,September,Monday,11 AM,Weekday
JADE DROP EARRINGS W FILIGREE,3,4.95,14.85,2011,September,Monday,11 AM,Weekday
JUMBO BAG RED RETROSPOT,10,2.08,20.8,2011,September,Monday,11 AM,Weekday
LARGE HEART MEASURING SPOONS,12,1.65,19.8,2011,September,Monday,11 AM,Weekday
LOVE HOT WATER BOTTLE,3,5.95,17.85,2011,September,Monday,11 AM,Weekday
LUNCH BAG SUKI DESIGN,10,1.65,16.5,2011,September,Monday,11 AM,Weekday
PARISIENNE JEWELLERY DRAWER,2,7.5,15.0,2011,September,Monday,11 AM,Weekday
PARISIENNE SEWING BOX,4,12.5,50.0,2011,September,Monday,11 AM,Weekday
PINK REGENCY TEACUP AND SAUCER,6,2.95,17.7,2011,September,Monday,11 AM,Weekday
POSTAGE,7,28.0,196.0,2011,September,Monday,11 AM,Weekday
RED ENCHANTED FOREST PLACEMAT,12,1.65,19.8,2011,September,Monday,11 AM,Weekday
RED GINGHAM ROSE JEWELLERY BOX,8,1.95,15.6,2011,September,Monday,11 AM,Weekday
RED REFECTORY CLOCK,2,9.95,19.9,2011,September,Monday,11 AM,Weekday
RED RETROSPOT CHILDRENS UMBRELLA,6,3.25,19.5,2011,September,Monday,11 AM,Weekday
RED RETROSPOT UMBRELLA,3,5.95,17.85,2011,September,Monday,11 AM,Weekday
REGENCY CAKESTAND 3 TIER,16,10.95,175.2,2011,September,Monday,11 AM,Weekday
RETROSPOT CHILDRENS APRON,8,1.95,15.6,2011,September,Monday,11 AM,Weekday
RETROSPOT TEA SET CERAMIC 11 PC,3,4.95,14.85,2011,September,Monday,11 AM,Weekday
ROSES REGENCY TEACUP AND SAUCER,6,2.95,17.7,2011,September,Monday,11 AM,Weekday
SET OF 3 REGENCY CAKE TINS,4,4.95,19.8,2011,September,Monday,11 AM,Weekday
SILVER HOOP EARRINGS WITH FLOWER,2,5.95,11.9,2011,September,Monday,11 AM,Weekday
SWEETHEART WIRE FRUIT BOWL,2,8.5,17.0,2011,September,Monday,11 AM,Weekday
ALARM CLOCK BAKELIKE RED,4,3.75,15.0,2011,September,Thursday,1 PM,Weekday
BREAD BIN DINER STYLE IVORY,1,16.95,16.95,2011,September,Thursday,1 PM,Weekday
BREAD BIN DINER STYLE PINK,1,16.95,16.95,2011,September,Thursday,1 PM,Weekday
BREAD BIN DINER STYLE RED,1,16.95,16.95,2011,September,Thursday,1 PM,Weekday
BROWN CHECK CAT DOORSTOP,3,4.25,12.75,2011,September,Thursday,1 PM,Weekday
CHRISTMAS CRAFT LITTLE FRIENDS,6,2.1,12.6,2011,September,Thursday,1 PM,Weekday
COLOUR GLASS T-LIGHT HOLDER HANGING,16,0.65,10.4,2011,September,Thursday,1 PM,Weekday
DOORMAT SPOTTY HOME SWEET HOME,2,8.25,16.5,2011,September,Thursday,1 PM,Weekday
HANGING QUILTED PATCHWORK APPLES,12,0.83,9.96,2011,September,Thursday,1 PM,Weekday
HOME SWEET HOME MUG,12,1.65,19.8,2011,September,Thursday,1 PM,Weekday
HOMEMADE JAM SCENTED CANDLES,24,1.45,34.8,2011,September,Thursday,1 PM,Weekday
ICE CREAM SUNDAE LIP GLOSS,24,1.25,30.0,2011,September,Thursday,1 PM,Weekday
PENNY FARTHING BIRTHDAY CARD,12,0.42,5.04,2011,September,Thursday,1 PM,Weekday
POSTAGE,2,28.0,56.0,2011,September,Thursday,1 PM,Weekday
REGENCY CAKESTAND 3 TIER,1,12.75,12.75,2011,September,Thursday,1 PM,Weekday
ROUND SNACK BOXES SET OF4 WOODLAND,6,2.95,17.7,2011,September,Thursday,1 PM,Weekday
SET OF 3 BUTTERFLY COOKIE CUTTERS,12,1.45,17.4,2011,September,Thursday,1 PM,Weekday
SET OF 3 HANGING OWLS OLLIE BEAK,24,1.25,30.0,2011,September,Thursday,1 PM,Weekday
SET OF 4 JAM JAR MAGNETS,12,2.08,24.96,2011,September,Thursday,1 PM,Weekday
SKETCHBOOK MAGNETIC SHOPPING LIST,24,1.45,34.8,2011,September,Thursday,1 PM,Weekday
SMALL HANGING IVORY/RED WOOD BIRD,24,0.42,10.08,2011,September,Thursday,1 PM,Weekday
SOAP DISH BROCANTE,8,2.95,23.6,2011,September,Thursday,1 PM,Weekday
STAR WREATH DECORATION WITH BELL,12,1.25,15.0,2011,September,Thursday,1 PM,Weekday
6 RIBBONS RUSTIC CHARM,12,1.95,23.4,2011,September,Monday,3 PM,Weekday
ASSORTED COLOUR BIRD ORNAMENT,48,1.69,81.12,2011,September,Monday,3 PM,Weekday
BLUE OWL SOFT TOY,12,2.95,35.4,2011,September,Monday,3 PM,Weekday
BLUE SPOT CERAMIC DRAWER KNOB,12,1.45,17.4,2011,September,Monday,3 PM,Weekday
BLUE STRIPE CERAMIC DRAWER KNOB,12,1.45,17.4,2011,September,Monday,3 PM,Weekday
CARD GINGHAM ROSE,12,0.42,5.04,2011,September,Monday,3 PM,Weekday
GREEN METAL BOX ARMY SUPPLIES,2,8.25,16.5,2011,September,Monday,3 PM,Weekday
HANGING QUILTED PATCHWORK APPLES,24,0.83,19.92,2011,September,Monday,3 PM,Weekday
HOME BUILDING BLOCK WORD,9,6.25,56.25,2011,September,Monday,3 PM,Weekday
HOME SWEET HOME CUSHION COVER,8,3.75,30.0,2011,September,Monday,3 PM,Weekday
HOME SWEET HOME METAL SIGN,6,2.95,17.7,2011,September,Monday,3 PM,Weekday
ICE CREAM BUBBLES,20,0.83,16.6,2011,September,Monday,3 PM,Weekday
JUNGLE POPSICLES ICE LOLLY MOULDS,12,1.25,15.0,2011,September,Monday,3 PM,Weekday
OPEN CLOSED METAL SIGN,8,4.95,39.6,2011,September,Monday,3 PM,Weekday
PACK OF 6 BIRDY GIFT TAGS,24,1.25,30.0,2011,September,Monday,3 PM,Weekday
PACK OF 72 RETROSPOT CAKE CASES,24,0.55,13.2,2011,September,Monday,3 PM,Weekday
PACK OF 72 SKULL CAKE CASES,24,0.55,13.2,2011,September,Monday,3 PM,Weekday
PARTY METAL SIGN,12,1.45,17.4,2011,September,Monday,3 PM,Weekday
PLASTERS IN TIN CIRCUS PARADE,24,1.65,39.6,2011,September,Monday,3 PM,Weekday
PLASTERS IN TIN SKULLS,24,1.65,39.6,2011,September,Monday,3 PM,Weekday
POSTAGE,4,28.0,112.0,2011,September,Monday,3 PM,Weekday
PRETTY HANGING QUILTED HEARTS,36,0.83,29.88,2011,September,Monday,3 PM,Weekday
RED METAL BOX TOP SECRET,2,8.25,16.5,2011,September,Monday,3 PM,Weekday
RED SPOT CERAMIC DRAWER KNOB,12,1.45,17.4,2011,September,Monday,3 PM,Weekday
RED STRIPE CERAMIC DRAWER KNOB,12,1.45,17.4,2011,September,Monday,3 PM,Weekday
ROUND CONTAINER SET OF 5 RETROSPOT,12,1.65,19.8,2011,September,Monday,3 PM,Weekday
SET OF 36 DOILIES PANTRY DESIGN,12,1.45,17.4,2011,September,Monday,3 PM,Weekday
SET OF 4 KNICK KNACK TINS DOILY,12,4.15,49.8,2011,September,Monday,3 PM,Weekday
SET OF 60 PANTRY DESIGN CAKE CASES,24,0.55,13.2,2011,September,Monday,3 PM,Weekday
SET OF 72 RETROSPOT PAPER  DOILIES,12,1.45,17.4,2011,September,Monday,3 PM,Weekday
TOADSTOOL BEDSIDE LIGHT,2,8.95,17.9,2011,September,Monday,3 PM,Weekday
TREASURE TIN BUFFALO BILL,12,2.08,24.96,2011,September,Monday,3 PM,Weekday
TREASURE TIN GYMKHANA DESIGN,12,2.08,24.96,2011,September,Monday,3 PM,Weekday
WHITE SPOT BLUE CERAMIC DRAWER KNOB,12,1.45,17.4,2011,September,Monday,3 PM,Weekday
WHITE SPOT RED CERAMIC DRAWER KNOB,12,1.45,17.4,2011,September,Monday,3 PM,Weekday
WORLD WAR 2 GLIDERS ASSTD DESIGNS,48,0.29,13.92,2011,September,Monday,3 PM,Weekday
6 RIBBONS RUSTIC CHARM,12,1.95,23.4,2011,September,Wednesday,2 PM,Weekday
CARD BILLBOARD FONT,12,0.42,5.04,2011,September,Wednesday,2 PM,Weekday
CARD DOLLY GIRL,12,0.42,5.04,2011,September,Wednesday,2 PM,Weekday
CARD PSYCHEDELIC APPLES,12,0.42,5.04,2011,September,Wednesday,2 PM,Weekday
CHARLOTTE BAG DOLLY GIRL DESIGN,10,0.85,8.5,2011,September,Wednesday,2 PM,Weekday
CIRCUS PARADE LUNCH BOX,12,1.95,23.4,2011,September,Wednesday,2 PM,Weekday
DOLLY GIRL LUNCH BOX,12,1.95,23.4,2011,September,Wednesday,2 PM,Weekday
DOORMAT ENGLISH ROSE,4,8.25,33.0,2011,September,Wednesday,2 PM,Weekday
DOORMAT FANCY FONT HOME SWEET HOME,2,8.25,16.5,2011,September,Wednesday,2 PM,Weekday
DOORMAT SPOTTY HOME SWEET HOME,2,8.25,16.5,2011,September,Wednesday,2 PM,Weekday
EDWARDIAN PARASOL NATURAL,3,5.95,17.85,2011,September,Wednesday,2 PM,Weekday
ENVELOPE 50 BLOSSOM IMAGES,12,0.42,5.04,2011,September,Wednesday,2 PM,Weekday
FAIRY CAKE BIRTHDAY CANDLE SET,4,3.75,15.0,2011,September,Wednesday,2 PM,Weekday
FAIRY CAKE DESIGN UMBRELLA,4,3.75,15.0,2011,September,Wednesday,2 PM,Weekday
FOUR HOOK  WHITE LOVEBIRDS,6,2.1,12.6,2011,September,Wednesday,2 PM,Weekday
JAM MAKING SET PRINTED,12,1.45,17.4,2011,September,Wednesday,2 PM,Weekday
JAM MAKING SET WITH JARS,6,4.25,25.5,2011,September,Wednesday,2 PM,Weekday
JUMBO BAG VINTAGE DOILY,10,2.08,20.8,2011,September,Wednesday,2 PM,Weekday
JUMBO BAG WOODLAND ANIMALS,10,2.08,20.8,2011,September,Wednesday,2 PM,Weekday
LUNCH BAG PINK POLKADOT,10,1.65,16.5,2011,September,Wednesday,2 PM,Weekday
MAGNETS PACK OF 4 SWALLOWS,12,0.39,4.68,2011,September,Wednesday,2 PM,Weekday
PACK OF 12 PINK PAISLEY TISSUES,24,0.39,9.36,2011,September,Wednesday,2 PM,Weekday
PACK OF 12 WOODLAND TISSUES,24,0.39,9.36,2011,September,Wednesday,2 PM,Weekday
PANTRY MAGNETIC  SHOPPING LIST,12,1.45,17.4,2011,September,Wednesday,2 PM,Weekday
PAPERWEIGHT CHILDHOOD MEMORIES,6,2.55,15.3,2011,September,Wednesday,2 PM,Weekday
PAPERWEIGHT SAVE THE PLANET,6,2.55,15.3,2011,September,Wednesday,2 PM,Weekday
PARTY BUNTING,4,4.95,19.8,2011,September,Wednesday,2 PM,Weekday
PARTY METAL SIGN,12,1.45,17.4,2011,September,Wednesday,2 PM,Weekday
PINK BABY BUNTING,5,2.95,14.75,2011,September,Wednesday,2 PM,Weekday
PINK LOVE BIRD CANDLE,12,1.25,15.0,2011,September,Wednesday,2 PM,Weekday
PINK NEW BAROQUECANDLESTICK CANDLE,24,0.85,20.4,2011,September,Wednesday,2 PM,Weekday
PLASTERS IN TIN STRONGMAN,12,1.65,19.8,2011,September,Wednesday,2 PM,Weekday
PLASTERS IN TIN WOODLAND ANIMALS,12,1.65,19.8,2011,September,Wednesday,2 PM,Weekday
POSTAGE,5,28.0,140.0,2011,September,Wednesday,2 PM,Weekday
RED RETROSPOT TAPE,12,0.65,7.8,2011,September,Wednesday,2 PM,Weekday
RED RETROSPOT UMBRELLA,3,5.95,17.85,2011,September,Wednesday,2 PM,Weekday
ROBOT BIRTHDAY CARD,12,0.42,5.04,2011,September,Wednesday,2 PM,Weekday
ROUND SNACK BOXES SET OF4 WOODLAND,6,2.95,17.7,2011,September,Wednesday,2 PM,Weekday
SET OF 10 LED DOLLY LIGHTS,2,6.25,12.5,2011,September,Wednesday,2 PM,Weekday
SET OF 12 FAIRY CAKE BAKING CASES,8,0.83,6.64,2011,September,Wednesday,2 PM,Weekday
SET OF 2 TINS VINTAGE BATHROOM,4,4.25,17.0,2011,September,Wednesday,2 PM,Weekday
SET OF 6 TEA TIME BAKING CASES,8,1.25,10.0,2011,September,Wednesday,2 PM,Weekday
SET OF 72 PINK HEART PAPER DOILIES,12,1.45,17.4,2011,September,Wednesday,2 PM,Weekday
SET OF 72 RETROSPOT PAPER  DOILIES,12,1.45,17.4,2011,September,Wednesday,2 PM,Weekday
SET OF TEA COFFEE SUGAR TINS PANTRY,4,4.95,19.8,2011,September,Wednesday,2 PM,Weekday
SET/6 COLLAGE PAPER CUPS,24,0.19,4.56,2011,September,Wednesday,2 PM,Weekday
SET/6 COLLAGE PAPER PLATES,12,0.39,4.68,2011,September,Wednesday,2 PM,Weekday
SPOTTY BUNTING,3,4.95,14.85,2011,September,Wednesday,2 PM,Weekday
STRAWBERRY LUNCH BOX WITH CUTLERY,6,2.55,15.3,2011,September,Wednesday,2 PM,Weekday
TEA TIME KITCHEN APRON,3,5.95,17.85,2011,September,Wednesday,2 PM,Weekday
TRAVEL SEWING KIT,10,1.65,16.5,2011,September,Wednesday,2 PM,Weekday
VICTORIAN SEWING KIT,12,1.25,15.0,2011,September,Wednesday,2 PM,Weekday
VINTAGE UNION JACK APRON,3,6.95,20.85,2011,September,Wednesday,2 PM,Weekday
WHITE WOOD GARDEN PLANT LADDER,1,9.95,9.95,2011,September,Wednesday,2 PM,Weekday
WRAP  VINTAGE DOILY,25,0.42,10.5,2011,September,Wednesday,2 PM,Weekday
WRAP DOLLY GIRL,25,0.42,10.5,2011,September,Wednesday,2 PM,Weekday
WRAP ENGLISH ROSE,25,0.42,10.5,2011,September,Wednesday,2 PM,Weekday
3 STRIPEY MICE FELTCRAFT,6,1.95,11.7,2011,September,Friday,9 AM,Weekday
36 PENCILS TUBE RED RETROSPOT,16,1.25,20.0,2011,September,Friday,9 AM,Weekday
36 PENCILS TUBE WOODLAND,16,1.25,20.0,2011,September,Friday,9 AM,Weekday
6 GIFT TAGS 50'S CHRISTMAS,12,0.83,9.96,2011,September,Friday,9 AM,Weekday
6 GIFT TAGS VINTAGE CHRISTMAS,12,0.83,9.96,2011,September,Friday,9 AM,Weekday
BALLOONS  WRITING SET,12,1.65,19.8,2011,September,Friday,9 AM,Weekday
BOX OF VINTAGE ALPHABET BLOCKS,2,11.95,23.9,2011,September,Friday,9 AM,Weekday
CHRISTMAS CRAFT LITTLE FRIENDS,12,2.1,25.2,2011,September,Friday,9 AM,Weekday
CHRISTMAS CRAFT TREE TOP ANGEL,6,2.1,12.6,2011,September,Friday,9 AM,Weekday
CHRISTMAS CRAFT WHITE FAIRY,12,1.45,17.4,2011,September,Friday,9 AM,Weekday
CHRISTMAS GINGHAM STAR,12,0.85,10.2,2011,September,Friday,9 AM,Weekday
CHRISTMAS RETROSPOT ANGEL WOOD,12,0.85,10.2,2011,September,Friday,9 AM,Weekday
DINOSAURS  WRITING SET,12,1.65,19.8,2011,September,Friday,9 AM,Weekday
FELTCRAFT 6 FLOWER FRIENDS,6,2.1,12.6,2011,September,Friday,9 AM,Weekday
FELTCRAFT CHRISTMAS FAIRY,4,4.25,17.0,2011,September,Friday,9 AM,Weekday
FELTCRAFT DOLL MOLLY,6,2.95,17.7,2011,September,Friday,9 AM,Weekday
FELTCRAFT PRINCESS LOLA DOLL,4,3.75,15.0,2011,September,Friday,9 AM,Weekday
GREEN BIRDHOUSE DECORATION,12,0.85,10.2,2011,September,Friday,9 AM,Weekday
HANGING WOOD AND FELT FLOWER,96,0.12,11.52,2011,September,Friday,9 AM,Weekday
HAPPY STENCIL CRAFT,12,1.25,15.0,2011,September,Friday,9 AM,Weekday
HOLIDAY FUN LUDO,4,3.75,15.0,2011,September,Friday,9 AM,Weekday
MAKE YOUR OWN MONSOON CARD KIT,6,2.95,17.7,2011,September,Friday,9 AM,Weekday
MAKE YOUR OWN PLAYTIME CARD KIT,6,2.95,17.7,2011,September,Friday,9 AM,Weekday
MEMO BOARD COTTAGE DESIGN,4,4.95,19.8,2011,September,Friday,9 AM,Weekday
PACK OF 6 HANDBAG GIFT BOXES,6,2.55,15.3,2011,September,Friday,9 AM,Weekday
PAPER CHAIN KIT 50'S CHRISTMAS,6,2.95,17.7,2011,September,Friday,9 AM,Weekday
PAPER CHAIN KIT RETROSPOT,6,2.95,17.7,2011,September,Friday,9 AM,Weekday
POPPY'S PLAYHOUSE BEDROOM,6,2.1,12.6,2011,September,Friday,9 AM,Weekday
POPPY'S PLAYHOUSE KITCHEN,6,2.1,12.6,2011,September,Friday,9 AM,Weekday
POSTAGE,3,28.0,84.0,2011,September,Friday,9 AM,Weekday
RED FLORAL FELTCRAFT SHOULDER BAG,4,3.75,15.0,2011,September,Friday,9 AM,Weekday
RETROSPOT TEA SET CERAMIC 11 PC,6,4.95,29.7,2011,September,Friday,9 AM,Weekday
ROCKING HORSE RED CHRISTMAS,12,0.85,10.2,2011,September,Friday,9 AM,Weekday
ROUND SNACK BOXES SET OF4 WOODLAND,6,2.95,17.7,2011,September,Friday,9 AM,Weekday
SET OF 3 HANGING OWLS OLLIE BEAK,12,1.25,15.0,2011,September,Friday,9 AM,Weekday
SET OF 3 WOODEN HEART DECORATIONS,12,1.25,15.0,2011,September,Friday,9 AM,Weekday
SET OF 3 WOODEN STOCKING DECORATION,12,1.25,15.0,2011,September,Friday,9 AM,Weekday
SET OF 6 3D KIT CARDS FOR KIDS,12,0.85,10.2,2011,September,Friday,9 AM,Weekday
STAR WOODEN CHRISTMAS DECORATION,12,0.85,10.2,2011,September,Friday,9 AM,Weekday
WOOD STAMP SET BEST WISHES,12,0.83,9.96,2011,September,Friday,9 AM,Weekday
WOODEN HAPPY BIRTHDAY GARLAND,6,2.95,17.7,2011,September,Friday,9 AM,Weekday
WOODEN STAR CHRISTMAS SCANDINAVIAN,12,0.85,10.2,2011,September,Friday,9 AM,Weekday
WOODEN TREE CHRISTMAS SCANDINAVIAN,12,0.85,10.2,2011,September,Friday,9 AM,Weekday
WOODLAND  HEIGHT CHART STICKERS,6,2.95,17.7,2011,September,Friday,9 AM,Weekday
WOODLAND MINI BACKPACK,4,4.15,16.6,2011,September,Friday,9 AM,Weekday
FRIDGE MAGNETS US DINER ASSORTED,24,0.85,20.4,2011,September,Friday,11 AM,Weekday
POSTAGE,1,28.0,28.0,2011,September,Friday,11 AM,Weekday
SET OF 4 JAM JAR MAGNETS,12,2.08,24.96,2011,September,Friday,11 AM,Weekday
SET OF 5 LUCKY CAT MAGNETS,12,2.08,24.96,2011,September,Friday,11 AM,Weekday
SET OF 5 MINI GROCERY MAGNETS,12,2.08,24.96,2011,September,Friday,11 AM,Weekday
SPOTTY BUNTING,24,4.95,118.8,2011,September,Friday,11 AM,Weekday
WHITE HANGING HEART T-LIGHT HOLDER,12,2.95,35.4,2011,September,Friday,11 AM,Weekday
36 DOILIES DOLLY GIRL,12,1.45,17.4,2011,September,Sunday,1 PM,Weekend
CAKE PLATE LOVEBIRD PINK,3,4.95,14.85,2011,September,Sunday,1 PM,Weekend
CAKE PLATE LOVEBIRD WHITE,3,4.95,14.85,2011,September,Sunday,1 PM,Weekend
CAKE STAND LOVEBIRD 2 TIER PINK,2,9.95,19.9,2011,September,Sunday,1 PM,Weekend
CAKE STAND WHITE TWO TIER LACE,2,8.5,17.0,2011,September,Sunday,1 PM,Weekend
DOORMAT FAIRY CAKE,2,8.25,16.5,2011,September,Sunday,1 PM,Weekend
